Ain't She Sweet,Die Ultimative Chartshow - Flower Power,The Beatles,131.6ø
The Vanishing Race,Johnny Cash Sings The Ballads Of The American Indian:  Bitter Tears,Johnny Cash,249.1ø
As Long As The Grass Shall Grow,Unearthed,Johnny Cash,262.3ø
Time Is On My Side,12 x 5,The Rolling Stones,172.7ø
Now I've Got A Witness (Like Uncle Phil And Uncle Gene),England's Newest Hit Makers,The Rolling Stones,151.8ø
If You Need Me,Singles 1963-1965,The Rolling Stones,122.9ø
Around And Around,12 x 5,The Rolling Stones,183.2ø