Baby Change Your Mind,A Quiet Storm,The Main Ingredient,203.6ø
You Gotta Have Love In Your Heart,Motown Chartbusters Vol.7,The Supremes | Four Tops,169.4ø
Let's Make Love Now,Magnificent: The Complete Studio Duets,The Supremes | Four Tops,199.4ø
I'm Glad About It,Magnificent: The Complete Studio Duets,The Supremes | Four Tops,198.0ø
I'll Try Not To Cry,Magnificent: The Complete Studio Duets,The Supremes | Four Tops,166.5ø
I Wonder Where We're Going,Magnificent: The Complete Studio Duets,The Supremes | Four Tops,181.5ø