Desperate Dan,The Greatest Hits,Lieutenant Pigeon,169.1ø
A Meditation Mass Part 4,A Meditation Mass,Yatha Sidhra,436.9ø
A Meditation Mass Part 2,A Meditation Mass,Yatha Sidhra,179.7ø
Trip Wire,Blow Up Presents Exclusive Blend Volume 2,N. Ingman,173.5ø
Down Home,Bite Harder: The Music De Wolfe Studio Sampler_ Vol. 2,Nick Ingman,179.4ø
Who Is He And What Is He To You,True Funk [3 CD Set],Creative Source,210.6ø
Willpower (Album Version),Sweet Charlie Babe,Jackie Moore,176.5ø
Willpower,Precious_ Precious [Digital 45],Jackie Moore,175.3ø
Time (Album Version),Sweet Charlie Babe,Jackie Moore,208.9ø
Sweet Charlie Babe (Album Version),Sweet Charlie Babe,Jackie Moore,157.0ø
Something in a Look (Album Version),Sweet Charlie Babe,Jackie Moore,190.4ø
Precious_ Precious (Album Version),Sweet Charlie Babe,Jackie Moore,205.0ø
If (Album Version),Sweet Charlie Babe,Jackie Moore,212.0ø
Darling Baby (Darling Baby),Sweet Charlie Babe,Jackie Moore,160.9ø
Cover Me (Album Version),Sweet Charlie Babe,Jackie Moore,163.6ø
Cover Me,Time / Cover Me [Digital 45],Jackie Moore,164.1ø
Clean Up Your Own Yard (Album Version),Sweet Charlie Babe,Jackie Moore,257.3ø
Both Ends Against the Middle (Album Version),Sweet Charlie Babe,Jackie Moore,152.0ø
Your Memories Comin' On,Satin Sheets,Jeanne Pruett,156.0ø
What My Thoughts Do All The Time,Satin Sheets,Jeanne Pruett,160.1ø
Walking Piece Of Heaven,Satin Sheets,Jeanne Pruett,123.1ø
Satin Sheets,True Country,Jeanne Pruett,194.8ø
I Forgot More (Than You'll Ever Know About Him),Satin Sheets,Jeanne Pruett,146.9ø
Hold To My Unchanging Love,Satin Sheets,Jeanne Pruett,107.8ø
Darling,Satin Sheets,Jeanne Pruett,134.9ø
Break My Mind,Satin Sheets,Jeanne Pruett,126.0ø
Wait A Lifetime (LP Version),Bite Down Hard,Jo Jo Gunne,209.0ø
Turn The Boy Loose (LP Version),Jumpin' The Gunne,Jo Jo Gunne,268.5ø
To The Island (LP Version),Jumpin' The Gunne,Jo Jo Gunne,228.6ø
Take Me Down Easy (LP Version),Bite Down Hard,Jo Jo Gunne,323.8ø
Special Situations (LP Version),Bite Down Hard,Jo Jo Gunne,285.4ø
Roll Over Me (LP Version),Bite Down Hard,Jo Jo Gunne,208.5ø
Rock Around The Symbol (LP Version),Bite Down Hard,Jo Jo Gunne,144.0ø
Rhoda (LP Version),Bite Down Hard,Jo Jo Gunne,285.0ø
Red Meat (LP Version),Jumpin' The Gunne,Jo Jo Gunne,207.3ø
Ready Freddy (LP Version),Bite Down Hard,Jo Jo Gunne,241.4ø
Neon City (LP Version),Jumpin' The Gunne,Jo Jo Gunne,158.8ø
Monkey Music (LP Version),Jumpin' The Gunne,Jo Jo Gunne,204.6ø
I Wanna Love You (LP Version),Jumpin' The Gunne,Jo Jo Gunne,230.2ø
High School Drool (LP Version),Jumpin' The Gunne,Jo Jo Gunne,215.1ø
Getaway (LP Version),Jumpin' The Gunne,Jo Jo Gunne,211.4ø
Couldn't Love You Better (LP Version),Jumpin' The Gunne,Jo Jo Gunne,180.2ø
Broken Down Man (LP Version),Bite Down Hard,Jo Jo Gunne,226.9ø
Before You Get Your Breakfast (LP Version),Jumpin' The Gunne,Jo Jo Gunne,252.4ø
At The Spa (LP Version),Jumpin' The Gunne,Jo Jo Gunne,174.9ø
When the Stars Begin to Fall,On Radio - Volume 4,Blue Sky Boys,127.5ø
Little Bessie,Classic Country Remastered: Charlotte_ NC - Rock Hills_ SC 1937_ 1938 (CD B),The Blue Sky Boys,190.3ø
New World Coming,Imaginational Anthem_ Vol. 2,Billy Faier,445.8ø
Wufferton Frog (LP Version),There's An Innocent Face,Curt Boetcher,249.4ø
The Choice Is Yours (LP Version),There's An Innocent Face,Curt Boetcher,129.8ø
Such A Lady (LP Version),There's An Innocent Face,Curt Boetcher,125.9ø
She'll Stay With You (LP Version),There's An Innocent Face,Curt Boetcher,142.4ø
Malachi Star (LP Version),There's An Innocent Face,Curt Boetcher,170.3ø
Love You Yes I Do (LP Version),There's An Innocent Face,Curt Boetcher,197.7ø
Lay Down (LP Version),There's An Innocent Face,Curt Boetcher,204.5ø
I've Been Wrong (LP Version),There's An Innocent Face,Curt Boetcher,218.3ø
I Love You More Each Day (LP Version),There's An Innocent Face,Curt Boetcher,160.3ø
Bobby California (LP Version),There's An Innocent Face,Curt Boetcher,280.9ø
We Are Your Children Too,Watch,Seatrain,222.0ø
Watching The River Flow,Watch,Seatrain,203.3ø
Scratch,Watch,Seatrain,225.1ø
Pack Of Fools,Watch,Seatrain,275.6ø
North Coast,Watch,Seatrain,263.4ø
Freedom Is The Reason,Watch,Seatrain,255.5ø
Bloodshot Eyes,Watch,Seatrain,180.7ø
Abbeville Fair,Watch,Seatrain,294.5ø
Voglia Di Rivivere,Io Non So Da Dove Vengo_ E Non So Dove Mai Andro'.Uomo E' Il Nome Che Mi Han Dato,De De Lind,214.6ø
Smarrimento,Io Non So Da Dove Vengo_ E Non So Dove Mai Andro'.Uomo E' Il Nome Che Mi Han Dato,De De Lind,479.0ø
Paura Del Niente,Io Non So Da Dove Vengo_ E Non So Dove Mai Andro'.Uomo E' Il Nome Che Mi Han Dato,De De Lind,466.3ø
Fuga E Morte,Io Non So Da Dove Vengo_ E Non So Dove Mai Andro'.Uomo E' Il Nome Che Mi Han Dato,De De Lind,440.2ø
E Poi,Io Non So Da Dove Vengo_ E Non So Dove Mai Andro'.Uomo E' Il Nome Che Mi Han Dato,De De Lind,125.3ø
Cimitero Di Guerra,Io Non So Da Dove Vengo_ E Non So Dove Mai Andro'.Uomo E' Il Nome Che Mi Han Dato,De De Lind,319.4ø
Mizrab,The Sorcerer,Gabor Szabo,418.9ø