Trouble In Paradise (LP Version),Trouble In Paradise,The Souther-Hillman-Furay Band,305.3ø
Somebody Must Be Wrong (LP Version),Trouble In Paradise,The Souther-Hillman-Furay Band,230.0ø
Prisoner In Disguise (LP Version),Trouble In Paradise,The Souther-Hillman-Furay Band,292.0ø
On The Line (LP Version),Trouble In Paradise,The Souther-Hillman-Furay Band,220.5ø
Move Me Real Slow (LP Version),Trouble In Paradise,The Souther-Hillman-Furay Band,183.2ø
Mexico (LP Version),Trouble In Paradise,The Souther-Hillman-Furay Band,194.4ø
Love And Satisfy (LP Version),Trouble In Paradise,The Souther-Hillman-Furay Band,179.5ø
For Someone I Love (LP Version),Trouble In Paradise,The Souther-Hillman-Furay Band,176.5ø
Follow Me Through (LP Version),Trouble In Paradise,The Souther-Hillman-Furay Band,230.2ø