Tristessa,Gish,The Smashing Pumpkins,213.7ø
Something To Remember (Album Version),I'm Breathless,Madonna,306.1ø
Like A Prayer (Album Version-Immaculate Collection),The Immaculate Collection,Madonna,351.6ø
He's A Man  (Album Version),I'm Breathless,Madonna,284.5ø
Borderline (Remix Version),The Immaculate Collection,Madonna,317.9ø
Now I'm Following You (Part 2) (Album Version),I'm Breathless,Madonna,198.6ø
Like A Virgin (Edit Version),The Immaculate Collection,Madonna,191.1ø
Into The Groove (Edit Version),The Immaculate Collection,Madonna,249.8ø
Express Yourself (Edit Version),The Immaculate Collection,Madonna,244.2ø