The Ancient In My Brain,In the West,Kenso,436.6ø
Alfama,In the West,Kenso,127.1ø
She Needs Love,Best of Wayne Fontana & The Mindbenders,Wayne Fontana | The Mindbenders,147.3ø
The Ritual Of Mahaparinirvana,Traditional Music Of Amygdala,Laszlo Hortobagyi,535.5ø
The Inanis Mantra,Traditional Music Of Amygdala,Laszlo Hortobagyi,156.8ø
The End,Traditional Music Of Amygdala,Laszlo Hortobagyi,128.8ø
Legend Of Yrch,Traditional Music Of Amygdala,Laszlo Hortobagyi,293.9ø
Kyrie Bhajan,Traditional Music Of Amygdala,Laszlo Hortobagyi,85.9ø
Hypotaxis,Traditional Music Of Amygdala,Laszlo Hortobagyi,317.4ø
Lucy Mae Blues,Blues Legends,Frankie Lee Sims,152.5ø
Just Good Ol' Boys,Moe Bandy & Joe Stampley - Super Hits,Moe Bandy & Joe Stampley,156.4ø
There Was An Old Lady,Mini Disney - Nursery Rhymes,Disneyland Children's Sing-Along Chorus|Larry Groce,136.5ø
Pop! Goes The Weasel,Mini Disney - Nursery Rhymes,Disneyland Children's Sing-Along Chorus|Larry Groce,66.5ø
Old Macdonald,Mini Disney - Nursery Rhymes,Disneyland Children's Sing-Along Chorus|Larry Groce,148.1ø
When Erastus Plays His Old Kazoo,Black Chicago (Johnny Dodds Volume 4 1927),Johnny Dodds Black Bottom Stompers,168.0ø
Joe Turner Blues,Black Chicago (Johnny Dodds Volume 4 1927),Johnny Dodds Black Bottom Stompers,161.6ø
In The Middle Of The House,Rock 'n' Roll And Pop Hits_ The 50s_ Vol. 14,Rusty Draper,114.0ø
Freight Train,Pop Parade Vol. 4,Rusty Draper,135.5ø
I'll Be There,Original Hits - Country,Gail Davies,137.3ø
When Things Dream,Stories Across Borders,Jansen|Barbieri,172.7ø
The Insomniac's Bed,Stories Across Borders,Jansen|Barbieri,237.4ø
One More Zombie,Stories Across Borders,Jansen|Barbieri,340.8ø
Nocturnal Sightseeing,Stories Across Borders,Jansen|Barbieri,382.5ø
Lumen,Stories Across Borders,Jansen|Barbieri,218.0ø
Long Tales_ Tall Shadows,Stories Across Borders,Jansen|Barbieri,313.8ø
The Love Of My Man,Country Girls,Theola Kilgore,196.8ø