Colinda,Voices Of Americana: Rod Bernard,Rod Bernard,182.6ø
Future FJP,Layo and Bushwacka! - Rio,Liaisons D,210.1ø
She's Got A Strange Attractor,Elementary Headcoats,Thee Headcoat Sect,267.5ø
Headcoats On,Elementary Headcoats,Thee Headcoat Sect,188.1ø
Be A Sect Maniac,Elementary Headcoats,Thee Headcoat Sect,131.4ø
Dewey Baby,The Beautyful Ones Are Not Yet Born,Branford Marsalis Trio,550.5ø
Citizen Tain,The Beautyful Ones Are Not Yet Born,Branford Marsalis Trio,485.6ø
Cain & Abel,The Beautyful Ones Are Not Yet Born,Branford Marsalis Trio,467.8ø
Uyavutha Umlilo,The Best Of,Mahlathini and the Mahotella Queens,174.0ø
Thonthodi,The Best Of,Mahlathini and the Mahotella Queens,230.5ø
Nina Majuba,The Best Of,Mahlathini and the Mahotella Queens,266.0ø
Mbaqanga,The Best Of,Mahlathini and the Mahotella Queens,264.0ø
Kgarebe Tsaga Mothusi (Thuntshwane Basadi),The Best Of,Mahlathini and the Mahotella Queens,269.0ø
The Things I Used To Do,Genuine Mississippi Blues&Plus - Ace (MS.) Blues Masters Vol 4,King Edward,342.6ø
What If,Particular People,Jane Kelly Williams,212.1ø
Rockin' Years,Greatest Hits Plus,Ricky Van Shelton,206.1ø
Dish Queen,Go Bang! Volume 1,House Of Venus,253.3ø
The Bass Gets Funky,Return Of The Bass That Ate Miami,Maggotron Crushing Crew,382.1ø
Return Of The Bass That Ate Miami,Return Of The Bass That Ate Miami,Maggotron Crushing Crew,418.9ø
Hammer And Nails,Blue Food & Black Sparks,Carnival Art,179.7ø