Amor Verdadero (Guajira-Son),A Toda Cuba Le Gusta,Afro-Cuban All Stars,398.9ø
Alto Songo (Son Montuno),A Toda Cuba Le Gusta,Afro-Cuban All Stars,406.1ø
A Toda Cuba Le Gusta (Son),A Toda Cuba Le Gusta,Afro-Cuban All Stars,348.7ø
When I Wake Up From This Night (Sally & Co.),Gabby Road,Four Bitchin' Babes,228.4ø
These Boots Are Made For The Tap Dancing Wild Thing (Co.),Gabby Road,Four Bitchin' Babes,211.4ø
Choices,V.M.Live Presents L.E.S. Stitches 11/15/97,L.E.S. Stitches,129.9ø
Six By Six,The Best of Detroit,Earl Van Dyke,197.2ø