What's In It For Me (Album Version),Breathe,Faith Hill,331.4ø
The Way You Love Me (Album Version),Breathe,Faith Hill,186.1ø
That's How Love Moves (Album Version),Breathe,Faith Hill,254.4ø
Love Is A Sweet Thing (Album Version),Breathe,Faith Hill,236.0ø
Let's Make Love (Album Version),Breathe,Faith Hill & Tim McGraw,252.9ø
It Will Be Me (Album Version),Breathe,Faith Hill,226.6ø
If I'm Not In Love (Album Version),Breathe,Faith Hill,242.5ø
I Got My Baby (Album Version),Breathe,Faith Hill,211.9ø
Bringing Out The Elvis (Album Version),Breathe,Faith Hill,214.4ø