Kick The Chair,The System Has Failed,Megadeth,237.6ø
Die Dead Enough,The System Has Failed,Megadeth,258.5ø
No Control,Bullet For My Valentine,Bullet For My Valentine,214.5ø
Hotride,Always Outnumbered_ Never Outgunned,Prodigy,276.2ø
Seven Angels_ Seven Trumpets,Plague Angel,Marduk,167.2ø
Daddy Frank,The Fightin' Side Of Me - 15 #1 Hits,Merle Haggard,225.4ø
Somersault (Album Version),When It Falls,Zero 7,417.7ø
In Time (Album Version),When It Falls,Zero 7,296.7ø
Home (Album Version),When It Falls,Zero 7,276.6ø
On the Lam from the law,Cowabonga,Melanie,138.8ø
Lover Of My Friend,Paled By Dimmer Light,Melanie,221.8ø
Extraordinary,Paled By Dimmer Light,Melanie,297.1ø
The Swish,Almost Killed Me,The Hold Steady,249.3ø
Sweet Payne,Almost Killed Me,The Hold Steady,273.0ø
Sketchy Metal,Almost Killed Me,The Hold Steady,257.4ø
Barfruit Blues,A Positive Rage,The Hold Steady,218.4ø
The Lair Of The White Worm,The Lair Of The White Worm,God Dethroned,211.5ø
The Grey Race,The Lair Of The White Worm,God Dethroned,250.9ø
Sigma Enigma,The Lair Of The White Worm,God Dethroned,245.8ø
Salt In Your Wounds,The Lair Of The White Worm,God Dethroned,301.7ø
Nihilism,The Lair Of The White Worm,God Dethroned,310.0ø
Arch Enemy Spain,The Lair Of The White Worm,God Dethroned,260.1ø
The Birth Feast,Girl with a Pearl Earring,Pro Arte Orchestra Of London | Michael Davis | Alexandre Desplat,167.0ø
Griet's Theme,Girl with a Pearl Earring,Pro Arte Orchestra Of London | Michael Davis | Alexandre Desplat,259.1ø
Griet Remembers,Girl with a Pearl Earring,Pro Arte Orchestra Of London | Michael Davis | Alexandre Desplat,59.5ø
Tons Confession,Elephant Woman,Blonde Redhead,217.3ø
Pink Love,Misery Is A Butterfly,Blonde Redhead,373.3ø
Misery Is A Butterfly,Misery Is A Butterfly,Blonde Redhead,308.0ø
Misery (Wicked Version),Elephant Woman,Blonde Redhead,282.5ø
Messenger,Misery Is A Butterfly,Blonde Redhead,201.9ø
Melody,Misery Is A Butterfly,Cass McCombs,276.9ø
Magic Mountain,Misery Is A Butterfly,Blonde Redhead,182.5ø
Maddening Cloud,Misery Is A Butterfly,Blonde Redhead,200.5ø
Falling Man,Misery Is A Butterfly,Blonde Redhead,206.6ø
Elephant Woman,Misery Is A Butterfly,Blonde Redhead,289.8ø
Doll Is Mine,Misery Is A Butterfly,Blonde Redhead,186.5ø
Anticipation,Misery Is A Butterfly,Blonde Redhead,244.3ø
Dirty Little Thing,XXX: State Of The Union,Velvet Revolver,237.5ø
Predictive Text,Sexie,Eddie Izzard,282.0ø
Odysseus and the Sirens,Sexie,Eddie Izzard,114.3ø
Mars Came to Visit,Sexie,Eddie Izzard,184.6ø
Greyhounds,Sexie,Eddie Izzard,83.3ø
Greek Heroes,Sexie,Eddie Izzard,243.3ø
Breast Headphones,Sexie,Eddie Izzard,317.4ø
Satellite (Radio Edit) (Radio Edit),Satellite,OceanLab,198.2ø
Satellite (Poison Pro Remix) (Poison Pro Remix),Satellite,OceanLab,408.4ø
Satellite (Paul Brekeman Remix) (Paul Brekeman Remix),Satellite,OceanLab,465.1ø
Satellite (Floris de Haan Mix) (Floris de Haan Mix),Satellite,OceanLab,271.7ø
Satellite (Flipside Vocal Mix) (Flipside Vocal Mix),Satellite,OceanLab,327.8ø
Satellite (Filo & Peri Remix) (Filo & Peri Remix),Satellite,OceanLab,516.6ø
Satellite (Devotion Remix) (Devotion Remix),Satellite,OceanLab,441.3ø
Satellite (Boldt & Steinweg Remix) (Boldt & Steinweg Remix),Satellite,OceanLab,456.2ø
Satellite (Blue Pace Remix) (Blue Pace Remix),Satellite,OceanLab,505.1ø
Satellite (Andreas Reuterberg Remix) (Andrewas Reuterberg Remix),Satellite,OceanLab,588.3ø
Satellite (Above & Beyond Progressive Remix) (Above & Beyond Progressive Remix),Satellite,OceanLab,475.3ø
Satellite (3 Colours Mix) (3 Colours Mix),Satellite,OceanLab,580.0ø
Satellite,Armada The Best Of_ Vol. 1,OceanLab,195.1ø
Warschau,Warschau,Marduk,294.3ø
Tod Und Vernichtung,Deathmarch Tour Ep,Marduk,206.8ø
Throne Of Rats,Warschau,Marduk,194.7ø
The Hangman Of Prague,Plague Angel,Marduk,185.9ø
Steel Inferno,Warschau,Marduk,148.4ø
Perish In Flames,Plague Angel,Marduk,466.2ø
Holy Blood_ Holy Grail,Plague Angel,Marduk,147.5ø
Blutrache,Plague Angel,Marduk,468.5ø
Touch,The String Quartet Tribute To Clay Aiken,Vitamin String Quartet,225.2ø
Idiot Box,String Quartet Tribute To Incubus Vol. 2,Vitamin String Quartet,233.9ø
Here To Stay,A String Quartet Tribute To Korn: The Hurt Inside,Vitamin String Quartet,269.0ø
Are You In?,String Quartet Tribute To Incubus Vol. 2,Vitamin String Quartet,236.0ø
Another Love Song,Queens Of The Stone Age_ Strings For The Deaf: A String Quartet to,Vitamin String Quartet,180.1ø
What They Do,The String Quartet Tribute To The Roots,Vitamin String Quartet,318.6ø
Hit Me Like You Did The First Time,The String Quartet Tribute to The Flaming Lips,Vitamin String Quartet,213.2ø
Goin' Blind,The String Quartet Tribute to KISS,Vitamin String Quartet,195.6ø