Out Of Our Lives,Best Trance Hits_ Vol. 2,Active Sight,491.8ø
Woo,Gibby Haynes and His Problem (Bonus Remixes),Gibby Haynes and His Problem,170.9ø
Superman,Gibby Haynes and His Problem (Bonus Remixes),Gibby Haynes and His Problem,190.8ø
Redneck Sex,Gibby Haynes and His Problem (Bonus Remixes),Gibby Haynes and His Problem,136.4ø
Nights,Gibby Haynes and His Problem (Bonus Remixes),Gibby Haynes and His Problem,228.8ø
Letter,Gibby Haynes and His Problem (Bonus Remixes),Gibby Haynes and His Problem,198.6ø
Kaiser,Gibby Haynes and His Problem (Bonus Remixes),Gibby Haynes and His Problem,179.9ø
I Need Some Help,Gibby Haynes and His Problem (Bonus Remixes),Gibby Haynes and His Problem,507.0ø
15000,Gibby Haynes and His Problem (Bonus Remixes),Gibby Haynes and His Problem,244.9ø
Ashes To Ashes,Best of Wayne Fontana & The Mindbenders,Wayne Fontana | The Mindbenders,148.1ø
Water at the Bar (Live),A Fine Kettle of Fish,Tiller's Folly,211.8ø
Water At the Bar,A Ripple In Time,Tiller's Folly,175.2ø
Together (Live),A Fine Kettle of Fish,Tiller's Folly,292.3ø
The Ghosts of Read Island (Live),A Fine Kettle of Fish,Tiller's Folly,219.2ø
The Ghosts of Read Island,The View from Here,Tiller's Folly,191.8ø
Steamboatin' Jamiesons (Live),A Fine Kettle of Fish,Tiller's Folly,144.7ø
Steamboatin' Jamiesons,Ghosts of the Mighty Fraser,Tiller's Folly,135.5ø
Road to Skidigate (Live),A Fine Kettle of Fish,Tiller's Folly,351.8ø
Mormond Braes (Live),A Fine Kettle of Fish,Tiller's Folly,232.7ø
McCulloch's Wonder (Live),A Fine Kettle of Fish,Tiller's Folly,221.9ø
McCulloch's Wonder,A Ripple In Time,Tiller's Folly,289.5ø
Little Beggarman (Live),A Fine Kettle of Fish,Tiller's Folly,234.2ø
John Tod (Live),A Fine Kettle of Fish,Tiller's Folly,236.4ø
John Tod,Stirring Up Ghosts,Tiller's Folly,234.5ø
Electric RR Line (Live),A Fine Kettle of Fish,Tiller's Folly,189.5ø
Cuckoo's Nest (Live),A Fine Kettle of Fish,Tiller's Folly,296.5ø
Chestnut Lane,A River So Wide,Tiller's Folly,276.0ø
Chesnut Lane (Live),A Fine Kettle of Fish,Tiller's Folly,191.2ø
Ashokan Farewell (Live),A Fine Kettle of Fish,Tiller's Folly,224.1ø
As I Roved Out (Live),A Fine Kettle of Fish,Tiller's Folly,262.7ø
A River So Wide (Live),A Fine Kettle of Fish,Tiller's Folly,276.9ø
A River So Wide,A River So Wide,Tiller's Folly,215.7ø
A Ripple in Time (Live),A Fine Kettle of Fish,Tiller's Folly,243.5ø
A Ripple In Time,A Ripple In Time,Tiller's Folly,283.2ø
My Family Is Weird,The Best Of Blue Collar Comedy,Larry The Cable Guy,586.2ø
Differences Between Men And Women,The Best Of Blue Collar Comedy,Bill Engvall,352.6ø
Courtesy Sniff,The Best Of Blue Collar Comedy,Jeff Foxworthy,182.1ø
I Heard It Through The Grapevine,Twist of Motown,Lee Ritenour | Dave Grusin,321.9ø
Bounce Da Beat,Shockwave ))),Philippe Rochard,311.4ø
Jo pihisee,Tanssisuosikit 6,Korsuorkesteri,185.9ø
Tough Times For The Troubadours,Today's Song For Tomorrow,Lord Sterling,199.3ø
Today's Song For Tomorrow,Today's Song For Tomorrow,Lord Sterling,384.8ø
Thread Will Be Torn,Today's Song For Tomorrow,Lord Sterling,237.8ø
This Time It's For Real,Today's Song For Tomorrow,Lord Sterling,203.8ø
Poison Lips,Today's Song For Tomorrow,Lord Sterling,315.2ø
Pivotal Planes,Today's Song For Tomorrow,Lord Sterling,280.8ø
Password,Today's Song For Tomorrow,Lord Sterling,310.6ø
Hidden Flame,Today's Song For Tomorrow,Lord Sterling,368.4ø
Evaporate,Today's Song For Tomorrow,Lord Sterling,333.3ø
I Never Loved A Woman (The Way I Love You),The Goldwax Years,Spencer Wiggins,181.7ø
Revenge of the nerd,Television Saga Remixes,Dash Dude,381.7ø
Working On The Building,Jesus Is Waiting,The Highway QC's,146.2ø
The Way Up The Hill,Jesus Is Waiting,The Highway QC's,174.7ø
Somewhere To Lay My Head,Jesus Is Waiting,The Highway QC's,143.7ø
I'll Trust His Word,Jesus Is Waiting,The Highway QC's,165.0ø
I'll See Jesus Too,Jesus Is Waiting,The Highway QC's,146.3ø
I Heard,Jesus Is Waiting,The Highway QC's,173.3ø
He Said,Jesus Is Waiting,The Highway QC's,139.8ø
Great Trumpet,Jesus Is Waiting,The Highway QC's,161.5ø
Child Of God,Jesus Is Waiting,The Highway QC's,135.3ø
Walpurgisnacht,Weiss der Teufel,Rufus Zuphall,181.8ø
Knight Of 3rd Degree,Outside The Gates Of Eden,Rufus Zuphall,454.8ø
Mi Si Ba To,The King Of Benin Urban Groove 1972 - 80,T.p. Orchestre Poly-rythmo,297.9ø
Medida,The King Of Benin Urban Groove 1972 - 80,T.p. Orchestre Poly-rythmo,174.0ø
Les Djos,The King Of Benin Urban Groove 1972 - 80,T.p. Orchestre Poly-rythmo,216.7ø
Kou Tche Kpo So O,The King Of Benin Urban Groove 1972 - 80,T.p. Orchestre Poly-rythmo,190.8ø
Kokoriko,The King Of Benin Urban Groove 1972 - 80,T.p. Orchestre Poly-rythmo,394.7ø
Hwe Towe Hun,The King Of Benin Urban Groove 1972 - 80,T.p. Orchestre Poly-rythmo,243.9ø
Gendamou Na Wili We Gnannin,The King Of Benin Urban Groove 1972 - 80,T.p. Orchestre Poly-rythmo,367.9ø
Gbeto Vivi,The King Of Benin Urban Groove 1972 - 80,T.p. Orchestre Poly-rythmo,341.2ø
Avoun Doupou Me Douga,The King Of Benin Urban Groove 1972 - 80,T.p. Orchestre Poly-rythmo,205.8ø
Angelina Ii,The King Of Benin Urban Groove 1972 - 80,T.p. Orchestre Poly-rythmo,207.3ø
Aihe Ni Kpe We,The King Of Benin Urban Groove 1972 - 80,T.p. Orchestre Poly-rythmo,428.1ø
Agnon Djidjo,The King Of Benin Urban Groove 1972 - 80,T.p. Orchestre Poly-rythmo,467.3ø
Turye Undas Fiurmae,Graveflowers,Monstrare,295.5ø
Turye Es Undas Urmae,Graveflowers,Monstrare,228.9ø
Qui Wuen,Graveflowers,Monstrare,255.2ø
Mem Na'ught,Graveflowers,Monstrare,420.1ø
Petite Ou La Grosse (Little Or Big_ They're All The Same),Live! At The Dance,Savoy-Doucet Cajun Band,267.3ø
La Valse Du Malchanceux (The Unlucky Waltz),Live! At The Dance,Savoy-Doucet Cajun Band,317.9ø
La Valse Du Malchanceux,The Best Of The Savoy-Doucet Cajun Band,Savoy-Doucet Cajun Band,316.4ø
La Valse Des Reids,Live! At The Dance,Savoy-Doucet Cajun Band,231.3ø
La Valse D'orphelin (The Orphan Waltz),Live! At The Dance,Savoy-Doucet Cajun Band,281.9ø
La Talle D'eronces (The Briar Buxh),Live! At The Dance,Savoy-Doucet Cajun Band,291.2ø
La Danse De Mardi Gras (The Mardi Gras Dance),Live! At The Dance,Savoy-Doucet Cajun Band,286.4ø
Home Sweet Home,Live! At The Dance,Savoy-Doucet Cajun Band,59.1ø
Worldes blis,Lenten is come,Briddes Roune,276.9ø
When the nichtegale singes,Lenten is come,Briddes Roune,296.8ø
The milde lomb,Lenten is come,Briddes Roune,366.1ø
Stond wel moder under roode,Lenten is come,Briddes Roune,394.7ø
Sante Marie viergene,Lenten is come,Briddes Roune,57.0ø
Sainte Nicholas,Lenten is come,Briddes Roune,76.8ø
Nou goth sonne under wod,Lenten is come,Briddes Roune,74.0ø
Man mai longe lives weene,Lenten is come,Briddes Roune,314.9ø
Lenten is come,Lenten is come,Briddes Roune,223.3ø
Edi be thu,Lenten is come,Briddes Roune,155.6ø
Crist and Sainte Marie,Lenten is come,Briddes Roune,101.4ø
Brid one breer,Lenten is come,Briddes Roune,137.9ø
Brid by a strem,Lenten is come,Briddes Roune,135.0ø
Ar ne kuth ich sorghe non,Lenten is come,Briddes Roune,244.6ø
Angelus ad virginem,Lenten is come,Briddes Roune,111.7ø
A wayle whyt,Lenten is come,Briddes Roune,136.0ø
Wild Spring Apples,Happenstance,touchingGrace,239.6ø
Watching Clouds,Happenstance,touchingGrace,302.0ø
Sunday Driver,Happenstance,touchingGrace,218.9ø
Stormfront,Happenstance,touchingGrace,321.5ø
Stick Dance,Happenstance,touchingGrace,212.2ø
Southern Sultry,Happenstance,touchingGrace,369.4ø
Sitar Study in Aflat Major,Happenstance,touchingGrace,291.0ø
Eastern Sky,Panacea,touchingGrace,560.1ø
Afternoon Lament,Happenstance,touchingGrace,202.8ø
47,Happenstance,touchingGrace,241.6ø
Sacramento & Polk,Por Vida,Lenny Kaye,279.2ø
Sokari,Plemora,Runaway Totem,449.2ø
Restau,Plemora,Runaway Totem,338.5ø
Il lago di fuoco,Plemora,Runaway Totem,531.4ø
Tootie Blues,Screamin' and Hollerin' The Blues,Paul Geremia,204.6ø
Your Eyes,Cubes,Novaspace,268.1ø
Tagore Street Blues,Mahima,Debashish Bhattacharya & Bob Brozman,225.8ø
Jessie Polka,South Texas Swing,Adolph Hofner,164.7ø
Tulips & Chocolate (Original Mix),Tulips & Chocolate,Woodshokk,470.8ø
Tulips & Chocolate (G&M Project Remix),Tulips & Chocolate,Woodshokk,442.4ø