You're The Love I Wanna Be In,Jason Aldean,Jason Aldean,196.5ø
Why,Jason Aldean,Jason Aldean,213.3ø
She Loved Me,Jason Aldean,Jason Aldean,202.7ø
Lonesome USA,Jason Aldean,Jason Aldean,218.7ø
I'm Just A Man,Jason Aldean,Jason Aldean,197.0ø
I Believe In Ghosts,Jason Aldean,Jason Aldean,205.4ø
Hicktown,Jason Aldean,Jason Aldean,305.5ø
Good To Go,Jason Aldean,Jason Aldean,240.1ø
Even If I Wanted To,Jason Aldean,Jason Aldean,249.9ø
Asphalt Cowboy,Jason Aldean,Jason Aldean,242.1ø
Amarillo Sky,Jason Aldean,Jason Aldean,202.1ø
We're Young And Beautiful,Some Hearts,Carrie Underwood,233.1ø
What More Do You Want,All That We Needed,Plain White T S,144.6ø
Take Me Away,All That We Needed,Plain White T S,162.5ø
Sing My Best,All That We Needed,Plain White T S,171.8ø
Sad Story,All That We Needed,Plain White T S,177.6ø
Revenge,All That We Needed,Plain White T S,206.2ø
My Only One,All That We Needed,Plain White T S,229.3ø
Lazy Day Afternoon,All That We Needed,Plain White T S,135.1ø
Last Call,All That We Needed,Plain White T S,173.8ø
Faster,All That We Needed,Plain White T S,171.3ø
Breakdown,All That We Needed,Plain White T S,214.3ø
Better Luck Next Time,Dead Bands Party - A Tribute To Oingo Boingo,Plain White T's,206.7ø
Anything,All That We Needed,Plain White T S,179.6ø
All That We Needed,All That We Needed,Plain White T S,221.3ø
We Are All On Drugs,We Are All On Drugs,Weezer,215.4ø
The Damage In Your Heart,Make Believe,Weezer,242.9ø
Savin' Me,All The Right Reasons,Nickelback,219.3ø
Your Embrace,Oral Fixation Vol. 2,Shakira,213.0ø
Timor,Oral Fixation Vol. 2,Shakira,212.4ø
How Do You Do,Oral Fixation Vol. 2,Shakira,225.4ø
Dreams for Plans,Oral Fixation Vol. 2,Shakira,242.8ø
Don't Bother,Oral Fixation Vol. 2,Shakira,264.1ø
Costume Makes the Clown,Oral Fixation Vol. 2,Shakira,192.1ø
Animal City,Oral Fixation Vol. 2,Shakira,195.5ø
Playa's Only,TP.3 Reloaded,R. Kelly featuring The Game,232.0ø
Kickin' It With Your Girlfriend,TP.3 Reloaded,R. Kelly,214.1ø
The Forecast (Album Version),Mr. A-Z,Jason Mraz,225.2ø
Song For A Friend (Album Version),Mr. A-Z,Jason Mraz,488.1ø
Please Don't Tell Her (Album Version),Mr. A-Z,Jason Mraz,277.9ø
Plane  (Album Version),Mr. A-Z,Jason Mraz,313.9ø
O. Lover (Album Version),Mr. A-Z,Jason Mraz,234.8ø
Mr.Curiosity  (Album Version),Mr. A-Z,Jason Mraz,235.0ø
Life Is Wonderful  (Album Version),Mr. A-Z,Jason Mraz,260.5ø
Geek In The Pink (Lilywhite Mix),Mr. A-Z,Jason Mraz,236.5ø
Did You Get My Message? (Album Version),Mr. A-Z,Jason Mraz,240.5ø
Clockwatching (Album Version),Mr. A-Z,Jason Mraz,263.5ø
Bella Luna (Album Version),Mr. A-Z,Jason Mraz,302.3ø
Head To Toe,Four Kicks,Kings Of Leon,126.1ø
So Lonely (One & Only Part II),The Emancipation of Mimi,Mariah Carey | Twista,233.2ø
Mine Again,The Emancipation of Mimi,Mariah Carey,241.7ø
Trapped In The Closet Chapter 5,TP.3 Reloaded,R. Kelly,198.3ø
Touchin,TP.3 Reloaded,R. Kelly featuring Nivea,300.8ø
Sex Weed,TP.3 Reloaded,R. Kelly,265.4ø
Remote Control,TP.3 Reloaded,R. Kelly,319.4ø
Let Your Light Shine,Hurricane Relief: Come Together Now,R. Kelly,266.0ø
In The Kitchen,TP.3 Reloaded,R. Kelly,217.5ø
Hit It Til The Mornin,TP.3 Reloaded,R. Kelly featuring Twista & Do Or Die,258.8ø
Happy Summertime,TP.3 Reloaded,R. Kelly featuring Snopp Dogg,218.4ø
Girls Go Crazy,TP.3 Reloaded,R. Kelly featuring Baby,269.9ø
We Will Rock You,Photograph [Commercial Single],Nickelback,119.8ø
Someone That You're With (Album Version),All The Right Reasons,Nickelback,241.7ø
Side Of A Bullet (Album Version),All The Right Reasons,Nickelback,180.6ø
Rockstar,Just The Best Vol. 60,Nickelback,254.9ø
Photograph [Live In Atlanta],All The Right Reasons,Nickelback,279.8ø
Photograph,All The Right Reasons,Nickelback,258.9ø
Never Again [Live In Atlanta],All The Right Reasons,Nickelback,257.1ø
Mistake [Live in Edmonton_ Moi Mix],Far Away,Nickelback,311.4ø
Follow You Home [Live In Atlanta],All The Right Reasons,Nickelback,278.6ø
Follow You Home (Album Version),All The Right Reasons,Nickelback,260.3ø
Animals [Live In Atlanta],All The Right Reasons,Nickelback,232.9ø
Animals (Album Version),All The Right Reasons,Nickelback,186.6ø
Summertime,The Road And The Radio,Kenny Chesney,206.6ø
Living In Fast Forward,Greatest Hits II,Kenny Chesney,211.9ø
Unbreakable,Have A Nice Day,Bon Jovi,227.3ø
Have A Nice Day,Have A Nice Day: Special Edition,Bon Jovi,228.8ø
This Is Such A Pity,Make Believe,Weezer,204.4ø
The Other Way,Make Believe,Weezer,196.9ø
Pardon Me,Make Believe,Weezer,255.9ø
My Best Friend,Make Believe,Weezer,167.8ø
Hold Me,Make Believe,Weezer,262.5ø
Sweet Neo Con,A Bigger Bang,The Rolling Stones,273.9ø
It's only Rock and Roll,Touch Covers 1973-1975_ Vol. 1,Chris Farlow,256.9ø
River Don't Runnn,Sweat/Suit (Combo),Nelly | Murphy Lee | Stephen Marley,301.3ø
Nothing Wrong,Futures,Jimmy Eat World,187.3ø
Half Right,Stay On My Side Tonight,Jimmy Eat World,281.7ø
Wordplay (Album Version),Mr. A-Z,Jason Mraz,187.5ø
Rocket Man (Acoustic Demo),Mr. A-Z,Jason Mraz,215.5ø
That Changes Everything,Doin' Something Right / Billy Currington,Billy Currington,229.6ø
She's Got A Way With Me,Doin' Something Right / Billy Currington,Billy Currington,285.3ø
Must Be Doin' Somethin' Right,Doin' Something Right / Billy Currington,Billy Currington,269.6ø
Lucille,Doin' Something Right / Billy Currington,Billy Currington,248.5ø
I Wanna Be A Hillbilly,Doin' Something Right / Billy Currington,Billy Currington,186.2ø
Here I Am,Doin' Something Right / Billy Currington,Billy Currington,221.2ø
Good Directions,Good Directions Hit Pack,Billy Currington,215.8ø