The Carnival of Venice,The Essential Joshua Bell,Joshua Bell,557.4ø
Short Trip Home,The Essential Joshua Bell,Joshua Bell;Edgar Meyer;Mike Marshall;Sam Bush,228.2ø
Nice Work If You Can Get It,The Essential Joshua Bell,Joshua Bell;London Symphony Orchestra;John Williams,217.5ø
New York_ New York from On the Town,The Essential Joshua Bell,Joshua Bell,147.1ø
Ladies in Lavender,The Essential Joshua Bell,Joshua Bell,243.3ø
III. Rondo. Allegro from Concerto in D Major for Violin and Orchestra_ Op. 61,The Essential Joshua Bell,Joshua Bell;Roger Norrington;Camerata Salzburg,560.2ø
Fantasy for Violin and Orchestra,The Essential Joshua Bell,Joshua Bell,219.5ø
Coitus Musicalis; Victoria's Departure,The Essential Joshua Bell,Joshua Bell;Esa-Pekka Salonen;The Philharmonia Orchestra,166.9ø
San Francisco Blues,Miss Lillie Brown,Lowell Fulson,145.1ø
The Roots,Active Sense Trance Vol.1,AJP,434.6ø
Wild Lights,Wild Light,Mount Sims,295.1ø
Somnambulist,Wild Light,Mount Sims,94.7ø
9 Voltz,Wild Light,Mount Sims,209.0ø
Strings Of Life (Stronger On My Own) (Radio Edit),Strings Of Life [Stronger On My Own],Soul Central Featuring Kathy Brown,217.1ø
Strings Of Life (Stronger On My Own) (Danny Krivit Re-Edit),Strings Of Life [Stronger On My Own],Soul Central Featuring Kathy Brown,479.9ø
Strings Of Life (Stronger On My Own) ,Pacha Club Classics,Soul Central,523.0ø
Es Vedra,Latin House,Erick E,394.3ø
Kiksu,Worldvibe,Kyau & Albert,270.7ø
Vois sur ton chemin,MY PERFECT LIST - FETE DES MERES,Les Choristes,139.9ø