LoveStoned/I Think She Knows Interlude,LoveStoned,Justin Timberlake,260.0ø
Damn Girl,FutureSex/LoveSounds,Justin Timberlake;Justin Timberlake featuring will.i.am,312.4ø
Red Rain,One Nation Underground [Special Edition],Ill Nino,318.7ø
Who's Your Daddy? ,Who's Your Daddy? - Remixes,Benny Benassi,443.5ø
The Fallen (Radio Edit),The Fallen,Franz Ferdinand,167.1ø
L. Wells,They'll Have To Catch Us First,Franz Ferdinand,209.0ø
Jeremy Fraser,The Fallen,Franz Ferdinand,235.6ø
Ghost In A Ditch,Eleanor Put Your Boots On,Franz Ferdinand,225.2ø
Phenomena,Show Your Bones,Yeah Yeah Yeahs,250.2ø
Honeybear,Show Your Bones,Yeah Yeah Yeahs,145.6ø
Yo Quiero,Todo Cambio,Camila,207.5ø
U Got My Love,Todo Cambio,Camila,194.9ø
Sin Tu Amor,Todo Cambio,Camila,163.7ø
Perderte De Nuevo,Todo Cambio,Camila,181.1ø
Nanga Ti Feo,Todo Cambio,Camila,160.7ø
Me Da Igual,Todo Cambio,Camila,218.3ø
Coleccionista De Canciones,Todo Cambio,Camila,308.0ø
Abrazame,Todo Cambio,Camila,230.7ø
Can't Take It (El Camino Prom Wagon Mix),Snakes On A Plane [OST],The All-American Rejects,178.2ø
Come Share The View,Bullets,Editors,282.2ø
Deadly Game,Wreckless Intent,Theory Of A Deadman,189.1ø
That Was My Veil,The Peel Sessions 1991 - 2004,PJ Harvey,184.4ø
Take A Gamble,Colours (The B-Sides),Hot Chip,128.3ø
Boy From School (Cosmic Sandwich Remix),Boy From School (The Mixes),Hot Chip,362.8ø
Trenchtown Rock,African Herbsman,Bob Marley & The Wailers,177.9ø
We Run This (High Contrast Remix),Confidential (UK edition),Missy Elliott,312.3ø
The Rain [Supa Dupa Fly]  (Amended Version),Respect M.E.,Missy Elliott,250.9ø
The Rain  [Supa Dupa Fly]  (LP Version),Respect M.E.,Missy Elliott,246.2ø
She's A Bitch (LP Version),Respect M.E.,Missy Elliott,239.9ø
She's A B**ch (Amended Version),Respect M.E.,Missy Elliott,79.9ø
Pass That Dutch [Respect M.E. Version]  (Explicit),Respect M.E.,Missy Elliott,221.3ø
I'm Really Hot [Respect M.E.] ( Explicit Version),Respect M.E.,Missy Elliott,210.7ø
Hit Em Wit Da Hee (Original LP Version),Respect M.E.,Missy  Elliott feat. Lil' Kim and Mocha,260.0ø
All N My Grill (LP Version),Respect M.E.,Missy Elliott,272.0ø
Mothership,Take To The Skies,Enter Shikari,277.4ø
Una Noche,Siempre,Il Divo,251.6ø
Somewhere,An Evening With Il Divo - Live in Barcelona,Il Divo,208.2ø
Nights In White Satin (Notte Di Luce),Siempre,Il Divo,257.4ø
Musica,Siempre,Il Divo,237.1ø
La Vida Sin Amor,Siempre,Il Divo,218.2ø
Have You Ever Really Loved A Woman (Un Regalo Que Te Dio La Vida),Siempre,Il Divo,278.5ø
Come Primavera,Siempre,Il Divo,229.1ø
Caruso,Siempre,Il Divo,235.8ø
Amor Venme A Buscar (Tell That To My Heart),Siempre,Il Divo,253.2ø
Losing Time / Grand Finale,Six Degrees of Inner Turbulence,Dream Theater,359.5ø
You Know My Name,Carry On,Chris Cornell,240.1ø
Thank You,Arms Around Your Love,Chris Cornell,287.4ø
Billie Jean,Carry On,Chris Cornell,281.3ø
We Wish You A Merry Christmas,Amarantine,Enya,220.0ø
The Magic Of The Night,Amarantine,Enya,214.1ø
You Spin Me Round (Like A Record),A Public Affair,Jessica Simpson,229.6ø
Walkin' 'Round In A Circle,A Public Affair,Jessica Simpson,280.1ø
The Lover In Me,A Public Affair,Jessica Simpson,221.1ø
Swing With Me,A Public Affair,Jessica Simpson,205.3ø
Push Your Tush,A Public Affair,Jessica Simpson,287.1ø
Let Him Fly,A Public Affair,Jessica Simpson,191.5ø
I Belong To Me,A Public Affair,Jessica Simpson,220.4ø
Fired Up,A Public Affair,Jessica Simpson,235.7ø
Back To You,A Public Affair,Jessica Simpson,250.5ø
B.O.Y.,A Public Affair,Jessica Simpson,202.3ø
A Public Affair,A Public Affair,Jessica Simpson,348.5ø
My Twin,My Twin,Katatonia,223.7ø
July,Live Consternation,Katatonia,303.2ø
In The White (Urban Dub),Deliberation,Katatonia,330.5ø
Still,supersunnyspeedgraphic_ the lp,Ben Folds,466.5ø
"White & Nerdy (Parody of ""Ridin'"" by Chamillionaire featuring Krayzie Bone)",Straight Outta Lynwood,"Weird Al"" Yankovic",170.2ø
I'll Sue Ya,Straight Outta Lynwood,"Weird Al"" Yankovic",231.0ø
"Confessions Part III (Parody of ""Confessions Part II"" by Usher)",Straight Outta Lynwood,"Weird Al"" Yankovic",232.1ø
Small Time Shoot 'Em Up,Collected,Massive Attack,404.6ø
Silent Spring,Collected,Massive Attack,187.5ø
Safe From Harm (2006 Digital Remaster),Collected,Massive Attack,319.3ø
Protection (2006 Digital Remaster) (Feat. Tracey Thorn),Collected,MASSIVE ATTACK FEATURING TRACEY THORN,465.3ø
Live With Me (Stripped Back),Live With Me,Massive Attack,279.8ø
Live With Me,Collected,Massive Attack,290.6ø
Inertia Creeps (2006 Digital Remaster),Collected,Massive Attack,354.3ø
Five Man Army (2006 Digital Remaster),Collected,Massive Attack,321.9ø
False Flags,Collected,Massive Attack,340.9ø
Butterfly Caught (RJD2 Instrumental),100th Window - The Remixes,Massive Attack,265.0ø
Butterfly Caught (2006 Digital Remaster),Collected,Massive Attack,308.6ø
Black Melt,Collected,Massive Attack,312.6ø
Sun_ Moon_ Stars,TRUE MAGIC,Mos Def,279.3ø
Crime & Medicine,TRUE MAGIC,Mos Def,188.8ø
America The Beautiful (Album Version),Living With War,Neil Young,176.9ø
After The Garden (Album Version),Living With War,Neil Young,201.7ø
No Buses,Who The F*** Are Arctic Monkeys?,Arctic Monkeys,199.3ø
Leave Before The Lights Come On,Leave Before The Lights Come On,Arctic Monkeys,232.1ø
7,When The Sun Goes Down,Arctic Monkeys,128.5ø
Lyon 6.6.06 (Live),Tell Me Baby,Red Hot Chili Peppers,233.2ø
Lately (Non-Album Track),Dani California,Red Hot Chili Peppers,175.2ø
Voice Inside My Head,Taking The Long Way,Dixie Chicks,352.3ø
The Long Way Around,Taking The Long Way,Dixie Chicks,273.4ø
So Hard,Taking The Long Way,Dixie Chicks,267.9ø
Silent House,Taking The Long Way,Dixie Chicks,323.8ø
Not Ready To Make Nice,Taking The Long Way,Dixie Chicks,238.1ø
Lullaby,Taking The Long Way,Dixie Chicks,351.8ø
Lubbock Or Leave It,Taking The Long Way,Dixie Chicks,234.3ø
I Like It,Taking The Long Way,Dixie Chicks,274.1ø
I Hope,Taking The Long Way,Dixie Chicks,325.3ø
Favorite Year,Taking The Long Way,Dixie Chicks,269.1ø
Everybody Knows,Taking The Long Way,Dixie Chicks,258.8ø
Easy Silence,Taking The Long Way,Dixie Chicks,242.7ø
Bitter End,Taking The Long Way,Dixie Chicks,278.5ø
Baby Hold On,Taking The Long Way,Dixie Chicks,304.0ø
The Bell Ringers,Boy From School (The B-Sides),Hot Chip,334.7ø
Getaway,The Makings Of Me,Monica,216.5ø
Martin Hannet Interview,Let The Movie Begin,Joy Division,31.1ø
Ian Curtis Interview,Let The Movie Begin,Joy Division,100.2ø
Bernard Sumner Interview,Let The Movie Begin,Joy Division,35.3ø
Auto Suggestion,Let The Movie Begin,Joy Division,246.6ø
Mercy Mercy (Non-Album Track),Tell Me Baby,Red Hot Chili Peppers,239.9ø
I Don't Want To Care,A Public Affair,Jessica Simpson,237.0ø
Between You & I,A Public Affair,Jessica Simpson,297.3ø
Venus As A Boy (Q Covermount),Corinne Bailey Rae,Corinne Bailey Rae,177.7ø
The Government Totally Sucks,The Pick Of Destiny,Tenacious D,94.5ø
Papagenu (He's My Sassafrass),The Pick Of Destiny,Tenacious D,144.2ø
Master Exploder,The Pick Of Destiny,Tenacious D,144.8ø
Car Chase City,The Pick Of Destiny,Tenacious D,162.3ø
Tits & Acid,Attack Decay Sustain Release,Simian Mobile Disco,243.8ø
I Believe,Attack Decay Sustain Release,Simian Mobile Disco,198.5ø
Hustler,Hustler,Simian Mobile Disco,397.7ø
Within Me,Karmacode,Lacuna Coil,218.0ø
Two Weeks In Hawaii,Zombies! Aliens! Vampires! Dinosaurs!,Hellogoodbye,291.0ø
Touchdown Turnaround (Don't Give Up On Me),Zombies! Aliens! Vampires! Dinosaurs!,Hellogoodbye,150.1ø
Stuck To You,Zombies! Aliens! Vampires! Dinosaurs!,Hellogoodbye,164.6ø
Oh_ It Is Love,Zombies! Aliens! Vampires! Dinosaurs!,Hellogoodbye,240.4ø
I Saw It On Your Keyboard,Zombies! Aliens! Vampires! Dinosaurs!,Hellogoodbye,183.0ø
Figures A And B (Means You And Me),Zombies! Aliens! Vampires! Dinosaurs!,Hellogoodbye,141.0ø
Dear Jamie...Sincerely Me,Here (In Your Arms),Hellogoodbye,261.7ø
Baby_ It's Fact,Zombies! Aliens! Vampires! Dinosaurs!,Hellogoodbye,197.0ø
All Time Lows,Zombies! Aliens! Vampires! Dinosaurs!,Hellogoodbye,164.2ø
All Of Your Love,Zombies! Aliens! Vampires! Dinosaurs!,Hellogoodbye,176.6ø
When I Look In Your Eyes,Idlewild,OutKast,163.4ø
PJ & Rooster,Idlewild,OutKast,267.8ø
No Bootleg DVDs,Idlewild,OutKast,50.3ø
Morris Brown,Idlewild,Outkast Featuring Scar & Sleepy Brown.,264.4ø
"Mighty ""O",Idlewild,OutKast,256.2ø
Makes No Sense At All,Idlewild,OutKast,173.6ø
Life Is Like A Musical,Idlewild,OutKast,134.3ø
Dyin' To Live,Idlewild,OutKast,127.6ø
Bamboo & Cross (Interlude),Idlewild,OutKast,54.6ø
A Bad Note,Idlewild,OutKast,527.2ø
Who Wants Flowers When You'Re Dead? Nobody,This Is What The Edge Of Your Seat Was Made For,Bring Me The Horizon,294.3ø
Traitors Never Play Hang-man,This Is What The Edge Of Your Seat Was Made For,Bring Me The Horizon,217.0ø
Tell Slater Not To Wash His Dick,Count Your Blessings,Bring Me The Horizon,210.4ø
Slow Dance,Count Your Blessings,Bring Me The Horizon,76.4ø
Re: They Have No Reflections,This Is What The Edge Of Your Seat Was Made For,Bring Me The Horizon,342.2ø
Rawwwrr!,This Is What The Edge Of Your Seat Was Made For,Bring Me The Horizon,253.8ø
Pray For Plague,Count Your Blessings,Bring Me The Horizon,261.7ø
Off The Heezay,Count Your Blessings,Bring Me The Horizon,338.9ø
Fifteen Fathoms_ Counting,Count Your Blessings,Bring Me The Horizon,116.8ø
Braille,Count Your Blessings,Bring Me The Horizon,269.6ø
Black & Blue,Count Your Blessings,Bring Me The Horizon,273.6ø
A Lot Like Vegas,Count Your Blessings,Bring Me The Horizon,129.9ø
[I Used To Make Out With] Medusa,Count Your Blessings,Bring Me The Horizon,339.0ø
This Mortal Soil (Album Version),Blood Mountain,Mastodon,300.5ø
The Wolf Is Loose (Album Version),Blood Mountain,Mastodon,216.0ø
Slickleg,Call of the Mastodon,Mastodon,209.9ø
Sleeping Giant (Album Version),Blood Mountain,Mastodon,336.3ø
Siberian Divide (Album Version),Blood Mountain,Mastodon,328.6ø
Pendulous Skin (Album Version),Blood Mountain,Mastodon,304.0ø
Hunters Of The Sky (Album Version),Blood Mountain,Mastodon,232.4ø
Hand Of Stone (Album Version),Blood Mountain,Mastodon,210.8ø
Colony Of Birchmen (Album Version),Blood Mountain,Mastodon,259.7ø
Circle Of Cysquatch [Live Version],The Wolf Is Loose,Mastodon,195.5ø
Circle Of Cysquatch (Album Version),Blood Mountain,Mastodon,199.2ø
Capillarian Crest [Live Version],The Wolf Is Loose,Mastodon,260.5ø
Capillarian Crest (Single Version),Capillarian Crest/Crystal Skull,Mastodon,262.5ø
Call of the Mastodon,Call of the Mastodon,Mastodon,219.2ø
Bladecatcher (Album Version),Blood Mountain,Mastodon,200.5ø
Spilt Needles [Alt Version],Phantom Limb,The Shins,147.3ø
Phantom Limb (Album),Phantom Limb,The Shins,287.5ø
Nothing At All,Phantom Limb,The Shins,249.9ø
Porcelain Heart (Acoustic Version),Another Journal Entry Expanded Edition,BarlowGirl,256.0ø
I Need You To Love Me (Acoustic Version),Another Journal Entry Expanded Edition,BarlowGirl,248.0ø
Wildcat,Classics,Ratatat,260.2ø
Tropicana,Classics,Ratatat,276.8ø
Tacobel Canon,Classics,Ratatat,266.8ø
Swisha,Classics,Ratatat,229.8ø
Nostrand,Classics,Ratatat,184.0ø
Montanita,Classics,Ratatat,300.3ø
Loud Pipes,Classics,Ratatat,226.5ø
Lex,Classics,Ratatat,269.7ø
Kennedy,Classics,Ratatat,214.7ø
Gettysburg,Classics,Ratatat,327.8ø
What's A Girl To Do?,Clara Sheller (Saison 2),Bat For Lashes,164.6ø
Trophy,Fur And Gold,Bat For Lashes,240.5ø
The Wizard,Fur And Gold,Bat For Lashes,256.8ø
Seal Jubilee,Fur And Gold,Bat For Lashes,284.2ø
Sarah,Fur And Gold,Bat For Lashes,236.7ø
You Decide,Don't Get Comfortable,Brandon Heath,230.0ø
The Light,Don't Get Comfortable,Brandon Heath,231.5ø
Steady Now,Don't Get Comfortable,Brandon Heath,219.0ø
Simple Man,Don't Get Comfortable,Brandon Heath,172.1ø
Red Sky,Don't Get Comfortable,Brandon Heath,269.5ø
Our God Reigns,Don't Get Comfortable,Brandon Heath,244.3ø
Let's Make It Last,The Way We Love,Brandon Heath,267.7ø
I'm Not Who I Was,Don't Get Comfortable,Brandon Heath,199.1ø
I Will Lay You Down,Don't Get Comfortable,Brandon Heath,185.9ø
Don't Get Comfortable,Don't Get Comfortable,Brandon Heath,192.2ø
Beauty Divine,Don't Get Comfortable,Brandon Heath,256.4ø
Two Receivers,Myths Of The Near Future,Klaxons,258.1ø
Totem On The Timeline,Myths Of The Near Future,Klaxons,161.1ø
Magick,Magick,Klaxons,218.4ø
It's Not Over Yet,NME Presents The Essential Bands,Klaxons,215.3ø
Hall Of Records,Magick,Klaxons,171.5ø
Gravity's Rainbow,Smashed,Klaxons,157.1ø
Atlantis To Interzone,Myths Of The Near Future,Klaxons,196.0ø
As Above So Below,Myths Of The Near Future,Klaxons,235.4ø
You Can't Be Missed If You Never Go Away,While The City Sleeps_ We Rule The Streets,Cobra Starship,201.2ø
The Ballad Of Big Poppa and Diamond Girl,While The City Sleeps_ We Rule The Streets,Cobra Starship,207.2ø
Pop-Punk Is Sooooo '05,While The City Sleeps_ We Rule The Streets,Cobra Starship,181.3ø
Keep It Simple,While The City Sleeps_ We Rule The Streets,Cobra Starship,250.0ø
It's Warmer In The Basement,While The City Sleeps_ We Rule The Streets,Cobra Starship,177.0ø
It's Amateur Night At The Apollo Creed!,While The City Sleeps_ We Rule The Streets,Cobra Starship,188.6ø
Tonight In Flames (Album Version),Thornography,Cradle Of Filth,355.9ø
Dirge Inferno (Album Version),Thornography,Cradle Of Filth,293.3ø
Steve Morris And Ian Curtis Interview,Let The Movie Begin,Joy Division,53.5ø
Accidental Babies,9,Damien Rice,393.9ø
Under Attack,Made In NYC,The Casualties,143.8ø
Social Outcast,Made In NYC,The Casualties,160.2ø
On City Streets,Made In NYC,The Casualties,162.2ø
In It For Life,Made In NYC,The Casualties,119.8ø
You Help Me Write This Song,Baby Makin' Music,The Isley Brothers | Ronald Isley,242.9ø
Forever Mackin',Baby Makin' Music,The Isley Brothers | Ronald Isley,261.1ø
Southern Hallelujah,Dangerous Man,Trace Adkins,250.7ø
I Came Here To Live,Dangerous Man,Trace Adkins,267.5ø
Wine In The Afternoon,Eleanor Put Your Boots On,Franz Ferdinand,262.9ø
What You Waiting For?,Live Lounge,Franz Ferdinand,204.0ø
The Fallen (Single Edit),The Fallen,Franz Ferdinand,166.3ø
The Fallen (Ruined By Justice),The Fallen,Franz Ferdinand,237.9ø
The Fallen (Live In Bologna),The Fallen,Franz Ferdinand,190.6ø
Jackie Jackson,Colours Are Brighter: Songs For Children - And Grown Ups Too,Franz Ferdinand,201.1ø
I'd Like To,Corinne Bailey Rae,Corinne Bailey Rae,248.7ø
Would That Make U Love Me,The Evolution of Robin Thicke,Robin Thicke,216.7ø
Wanna Love You Girl,The Evolution of Robin Thicke,Robin Thicke | Pharrell Williams,263.3ø
Teach U a Lesson,The Evolution of Robin Thicke,Robin Thicke,268.7ø
Shooter,The Evolution of Robin Thicke,Robin Thicke | Lil Wayne,277.2ø
Lost Without U,Chilled R&B Volume II,Robin Thicke,250.8ø
Lonely World,The Evolution of Robin Thicke,Robin Thicke,261.2ø
I Need Love,The Evolution of Robin Thicke,Robin Thicke,295.6ø
Got 2 Be Down,The Evolution of Robin Thicke,Robin Thicke | Faith Evans,273.3ø
Everything I Can't Have,The Evolution of Robin Thicke,Robin Thicke,203.9ø
Complicated,The Evolution of Robin Thicke,Robin Thicke,253.5ø
Cocaine,The Evolution of Robin Thicke,Robin Thicke,210.5ø
Can U Believe,The Evolution of Robin Thicke,Robin Thicke,292.0ø
Ask Myself,The Evolution of Robin Thicke,Robin Thicke,227.5ø
Angels,The Evolution of Robin Thicke,Robin Thicke,515.2ø
All Night Long,The Evolution of Robin Thicke,Robin Thicke,221.2ø
2 The Sky,The Evolution of Robin Thicke,Robin Thicke,365.8ø
Where Did My Baby Go,Once Again,John Legend,303.1ø
Show Me,Once Again,John Legend,298.5ø
Save Room,Live From Philadelphia,John Legend,244.7ø
P.D.A. (We Just Don't Care),Once Again,John Legend,278.8ø
Out Of Sight,Save Room,John Legend,251.8ø
Maxine's Interlude,Once Again,John Legend,110.5ø
Maxine,Once Again,John Legend,267.0ø
King & Queen,Reflections - A Retrospective,Mary J. Blige | John Legend,226.0ø
Heaven,Got Snow?,Re-up Gang,250.1ø
Each Day Gets Better,Once Again,John Legend,227.9ø
Coming Home,Live From Philadelphia,John Legend,323.5ø
My Grilfriends Girlfriend - Album Version,The Best Of Type O Negative,Type O Negative,226.5ø
Highway Star (Album Version),The Best Of Type O Negative,Type O Negative,356.5ø
The Rest Of My Life (Album Version),Ten,Brian McKnight,284.8ø
Shoulda Been Lovin' You (Album Version),Ten,Brian McKnight,304.2ø
Red_ White_ And Blue [With Rascal Flatts] (Album Version),Ten,Brian McKnight,287.5ø
Holdin' On [Missin' U] (Album Version),Ten,Brian McKnight,279.4ø
Don't Take Your Love Away (Album Version),Ten,Brian McKnight,243.0ø
Again (Album Version),Ten,Brian McKnight,277.9ø
A Little Too Late (Album Version),Ten,Brian McKnight,293.8ø
Ghost of York,The Circles EP,As Tall As Lions,248.8ø
Caroline (Album Version),Chicago XXX,Chicago,218.6ø
Turn This Car Around (Album Version),Highway Companion,Tom Petty,238.4ø
This Old Town (Album Version),Highway Companion,Tom Petty,255.8ø
The Golden Rose (Album Version),Highway Companion,Tom Petty,283.0ø
Square One (Album Version),Highway Companion,Tom Petty,204.8ø
Saving Grace (Album Version),Highway Companion,Tom Petty,226.0ø
Night Driver (Album Version),Highway Companion,Tom Petty,267.3ø
Jack (Album Version),Highway Companion,Tom Petty,148.6ø
Flirting With Time (Album Version),Highway Companion,Tom Petty,194.5ø
Down South (Album Version),Highway Companion,Tom Petty,205.3ø
Damaged By Love (Album Version),Highway Companion,Tom Petty,203.0ø
Big Weekend (Album Version),Highway Companion,Tom Petty,195.4ø
Ankle Deep (Album Version),Highway Companion,Tom Petty,203.2ø
You Create,Karmacode,Lacuna Coil,92.1ø
LAST DAYS OF SUMMER (LP Version),18 CANDLES: THE EARLY YEARS,Silverstein,266.0ø
BLEEDS NO MORE (LP Version),18 CANDLES: THE EARLY YEARS,Silverstein,197.4ø
The Negotiator,Don't Close Your Eyes,Parkway Drive,221.8ø
Hollow Man,Don't Close Your Eyes,Parkway Drive,144.6ø
Emotional Breakdown,Don't Close Your Eyes,Parkway Drive,154.4ø
Tales,Wolfmother,Wolfmother,218.2ø
Love Train,Lifestyle2 - Dance Grooves Vol 2,Wolfmother,344.0ø
Joker And The Thief,Joker And The Thief,Wolfmother,280.9ø
Sonsoneo,Top Of The Line,Tito El Bambino,202.3ø
Sera,Top Of The Line,Tito El Bambino,291.9ø
Mi Chica Rebelde,Top Of The Line,Tito El Bambino,193.0ø
Me Tiemblan Las Manos,Top Of The Line,Tito El Bambino,162.2ø
Me Da Miedo,Top Of The Line,Tito El Bambino,165.3ø
Maximo,Top Of The Line,Tito El Bambino,184.3ø
Grito Latino,Top Of The Line,Tito El Bambino,181.9ø
Flow Natural,Top Of The Line,Tito El Bambino Featuring Beenie Man & Ines,173.9ø
The Itch,The Great Cold Distance,Katatonia,260.4ø
Soil's Song,The Great Cold Distance,Katatonia,252.2ø
Rusted,The Great Cold Distance,Katatonia,261.1ø
Leaders,The Great Cold Distance,Katatonia,260.9ø
Increase,The Great Cold Distance,Katatonia,260.0ø
In The White,The Great Cold Distance,Katatonia,293.6ø
Follower,The Great Cold Distance,Katatonia,285.6ø
Consternation,The Great Cold Distance,Katatonia,230.7ø
The River,The River,Live,179.1ø
Story To Tell,Story To Tell,Fat Joe,317.1ø
Walking On Water,This Providence,This Providence,156.2ø
The Road To Jericho Is Lined With Starving People,This Providence,This Providence,190.4ø
The Pursuit Of Happiness: 2nd Movement,This Providence,This Providence,147.5ø
The Pursuit Of Happiness: 1st Movement,This Providence,This Providence,205.7ø
Secret Love And The Fastest Way To Loneliness,This Providence,This Providence,179.6ø
Patience,This Providence,This Providence,226.4ø
My Beautiful Rescue,This Providence,This Providence,156.6ø
Losing Control,This Providence,This Providence,254.5ø
Anything Is Possible,This Providence,This Providence,198.5ø
An Ocean Between,This Providence,This Providence,169.4ø
A Wolf In Sheep's Clothing,This Providence,This Providence,190.6ø
...But What Will They Say,This Providence,This Providence,142.1ø
Oh Yeah (Album Version),Young For Eternity,The Subways,178.8ø
Another Sunny Day,The Life Pursuit,Belle & Sebastian,244.4ø
Young Blood Spills Tonight,Reach,Eyes Set to Kill,268.4ø
Liar in the Glass,Reach,Eyes Set to Kill,238.1ø
Interlude,The World Outside,Eyes Set to Kill,59.8ø
Darling,Reach,Eyes Set to Kill,244.8ø
Put Your Dukes Up John,Leave Before The Lights Come On,Arctic Monkeys,184.0ø
Despair In The Departure Lounge,Who The F*** Are Arctic Monkeys?,Arctic Monkeys,204.9ø
The Glide,4:21...The Day After,Method Man | Raekwon | La The Darkman,185.3ø
Say,4:21...The Day After,Method Man,229.5ø
Problem,4:21...The Day After,Method Man,210.3ø
Pimpin' (Skit),4:21...The Day After,Method Man,31.9ø
U R The One,TRUE MAGIC,Mos Def,238.4ø
Lifetime,TRUE MAGIC,Mos Def,347.1ø
Dollar Day,TRUE MAGIC,Mos Def,314.5ø
The Book I Write,Music From The Motion Picture Stranger Than Fiction,Spoon,133.7ø
Her Man,Greatest Hits,Gary Allan,163.7ø
Bring It (Snakes On A Plane),While The City Sleeps_ We Rule The Streets,Cobra Starship,194.9ø
You're Not Alone,Saosin,Saosin,238.1ø
Voices (Album Fade),Voices,Saosin,225.4ø
Some Sense Of Security,Saosin,Saosin,240.2ø
Sleepers,Saosin,Saosin,171.9ø
Seven Years (Live),Voices,Saosin,202.8ø
Let Go Control,Voices,Saosin,177.6ø
It's So Simple,Saosin,Saosin,168.8ø
It's Far Better To Learn,Saosin,Saosin,234.6ø
I Never Wanted To,Saosin,Saosin,209.2ø
Finding Home,Saosin,Saosin,189.3ø
Come Close,Saosin,Saosin,195.9ø
Collapse,Saosin,Saosin,195.2ø
Pop Song 2006,Razorlight,Razorlight,160.6ø
Los Angeles Waltz,Razorlight,Razorlight,279.9ø
In The Morning,In The Morning,Razorlight,239.0ø
I Can't Stop This Feeling I've Got,Razorlight,Razorlight,205.7ø
Hold On,NME Presents The Essential Bands,Razorlight,197.2ø
Doctor_ Doctor,In The Morning,Razorlight,236.9ø
Before I Fall To Pieces,Before I Fall To Pieces,Razorlight,209.1ø
Back To The Start,Razorlight,Razorlight,192.3ø
Libertina Grimm (Album Version),Thornography,Cradle Of Filth,351.3ø
Yee [Featuring Too $hort & Budda] (Amended Album Version),My Ghetto Report Card,E-40,273.8ø
Yay Area (Album Version),My Ghetto Report Card,E-40,235.1ø
Sick Wid It II [Featuring Turf Talk] (Album Version),My Ghetto Report Card,E-40,208.4ø
Muscle Cars [Featuring Keak Da Sneak & Turf Talk] (Album Version),My Ghetto Report Card,E-40,242.3ø
Happy To Be Here [Featuring Bosko & D.D. Artis] (Amended Album Version),My Ghetto Report Card,E-40,209.4ø
Gimme Head [Featuring Al Kapone & Bosko] (Album Version),My Ghetto Report Card,E-40,361.5ø
Block Boi [Featuring Miko & Stressmatic Of The Federation] (Amended Album Version),My Ghetto Report Card,E-40,226.4ø
Yellow Sun,Broken Boy Soldier,The Raconteurs,197.7ø
Broken Boy Soldier (Live),Broken Boy Soldier,The Raconteurs,275.8ø
Broken Boy Soldier (KCRW Version),Broken Boy Soldier,The Raconteurs,230.6ø
Broken Boy Soldier,Broken Boy Soldier,The Raconteurs,184.2ø
Blue Veins (KCRW Version),Broken Boy Soldier,The Raconteurs,271.1ø
Shallow Brown,Rogues Gallery; Pirate Ballads_ Sea Songs & Chanteys,Sting,149.6ø
Hey Jealousy,Punk Goes 90s,Hit The Lights,178.3ø
Wanna Play,Rebels,RBD,220.3ø
Tu Dulce Voz,Celestial Fan Edition,RBD,198.3ø
Ser O Parecer,Celestial,RBD,210.6ø
RBD English Snippet,Celestial (International Version),RBD,120.2ø
Quisiera Ser,Celestial Fan Edition,RBD,247.7ø
Keep It Down Low,Rebels,RBD,215.6ø
Es Por Amor,Celestial,RBD,196.3ø
Aburrida Y Sola,Celestial Fan Edition,RBD,233.4ø
Nothing In This World (Album Version),Paris,Paris Hilton,192.7ø
When We Die,The Great Burrito Extortion Case,Bowling For Soup,255.2ø
Val Kilmer,The Great Burrito Extortion Case,Bowling For Soup,211.8ø
Luckiest Loser,The Great Burrito Extortion Case,Bowling For Soup,227.9ø
Friends Like You,The Great Burrito Extortion Case,Bowling For Soup,150.8ø
Sol Tapado,Silencio= Muerte: Red Hot + Latin Redux,Thievery Corporation,239.6ø
Omid,The Richest Man In Babylon,Thievery Corporation,228.0ø
Your Song,Tales Told By Dead Friends,Mayday Parade,237.6ø
Three Cheers For Five Years,Tales Told By Dead Friends,Mayday Parade,340.0ø
The Last Something That Meant Anything,Tales Told By Dead Friends,Mayday Parade,294.1ø
One Man Drinking Games,Tales Told By Dead Friends,Mayday Parade,279.5ø
Just Say You're Not Into It,Tales Told By Dead Friends,Mayday Parade,261.9ø
You Are the Moon (Album Version),Like Vines,The Hush Sound,207.9ø
Wine Red (Tommie Sunshine's Brooklyn Fire Retouch),Like Vines,The Hush Sound,154.2ø
Where We Went Wrong (Album Version),Like Vines,The Hush Sound,211.4ø
We Intertwined (Album Version),We Intertwined,The Hush Sound,196.3ø
Sweet Tangerine (Album Version),Like Vines,The Hush Sound,183.2ø
Out Through the Curtain (Album Version),Like Vines,The Hush Sound,207.3ø
Magnolia (Album Version),Like Vines,The Hush Sound,229.1ø
Lions Roar (Album Version),Like Vines,The Hush Sound,172.1ø
Lighthouse (Album Version),Like Vines,The Hush Sound,179.3ø
Don't Wake Me Up (Album Version),Like Vines,The Hush Sound,221.1ø
A Dark Congregation (Album Version),Like Vines,The Hush Sound,192.5ø
Wolves At Night,Wolves At Night,Manchester Orchestra,244.9ø
Where Have You Been?,I'm Like A Virgin Losing A Child,Manchester Orchestra,374.9ø
The Neighborhood Is Bleeding,I'm Like A Virgin Losing A Child,Manchester Orchestra,168.8ø
Sleeper 1972,I'm Like A Virgin Losing A Child,Manchester Orchestra,248.3ø
Now That You're Home,I'm Like A Virgin Losing A Child,Manchester Orchestra,187.6ø
I Can Feel Your Pain,I'm Like A Virgin Losing A Child,Manchester Orchestra,172.5ø
Golden Ticket,I'm Like A Virgin Losing A Child,Manchester Orchestra,211.4ø
Don't Let Them See You Cry,I'm Like A Virgin Losing A Child,Manchester Orchestra,104.9ø
Twenty-Twenty Surgery (Album Version),Louder Now,Taking Back Sunday,235.1ø
What If You,Catch And Release,Joshua Radin,273.5ø
These Photographs,We Were Here,Joshua Radin,205.8ø
The Fear You Won't Fall,Unclear Sky,Joshua Radin,182.6ø
Sundrenched World,We Were Here,Joshua Radin,268.5ø
Star Mile,We Were Here,Joshua Radin,242.0ø
Someone Else's Life,We Were Here,Joshua Radin,211.3ø
Only You,We Were Here,Joshua Radin,149.0ø
