Tilting The Hourglass,On Frail Wings of Vanity And Wax,Alesana,228.7ø
This Conversation is Over,On Frail Wings of Vanity And Wax,Alesana,203.7ø
The Third Temptation Of Paris,On Frail Wings of Vanity And Wax,Alesana,222.5ø
The Last Three Letters,On Frail Wings of Vanity And Wax,Alesana,212.9ø
Pathetic_ Ordinary,On Frail Wings of Vanity And Wax,Alesana,240.5ø
Necro's Decay,On Frail Wings of Vanity And Wax,Alesana,266.0ø
Early Mourning (Bonus Track),On Frail Wings of Vanity And Wax,Alesana,234.1ø
Daggers Speak Louder Than Words,On Frail Wings of Vanity And Wax,Alesana,207.4ø
Apology (Acoustic),On Frail Wings of Vanity And Wax,Alesana,240.9ø
Ambrosia,On Frail Wings of Vanity And Wax,Alesana,185.3ø
Alchemy Sounded Good At the Time,On Frail Wings of Vanity And Wax,Alesana,253.9ø
A Siren's Soliloquy,On Frail Wings of Vanity And Wax,Alesana,240.7ø
Through Glass (Album Version),Come What[ever] May,Stone Sour,283.0ø
sillyworld (Album Version),Come What[ever] May,Stone Sour,250.1ø
Fruitcake,Come What[ever] May,Stone Sour,240.3ø
Questions,Sing-A-Longs & Lullabies For The Film Curious George,Jack Johnson,249.0ø
Broken,Sing-A-Longs & Lullabies For The Film Curious George,Jack Johnson,234.7ø
What Child Is This?,Christmas Offerings,Third Day,210.9ø
O Come All Ye Faithful,Christmas Offerings,Third Day,231.2ø
Merry Christmas,Christmas Offerings,Third Day,390.1ø
Joy To The World,Christmas Offerings,Third Day,216.0ø
Jesus_ Light Of The World,Christmas Offerings,Third Day,235.6ø
Born In Bethlehem,Christmas Offerings,Third Day,222.4ø
Away In A Manger,Christmas Offerings,Third Day,234.7ø
Angels We Have Heard On High,Christmas Offerings,Third Day,227.4ø
Reinvention (Re-Recorded),A Long March: The First Recordings,As I Lay Dying,298.2ø
Forever (Re-Recorded),A Long March: The First Recordings,As I Lay Dying,282.3ø
Invisible Monsters,Commit This To Memory Deluxe Version,Motion City Soundtrack,237.1ø
Youth,Youth,Matisyahu,258.7ø
WP,Youth (Best Buy Version),Matisyahu,238.9ø
What I'm Fighting For,Youth (Best Buy Version),Matisyahu,130.1ø
Unique Is My Dove,Youth,Matisyahu,203.3ø
Time Of Your Song,Youth,Matisyahu,266.3ø
Shalom/Saalam,Youth,Matisyahu,64.0ø
Jerusalem,Youth,Matisyahu,240.2ø
Indestructible,Youth,Matisyahu,248.9ø
Fire Of Heaven / Altar Of Earth,Youth (Best Buy Version),Matisyahu,239.0ø
Dispatch The Troops,Youth,Matisyahu,244.4ø
Ancient Lullaby,Youth (Best Buy Version),Matisyahu,257.7ø
The Longest Lasting Statement,Redeemer,Norma Jean,167.9ø
The End Of All Things Will Be Televised,Redeemer,Norma Jean,311.5ø
Songs Sound Much Sadder,This Is Solid State Vol. 6,Norma Jean,184.1ø
Like Swimming Circles,Redeemer,Norma Jean,184.3ø
Cemetery Like A Stage,Redeemer,Norma Jean,266.8ø
Blueprints For Future Homes,Redeemer,Norma Jean,169.1ø
A Temperamental Widower,Redeemer,Norma Jean,166.6ø
A Small Spark vs. A Great Forest,Redeemer,Norma Jean,299.3ø
A Grand Scene For A Color Film,Redeemer,Norma Jean,204.0ø
I'll Try,Tinker Bell And The Lost Treasure,Jesse McCartney,229.8ø
Until The End Of Time,Until The End Of Time - Duet with Beyonce,Justin Timberlake duet with Beyonce,322.2ø
Summer Love,FutureSex/LoveSounds,Justin Timberlake,253.0ø
You're Ever So Inviting,This Is Solid State Vol. 6,Underoath,242.5ø
To Whom It May Concern (Define The Great Line Album Version),Define The Great Line,Underoath,422.8ø
There Could Be Nothing After This,Define The Great Line,Underoath,177.1ø
Salmarnir,Define The Great Line,Underoath,177.3ø
Returning Empty Handed,Define The Great Line,Underoath,267.2ø
Moving for the Sake of Motion,Define The Great Line,Underoath,195.5ø
In Regards to Myself,Define The Great Line,Underoath,204.3ø
Everyone Looks So Good From Here,Define The Great Line,Underoath,176.1ø
Casting Such A Thin Shadow,Define The Great Line,Underoath,373.8ø
A Moment Suspended In Time,Define The Great Line,Underoath,239.9ø
You Stand By Me,Endless Wire,The Who,96.0ø
Trilby's Piano,Endless Wire,The Who,124.9ø
Endless Wire,Endless Wire,The Who,111.9ø
A Man In A Purple Dress,Endless Wire,The Who,254.9ø
Sunshine (Album Version),15,Buckcherry,252.7ø
So Far (Album Version),15,Buckcherry,199.0ø
Out of Line (Album Version),15,Buckcherry,262.5ø
On Set (Explicit),15,Buckcherry,215.7ø
Next 2 You (Album Version),15,Buckcherry,208.7ø
Everything (Album Version),15,Buckcherry,263.4ø
Crazy Bitch (Album Version),15,Buckcherry,201.8ø
Brooklyn (Album Version),15,Buckcherry,239.5ø
Miami 2017 (I've Seen The Lights Go Out On Broadway),Turnstiles,Billy Joel,315.0ø
Freaky Gurl,Hip Hop Raw and Uncut Live,Gucci Mane,208.0ø
Under The Knife,The Sufferer & The Witness,Rise Against,165.1ø
The Good Left Undone,The Sufferer & The Witness,Rise Against,181.4ø
The Approaching Curve,The Sufferer & The Witness,Rise Against,224.7ø
Survive,The Sufferer & The Witness,Rise Against,221.5ø
Roadside,The Sufferer & The Witness,Rise Against,201.0ø
Intro/Chamber The Cartridge,The Sufferer & The Witness,Rise Against,214.9ø
Injection,The Sufferer & The Witness,Rise Against,199.2ø
But Tonight We Dance,This Is Noise,Rise Against,167.7ø
Bricks,The Sufferer & The Witness,Rise Against,90.8ø
Boy's No Good,Audience Of One,Rise Against,78.6ø
Behind Closed Doors,The Sufferer & The Witness,Rise Against,195.1ø
Truly_ Madly_ Deeply,Truly Madly Deeply,Cascada,367.8ø
Truly Madly Deeply,Truly Madly Deeply,Cascada,177.1ø
Ready For Love,Everytime We Touch,Cascada,207.0ø
Can't Stop The Rain,Everytime We Touch,Cascada,212.4ø
Another You,Everytime We Touch,Cascada,221.3ø
Maybellene (Live),Hound Dog,Elvis Presley,115.0ø
The Pain Of Separation (Re-Recorded),A Long March: The First Recordings,As I Lay Dying,176.1ø
When The Deal Goes Down,Modern Times,Bob Dylan,304.2ø
Someday Baby,Tell Tale Signs: The Bootleg Series Vol. 8,Bob Dylan,355.8ø
Zero,Smile_ It's The End Of The World,Hawk Nelson,278.6ø
The One Thing I Have Left,Tooth & Nail Ultimate Collection,Hawk Nelson,186.5ø
It's Over,Smile_ It's The End Of The World,Hawk Nelson,186.7ø
Head On Collision,Smile_ It's The End Of The World,Hawk Nelson,247.4ø
Everything You Ever Wanted,Charlotte's Web (OST),Hawk Nelson,244.2ø
Alleluia,Gloria EP,Hawk Nelson,255.4ø
Love Again,Everytime We Touch,Cascada,211.1ø
Kids In America,Everytime We Touch,Cascada,184.4ø
Maniacal,Kill,Cannibal Corpse,132.6ø
Give A Little Bit (Album Version),Let Love In,Goo Goo Dolls,215.9ø
Where The Red Fern Grows,Sonic Youth,Sonic Youth,347.4ø
Rats,Rather Ripped,Sonic Youth,264.6ø
Queen Anne Chair,The Destroyed Room,Sonic Youth,278.0ø
Golden Skans,Golden Skans,Klaxons,270.4ø
Four Horsemen Of 2012,Myths Of The Near Future,Klaxons,138.0ø
Grew Up Hard,More Fish,Ghostface Killah | Trife Da God | Solomon Childs,287.5ø
Blue Armor,More Fish,Ghostface Killah | Sheek Louch,188.5ø
Wait [Demo Version],Can't Catch Tomorrow,Lostprophets,235.8ø
The New Transmission,Liberation Transmission,Lostprophets,213.0ø
Rooftops,Liberation Transmission,Lostprophets,251.5ø
Heaven For The Weather_ Hell For The Company,Liberation Transmission,Lostprophets,253.6ø
For All These Times Kid_ For All These Times,Liberation Transmission,Lostprophets,234.5ø
Fight [Demo Version],Can't Catch Tomorrow,Lostprophets,240.6ø
Everybody's Screaming!!!,Liberation Transmission,Lostprophets,232.9ø
Can'T Stop_ Gotta Date With Hate,Liberation Transmission,Lostprophets,222.9ø
Can't Catch Tomorrow [Live From Norwich ],Can't Catch Tomorrow,Lostprophets,225.8ø
Can't Catch Tomorrow [Live From Cardiff],Can't Catch Tomorrow,Lostprophets,220.5ø
Can't Catch Tomorrow [Live From Brixton Academy],Can't Catch Tomorrow,Lostprophets,226.6ø
Broken Hearts_ Torn Up Letters And The Story Of A Lonely Girl,Liberation Transmission,Lostprophets,244.0ø
Always All Ways [apologies_ Glances And Messed Up Chances],Liberation Transmission,Lostprophets,266.7ø
Have Yourself A Merry Little Christmas,Wintersong,Sarah McLachlan,223.7ø
Yr City's A Sucker,Introns,LCD Soundsystem,328.1ø
Tribulations (Lindstrom Mix),Introns,LCD Soundsystem,475.8ø
Thrills (XFM Session),Introns,LCD Soundsystem,211.7ø
On Repeat (XFM Session),Introns,LCD Soundsystem,408.0ø
En Su Nota,King Of Kings,Don Omar | Mackie Ranks,219.4ø
The World Around You,The Paramour Sessions,Papa Roach,275.4ø
Alive,The Paramour Sessions,Papa Roach,202.2ø
Last Trip (In Flight),Empire,Kasabian,172.7ø
Empire,Live Lounge 2,Kasabian,181.9ø
Shoulders & Arms,A Lesson In Crime,Tokyo Police Club,159.3ø
Nature of the Experiment,A Lesson In Crime,Tokyo Police Club,121.9ø
La Ferrassie,A Lesson In Crime,Tokyo Police Club,170.8ø
If It Works,Live at Lollapalooza 2007: Tokyo Police Club,Tokyo Police Club,131.7ø
Citizens Of Tomorrow,A Lesson In Crime,Tokyo Police Club,166.1ø
Cheer It On,Live at Lollapalooza 2007: Tokyo Police Club,Tokyo Police Club,167.5ø
Box,Live at Lollapalooza 2007: Tokyo Police Club,Tokyo Police Club,130.9ø
Be Good,A Lesson In Crime,Tokyo Police Club,124.8ø
Beat Up On Yo Pads,Tha Blue Carpet Treatment,Snoop Dogg,177.7ø
The Yeah Yeah Yeah Song (In Anatropous Reflex),The W.A.N.D.,The Flaming Lips,261.1ø
The Wizard Turns On... (Album Version),At War With The Mystics,The Flaming Lips,221.2ø
I'm Afraid Of Dying...Aren't You?? (Non-Album Track),It Overtakes Me,The Flaming Lips,248.1ø
You Are Mine (Album Version),Mutemath,Mutemath,283.7ø
Typical [Live],Mutemath,Mutemath,265.3ø
Typical (Album Version),Mutemath,Mutemath,252.3ø
Stare At The Sun (Album Version),Mutemath,Mutemath,273.0ø
Stall Out (Album Version),Mutemath,Mutemath,426.7ø
Reset (Album Version),Mutemath,Mutemath,325.7ø
Plan B (Album Version),Mutemath,Mutemath,286.9ø
Picture (Album Version),Mutemath,Mutemath,326.4ø
Obsolete (Album Version),Mutemath,Mutemath,270.4ø
Noticed [Live Version],Mutemath,Mutemath,369.9ø
Noticed (Album Version),Mutemath,Mutemath,269.9ø
Control [Live Version],Mutemath,Mutemath,409.1ø
Control (Album Version),Mutemath,Mutemath,279.4ø
Collapse [Live Version],Mutemath,Mutemath,113.0ø
Collapse (Album Version),Mutemath,Mutemath,73.0ø
Chaos (Album Version),Mutemath,Mutemath,295.0ø
Break The Same [Live Version],Mutemath,Mutemath,569.2ø
Break The Same (Album Version),Mutemath,Mutemath,360.1ø
After We Have Left Our Homes (Album Version),Mutemath,Mutemath,74.8ø
NY NY,Rotten Apple,Lloyd Banks | Tony Yayo,209.8ø
Where The Falls Begin,Everglow_ The (Deluxe Edition),Mae,220.7ø
Suspension (Demo),The Everglow EP,Mae,229.6ø
A Day In The Life,Everglow_ The (Deluxe Edition),Mae,280.1ø
Inside Job,Pearl Jam,Pearl Jam,428.6ø
Skeleton Christ,Christ Illusion,Slayer,262.2ø
Jihad,Christ Illusion,Slayer,210.9ø
Consfearacy,Christ Illusion,Slayer,186.4ø
Catatonic,Christ Illusion,Slayer,293.2ø
Follow And Feel,Saosin,Saosin,199.1ø
Suffer Well (Single Version),Suffer Well,Depeche Mode,171.0ø
Suffer Well (Narcotic Thrust Vocal Dub),Suffer Well,Depeche Mode,404.6ø
Suffer Well (M83 Remix),Suffer Well,Depeche Mode,273.2ø
Suffer Well (Live In Milan),Touring The Angel: Live In Milan,Depeche Mode,221.2ø
Precious (Live In Milan),Touring The Angel: Live In Milan,Depeche Mode,278.3ø
Martyr (Radio Version),Martyr,Depeche Mode,187.5ø
Martyr (Alex Smoke Bare Bones Edit),Martyr,Depeche Mode,189.0ø
John The Revelator (Single Version),John The Revelator,Depeche Mode,198.2ø
John The Revelator (Live In Milan),Touring The Angel: Live In Milan,Depeche Mode,214.2ø
John The Revelator (James T. Cotton Dub),John The Revelator,Depeche Mode,364.5ø
John The Revelator (Bill Hamel's Audio Magnetics Edit),John The Revelator (Bill Hamel's Audio Magnetics Edit),Depeche Mode,282.0ø
I Want It All (Live In Milan),Touring The Angel: Live In Milan,Depeche Mode,288.7ø
Better Days (Basteroid 'Dance Is Gone' Vocal Mix),Suffer Well,Depeche Mode,431.3ø
A Pain That I'm Used To (Live In Milan),Touring The Angel: Live In Milan,Depeche Mode,261.1ø
You Can Bring Me Flowers,Till The Sun Turns Black,Ray LaMontagne,254.4ø
Within You,Till The Sun Turns Black,Ray LaMontagne,343.2ø
Till The Sun turns Black,Till The Sun Turns Black,Ray LaMontagne,268.9ø
Three More Days,Till The Sun Turns Black,Ray LaMontagne,216.8ø
Lesson Learned,Till The Sun Turns Black,Ray LaMontagne,278.7ø
Gone Away From Me,Till The Sun Turns Black,Ray LaMontagne,265.4ø
Can I Stay,Till The Sun Turns Black,Ray LaMontagne,219.6ø
Be Here Now,Till The Sun Turns Black,Ray LaMontagne,383.1ø
Barfly,Till The Sun Turns Black,Ray LaMontagne,235.2ø
WISH I COULD FORGET YOU (LP Version),18 CANDLES: THE EARLY YEARS,Silverstein,216.6ø
WAITING FOUR YEARS (LP Version),18 CANDLES: THE EARLY YEARS,Silverstein,242.8ø
SUMMERS STELLAR GLAZE,18 CANDLES: THE EARLY YEARS,Silverstein,167.2ø
SMILE IN YOUR SLEEP (Remix),18 CANDLES: THE EARLY YEARS,Silverstein,275.0ø
Red Light Pledge (LP Version),18 CANDLES: THE EARLY YEARS,Silverstein,231.2ø
MY HERIONE (Acoustic Version),18 CANDLES: THE EARLY YEARS,Silverstein,214.0ø
MY CONSOLATION (LP Version),18 CANDLES: THE EARLY YEARS,Silverstein,242.8ø
FRIENDS IN FALL RIVER  (LP Version),18 CANDLES: THE EARLY YEARS,Silverstein,181.8ø
FOREVER AND A DAY  (LP Version),18 CANDLES: THE EARLY YEARS,Silverstein,267.3ø
DISCOVERING THE WATERFRONT (LP Version),18 CANDLES: THE EARLY YEARS,Silverstein,285.9ø
DEFEND YOU (Live Version),18 CANDLES: THE EARLY YEARS,Silverstein,214.9ø
CALL IT KARMA (Acoustic),18 CANDLES: THE EARLY YEARS,Silverstein,258.5ø
BLEEDS NO MORE (Live Version),18 CANDLES: THE EARLY YEARS,Silverstein,256.5ø
Stop The Dams,D-Sides,Gorillaz,336.9ø
Kids With Guns (Hot Chip Remix),D-Sides,Gorillaz,429.7ø
Hong Kong (Live At Manchester Opera House),D-Sides,Gorillaz,397.7ø
This Is Halloween,Nightmare Before Christmas,Panic! At The Disco,216.8ø
The Only Difference Between Martyrdom and Suicide Is Press Coverage (Tommie Sunshine Brooklyn Fire Remix),Snakes On A Plane [OST],Panic! At The Disco,215.9ø
Nails For Breakfast_ Tacks For Snacks (demo) (unreleased),I Write Sins Not Tragedies,Panic! At The Disco,233.6ø
I Write Sins Not Tragedies (MTV VMA Performance 2006),I Write Sins Not Tragedies,Panic! At The Disco,212.3ø
I Write Sins Not Tragedies (Album Version),I Write Sins Not Tragedies,Panic! At The Disco,186.6ø
I Write Sins Not Tragedies (91X Acoustic Version),But It's Better If You Do,Panic! At The Disco,188.4ø
This Is The Life,Hannah Montana - The Collection,Hannah Montana,177.1ø
The Other Side Of Me,Disney Singalong - Hannah Montana,Helen Darling|Taylor Seyer,194.2ø
The Best Of Both Worlds,Hannah Montana - The Collection,Hannah Montana,174.0ø
Pumpin' Up The Party,Disney Singalong - Hannah Montana,Hallie Seyer|Helen Darling,191.6ø
Just Like You,Hannah Montana - The Collection,Hannah Montana,193.9ø
If We Were A Movie,Disney Singalong - Hannah Montana,Helen Darling,185.2ø
What You Believe In,Beautiful World,Take That,272.8ø
Like I Never Loved You At All,Beautiful World,Take That,225.0ø
Black Hole Sun,Punk Goes 90s,Copeland,271.1ø
Xerces (Album Version),Saturday Night Wrist,Deftones,221.8ø
U_U_D_D_L_R_L_R_A_B_Select_Start (Album Version),Saturday Night Wrist,Deftones,252.5ø
Rats!Rats!Rats! (Amended Version),Saturday Night Wrist,Deftones,240.8ø
Rapture (Amended Version),Saturday Night Wrist,Deftones,205.3ø
Pink Cellphone (Amended Version),Saturday Night Wrist,Deftones,234.4ø
Kimdracula (Album Version),Saturday Night Wrist,Deftones,194.3ø
Hole In The Earth (Album Version),Saturday Night Wrist,Deftones,251.6ø
Drive [Bonus Track],Saturday Night Wrist,Deftones,290.7ø
Combat (Album Version),Saturday Night Wrist,Deftones,286.2ø
Cherry Waves (Album Version),Saturday Night Wrist,Deftones,317.7ø
Beware (Album Version),Saturday Night Wrist,Deftones,360.7ø
Who Is Watching,Armada Trance Tunes Vol. 2,Armin van Buuren feat. Nadia Ali,469.0ø
Sail,"Armin Only - Imagine ""The Music",Armin van Buuren,548.7ø
Communication Part 3,Godskitchen Pure Trance Classics,Armin van Buuren,507.9ø
High Heel Sneakers,The Complete Motown Singles_ Volume 5: 1965,Stevie Wonder,184.5ø
What Are We Doing,21,Omarion,233.4ø
Obsession,21,Omarion,253.4ø
Midnight,21,Omarion,239.0ø
Made For TV,21,Omarion,286.2ø
Just That Sexy,21,Omarion,228.2ø
Just Can't Let You Go,21,Omarion,183.5ø
Ice Box,R&B Love Collection 08,Omarion,257.0ø
Entourage,Entourage,Omarion,233.7ø
Electric,21,Omarion,205.2ø
Do It,21,Omarion,234.8ø
Beg For It,21,Omarion,177.0ø
Been With A Star,21,Omarion,198.3ø
What A Friend We Have In Jesus,Precious Memories,Alan Jackson,134.0ø
The Old Rugged Cross,Precious Memories,Alan Jackson,184.8ø
Softly And Tenderly,Precious Memories,Alan Jackson,196.4ø
Had It Not Been You,Like Red On A Rose,Alan Jackson,241.7ø
'Tis So Sweet To Trust In Jesus,Precious Memories,Alan Jackson,110.6ø
Spellbound (By The Devil) (Live),Godless Savage Garden - Deluxe Edition,Dimmu Borgir,285.4ø
Wait A Minute,Like Red On A Rose,Alan Jackson,262.6ø
Turn Your Eyes Upon Jesus,Precious Memories,Alan Jackson,224.5ø
Standing On The Promises,Precious Memories,Alan Jackson,93.8ø
Like Red On A Rose,Like Red On A Rose,Alan Jackson,213.3ø
In The Garden,Precious Memories,Alan Jackson,173.0ø
Don't Change On Me,Like Red On A Rose,Alan Jackson,206.3ø
Blessed Assurance,How Great Thou Art: Gospel Favorites Live From The Grand Ole Opry,Alan Jackson,146.8ø
As Lovely As You,Like Red On A Rose,Alan Jackson,246.6ø
Anywhere On Earth You Are,Like Red On A Rose,Alan Jackson,254.1ø
A Feelin' Like That,Greatest Hits,Gary Allan,210.6ø
When I Go Out_ I Want To Go Out On A Chariot Of Fire,Dying Is Your Latest Fashion,Escape The Fate,241.1ø
There's No Sympathy For The Dead (Album Version),There's No Sympathy For The Dead,Escape The Fate,326.1ø
The Webs We Weave,Dying Is Your Latest Fashion,Escape The Fate,173.7ø
The Ransom (Album Version),There's No Sympathy For The Dead,Escape The Fate,230.3ø
The Guillotine (Album Version),Dying Is Your Latest Fashion,Escape The Fate,272.5ø
The Day I Left The Womb,Dying Is Your Latest Fashion,Escape The Fate,144.9ø
Situations,Dying Is Your Latest Fashion,Escape The Fate,187.9ø
Reverse the Curse,Dying Is Your Latest Fashion,Escape The Fate,220.9ø
Not Good Enough For Truth In Cliche',Dying Is Your Latest Fashion,Escape The Fate,231.5ø
My Apocalypse,Dying Is Your Latest Fashion,Escape The Fate,283.4ø
Friends And Alibis,Dying Is Your Latest Fashion,Escape The Fate,250.1ø
Dragging Dead Bodies In Blue Bags Up Really Long Hills (Album Version),There's No Sympathy For The Dead,Escape The Fate,218.1ø
Celler Door,Dying Is Your Latest Fashion,Escape The Fate,276.0ø
As You're Falling Down (Album Version),There's No Sympathy For The Dead,Escape The Fate,204.7ø
Degausser,The Devil And God Are Raging Inside Me,Brand New,324.9ø
Tears Dry On Their Own,Ultimate R&B Love 2009,Amy Winehouse,185.0ø
Some Unholy War,Frank & Back to Black,Amy Winehouse,193.9ø
Walk In The Sun,Motion In The Ocean,McFly,275.3ø
She's a Seven,The Early Years EP,The Rocket Summer,260.7ø
When Doves Cry (LP Version),Purple Rain,Prince,352.9ø
1999 (LP Version),1999,Prince,375.2ø
Your Love Is Better Than Life,newsboys live: Houston We Are Go,Newsboys,212.2ø
Wherever We Go,newsboys live: Houston We Are Go,Newsboys,203.2ø
Something Beautiful,newsboys live: Houston We Are Go,Newsboys,233.2ø
Secret Kingdom (Go Album Version),Go,Newsboys,200.5ø
Let It All Come Out (Go Album Version),Go,Newsboys,259.8ø
I Am Free,newsboys live: Houston We Are Go,Newsboys,365.6ø
The Fever,From The Carpet,The Academy Is...,220.8ø
Slow Down (Album Version),Almost Here,The Academy Is...,242.1ø
Pour Yourself A Drink (Basement Demo),From The Carpet,The Academy Is...,88.9ø
WISH I COULD FORGET YOU (Alt. LP Version),18 CANDLES: THE EARLY YEARS,Silverstein,207.7ø
WAITING FOUR YEARS (Alt. LP Version),18 CANDLES: THE EARLY YEARS,Silverstein,254.2ø
DAWN OF THE FALL (LP Version),18 CANDLES: THE EARLY YEARS,Silverstein,257.1ø
What Ever Happened,Marie Antoinette (Original Motion Picture Soundtrack),The Strokes,168.8ø
Richard Manuel Is Dead,New Amsterdam Live At Heineken Music Hall February 6_ 2003,Counting Crows,236.7ø
Not What You See (Live),Live From Portland,Kutless,246.4ø
When We All Get To Heaven,Precious Memories,Alan Jackson,102.3ø
The Firefly's Song,Like Red On A Rose,Alan Jackson,237.0ø
I Love To Tell The Story,Precious Memories,Alan Jackson,170.9ø
Requiem,Sacrament,Lamb Of God,251.4ø
Redneck,Sacrament,Lamb Of God,220.9ø
Pathetic,Sacrament,Lamb Of God,271.1ø
More Time to Kill,Sacrament,Lamb Of God,217.0ø
Forgotten (Lost Angels),Sacrament,Lamb Of God,185.5ø
Foot to the Throat,Sacrament,Lamb Of God,193.9ø
Descending,Sacrament,Lamb Of God,215.2ø
Blacken The Cursed Sun,Sacrament,Lamb Of God,328.2ø
Beating On Deaths Door,Sacrament,Lamb Of God,307.0ø
Again We Rise,Sacrament,Lamb Of God,270.4ø
Fury,Fury,Prince,242.2ø
The Great Escape Under The Sea,The Acoustic Alternative Album,We Are Scientists,232.3ø
Universe & U (Acoustic Extravaganza Version),Grey's Anatomy Original Soundtrack,KT Tunstall,272.9ø
One Day,Eye To The Telescope / KT Tunstall's Acoustic Extravaganza,KT Tunstall,302.9ø
Miniature Disasters (Acoustic Extravaganza Version),KT Tunstall's Acoustic Extravaganza,KT Tunstall,272.0ø
Golden Age,KT Tunstall's Acoustic Extravaganza,KT Tunstall,300.0ø
Another Place To Fall (Radio Version),Another Place To Fall,KT Tunstall,224.9ø
Nothing In My Way,Nothing In My Way,Keane,238.7ø
Hamburg Song,Under The Iron Sea,Keane,277.2ø
Crystal Ball,Under The Iron Sea (Ecopac),Keane,233.9ø
9 Crimes,9,Damien Rice,217.9ø
Get Down,Jimi Hendrix & Carlos Santana (CD 1),Jimi Hendrix,172.8ø
Feel That Soul,Jimi Hendrix & The Best Rock Guitars (CD1),Jimi Hendrix,93.9ø
You Say You Love Me,She's a Fox (Rare Recordings),Jimi Hendrix,153.1ø
All Alone,Sweet Thing (Ultra Rare Recordings),Jimi Hendrix,144.0ø
One Too Many Drinks (Extravaganza),Extravaganza,Jamie Foxx featuring Kanye West,277.0ø
Don't Know You Anymore,Extravaganza,Jamie Foxx,226.6ø
DJ Play A Love Song,Unpredictable,Jamie Foxx featuring Twista,258.8ø
Mercy Mercy Me (The Ecology),You Only Live Once,The Strokes,157.7ø
Life's A Gas,Heart In A Cage,The Strokes,188.9ø
I'll Try Anything Once,Heart In A Cage,The Strokes,195.8ø
Tea & Theatre,Endless Wire,The Who,203.5ø
Sound Round,Endless Wire,The Who,81.4ø
Mike Post Theme,Endless Wire,The Who,268.4ø
God Speaks_ of Marty Robbins,Endless Wire,The Who,206.8ø
Broken Man,Boys Like Girls,Boys Like Girls,210.3ø
UNEEDMEMORETHANINEEDU,Meds,Placebo,209.3ø
Post Blue (Explicit),Meds,Placebo,192.0ø
Post Blue (Dave Bascombe Mix),Meds,Placebo,191.3ø
Paycheck (Demo),Placebo - 10th Anniversary Edition,Placebo,179.8ø
Meds (FM4 Radio Session),Meds,Placebo,187.8ø
Infra-Red (The Waltmann Remix),Infra-red,Placebo,411.3ø
Infra-Red (Live At Newcastle Academy),Infra-red,Placebo,223.1ø
Follow The Cops Back Home,Meds,Placebo,279.6ø
Broken Promise,Meds,Placebo Featuring Michael Stipe,252.9ø
Because I Want You (Ladytron Club Mix),Because I Want You,Placebo,411.5ø
Because I Want You (Instrumental),Because I Want You,Placebo,203.0ø
Ridin',Ridin',Chamillionaire,286.1ø
If You Were Mine,A Public Affair,Jessica Simpson,197.4ø
Where We Belong (The Face Of Love Album Version),The Face Of Love,Sanctus Real,214.0ø
I'm Not Alright (Acoustic Bonus Digital Cut),The Face Of Love,Sanctus Real,266.8ø
Fly (The Face Of Love Album Version),The Face Of Love,Sanctus Real,238.5ø
Eloquent (The Face Of Love Album Version),The Face Of Love,Sanctus Real,202.8ø
Don't Give Up (The Face Of Love Album Version),The Face Of Love,Sanctus Real,255.7ø
Shame For You,Alright_ Still (Deluxe),Lily Allen,246.1ø
Littlest Things,Alright_ Still,Lily Allen,181.0ø
Knock 'Em Out,Alright_ Still (Deluxe),Lily Allen,172.1ø
Don't Get It Twisted,The Sweet Escape,Gwen Stefani,216.7ø
Breakin' Up,The Sweet Escape,Gwen Stefani,226.3ø
My Mind's Eye,Nine Destinies And A Downfall,Sirenia,197.7ø
Total Eclipse Of The Heart,The Love Album,Westlife,281.5ø
Invincible (Live),Do What You Want,Ok Go,222.5ø
Here It Goes Again (UK Surf) (iTunes Italy),Here It Goes Again,Ok Go,197.2ø
Get Over It (Live),Do What You Want,Ok Go,220.4ø
Wraith Pinned to the Mist and Other Games  (Broken Spindles remix),Satanic Twins,Of Montreal,241.8ø
Wraith Pinned to the Mist (And Other Games),Deflated Chime_ Foals Slightly Flower Sibylline Responses,Of Montreal,247.4ø
She's a Rejecter,She's A Rejecter,Of Montreal,245.4ø
Rapture Rapes The Muses (DJ Dave P. and Adam Sparkles Making Time remix),Satanic Twins,Of Montreal,385.9ø
Psychotic Feeling,Deflated Chime_ Foals Slightly Flower Sibylline Responses,Of Montreal,184.9ø
Noir Blues to Tinnatus,Deflated Chime_ Foals Slightly Flower Sibylline Responses,Of Montreal,323.3ø
My British Tour Diary (Caro remix),Satanic Twins,Of Montreal,337.5ø
Little Rock,She's A Rejecter,Of Montreal,58.6ø
I Was A Landscape In Your Dream (Grizzly Bear remix),Satanic Twins,Of Montreal,289.6ø
Forecast Fascist Future (IQU remix),Satanic Twins,Of Montreal,296.6ø
Disconnect The Dots (Mixel Pixel remix),Satanic Twins,Of Montreal,257.1ø
Climb The Ladder (Rory Phillips Trash UK remix),Satanic Twins,Of Montreal,334.8ø
Chrissy Kiss The Corpse (Nils Lannon remix),Satanic Twins,Of Montreal,151.5ø
These Colours Don't Run,A Matter Of Life And Death,Iron Maiden,410.9ø
The Pilgrim,A Matter Of Life And Death,Iron Maiden,306.1ø
The Longest Day,A Matter Of Life And Death,Iron Maiden,466.8ø
The Legacy,A Matter Of Life And Death,Iron Maiden,562.7ø
Out Of The Shadows,A Matter Of Life And Death,Iron Maiden,335.0ø
Lord Of Light,A Matter Of Life And Death,Iron Maiden,444.3ø
Infieles,King Of Kings,Don Omar,264.7ø
Bomba,King Of Kings,Don Omar,171.4ø
SexyBack,SexyBack,Justin Timberlake Featuring Timbaland,378.6ø
Sexy Ladies,FutureSex/LoveSounds,Justin Timberlake,238.6ø
My Love,My Love: The Remixes,Justin Timberlake Featuring T.I.,308.5ø
Medley: Summer Love/Set The Mood (Prelude),FutureSex/LoveSounds,Justin Timberlake,384.2ø
Medley: Let Me Talk To You/ My Love,FutureSex/LoveSounds,Justin Timberlake Featuring T.I.,370.1ø
