What's New?,Louis Armstrong Meets Oscar Peterson,Louis Armstrong & Oscar Peterson,161.9ø
I Got Rhythm,Corrine Corrina,Red Nichols,177.7ø
Supermodel Or Redneck,The Best Of Blue Collar Comedy,Jeff Foxworthy,130.2ø
Redneck Fashion Tip #1,The Best Of Blue Collar Comedy,Jeff Foxworthy,147.2ø
Fishing,The Best Of Blue Collar Comedy,Larry The Cable Guy,167.5ø
War Star Days,Horus Of The Horizon,Wooden Wand_ The Omen Bones Band,471.1ø
Wand Arise,Horus Of The Horizon,Wooden Wand_ The Omen Bones Band,113.4ø
Son of Wand (Hard Luck Prince),Horus Of The Horizon,Wooden Wand_ The Omen Bones Band,310.9ø
Candace_ Queen of Witchcraft,Horus Of The Horizon,Wooden Wand_ The Omen Bones Band,137.5ø
Black Hanna,Horus Of The Horizon,Wooden Wand_ The Omen Bones Band,176.6ø
Tuesday (Bonus Track),Beaufort-Wes se Beautiful Woorde,Gert Vlok Nel,322.1ø
Timotei Sjampoe,Beaufort-Wes se Beautiful Woorde,Gert Vlok Nel,349.3ø
Rivier,Beaufort-Wes se Beautiful Woorde,Gert Vlok Nel,301.3ø
Moenie my hier vergeet nie_ Dixie,Beaufort-Wes se Beautiful Woorde,Gert Vlok Nel,224.8ø
Hillside Lullaby,Beaufort-Wes se Beautiful Woorde,Gert Vlok Nel,277.6ø
Epitaph,Beaufort-Wes se Beautiful Woorde,Gert Vlok Nel,293.6ø
Beautiful in Beaufort-Wes,Beaufort-Wes se Beautiful Woorde,Gert Vlok Nel,310.3ø
Zisame,Best Of +,Peggy Zina,218.1ø
Zilia,Ena,Peggy Zina,214.9ø
Tora Ti Kano,Ena,Peggy Zina,235.4ø
To 'Xera,Ena,Peggy Zina,239.4ø
Sto Kalo,Ena,Peggy Zina,191.7ø
Sti Saloniki,Ena,Peggy Zina,244.8ø
Pos Na To Palepso,Ena,Peggy Zina,177.3ø
Pes Tou,Ena,Peggy Zina,223.4ø
Ime Edo,Ena,Peggy Zina,226.1ø
Gi Ki Ouranos,Ena,Peggy Zina,212.3ø
Fadasia Mou,Ena,Peggy Zina,241.6ø
Ena,Ena,Peggy Zina,217.3ø
Ego Ta Spao,Ena,Peggy Zina,219.2ø
De Se Sighoro,Ena,Peggy Zina,215.8ø
De Goustaro Na Se Vlepo,Ena,Peggy Zina,212.2ø
Not Even Wrong,The Remedy of Abstraction,A Triggering Myth,487.1ø
Feathers (Radioactive Man Remix),Feathers,Meat Katie and Aquasky,387.7ø
Feathers (Marco Bailey Remix),Feathers,Meat Katie and Aquasky,339.0ø
Feathers (James Talk Remix),Feathers,Meat Katie and Aquasky,455.2ø
Haul Away Joe,Which Side Are You On?,Almanac Singers,196.2ø
Get Thee Behind Me Satan,Which Side Are You On?,Almanac Singers,152.4ø
Blow Ye Winds Heigh Ho,Which Side Are You On?,Almanac Singers,162.1ø
Away Rio,Which Side Are You On?,Almanac Singers,141.3ø
Whoa Baby,At The Cavern,Alexis Korner's Blues Incorporated,251.6ø
Watermelon Man,Sky High,Alexis Korner's Blues Incorporated,233.8ø
Turn On Your Lovelight,At The Cavern,Alexis Korner's Blues Incorporated,145.1ø
Ramblin',Sky High,Alexis Korner's Blues Incorporated,175.1ø
Oo-Wee Baby,Sky High,Alexis Korner's Blues Incorporated,135.1ø
I Need Your Lovin',At The Cavern,Alexis Korner's Blues Incorporated,135.0ø
I Got A Woman,Sky High,Alexis Korner's Blues Incorporated,214.3ø
Going Down Slow,Sky High,Alexis Korner's Blues Incorporated,98.8ø
Brief Interview,At The Cavern,Alexis Korner's Blues Incorporated,67.8ø
Back At The Chicken Shack,Sky High,Alexis Korner's Blues Incorporated,202.4ø
Anchor Five Miles,Sky High,Alexis Korner's Blues Incorporated,87.1ø
Walking The Distance,The Witch Of Berkeley,A II Z,296.6ø
Valhalla Force,The Witch Of Berkeley,A II Z,226.9ø
The Witch Of Berkeley,The Witch Of Berkeley,A II Z,279.0ø
The Romp,The Witch Of Berkeley,A II Z,404.0ø
The King Is Dead,The Witch Of Berkeley,A II Z,246.0ø
No Fun After Midnight (Single Version),The Witch Of Berkeley,A II Z,186.0ø
No Fun After Midnight,The Witch Of Berkeley,A II Z,328.5ø
Glastonbury Massacre,The Witch Of Berkeley,A II Z,239.2ø
Danger UXB,The Witch Of Berkeley,A II Z,210.4ø
Boi Bandido,Juliano Cezar,Juliano Cezar,159.7ø
Lawdy Miss Clawdy,Brit Beat of the 60's: Shake 'n' Shimmy,Duffy Power,123.7ø
You Belong To Me,Borscht Riders In The Sky,Mickey Katz,156.1ø
Yiddish Mule Train,Borscht Riders In The Sky,Mickey Katz,160.7ø
Turkish Lullaby,Borscht Riders In The Sky,Mickey Katz,177.3ø
There's A Hole In The Iron Curtain,Borscht Riders In The Sky,Mickey Katz,152.0ø
The Baby_ The Bubbe And You,Borscht Riders In The Sky,Mickey Katz,155.6ø
Sound Off,Borscht Riders In The Sky,Mickey Katz,146.2ø
She'll be Coming Round The Katzkills,Borscht Riders In The Sky,Mickey Katz,151.8ø
She Walks Past his Window Every Day,Borscht Riders In The Sky,Mickey Katz,167.7ø
Schleppin' My Baby Back Home,Borscht Riders In The Sky,Mickey Katz,189.4ø
Scheherazde,Borscht Riders In The Sky,Mickey Katz,141.8ø
Patcha-Me,Borscht Riders In The Sky,Mickey Katz,129.9ø
Music_ Music_ Music,Borscht Riders In The Sky,Mickey Katz,138.4ø
Mona Lisa,Borscht Riders In The Sky,Mickey Katz,174.4ø
Geshray Of De Vilde Kotchke,Borscht Riders In The Sky,Mickey Katz,175.0ø
Gehakte Mambo,Borscht Riders In The Sky,Mickey Katz,170.3ø
Feet Up Pat Him On The Pipick,Borscht Riders In The Sky,Mickey Katz,154.1ø
Come On-A My House,Borscht Riders In The Sky,Mickey Katz,127.5ø
Borscht Riders In The Sky,Borscht Riders In The Sky,Mickey Katz,168.0ø
A Schmo Is A Schmo,Borscht Riders In The Sky,Mickey Katz,149.0ø
The Final Show,Bluebeat Party,Strange Tenants,147.4ø
Something Like That,Bluebeat Party,Strange Tenants,180.2ø
Soldier Boy,Bluebeat Party,Strange Tenants,154.7ø
Moonstomp,Bluebeat Party,Strange Tenants,323.7ø
Living Life,Bluebeat Party,Strange Tenants,132.3ø
Calling All Rude Boys,Bluebeat Party,Strange Tenants,138.8ø
Al Capone,Bluebeat Party,Strange Tenants,179.1ø
Waltz In Three Colors,Rhythm Of Life,Common Bond,370.7ø
The Ring,Rhythm Of Life,Common Bond,417.1ø
Sinai,Rhythm Of Life,Common Bond,305.1ø
Rhythm Of Life,Rhythm Of Life,Common Bond,255.5ø
Nabat's Parade,Rhythm Of Life,Common Bond,439.2ø
Janana,Rhythm Of Life,Common Bond,296.2ø
Jamila,Rhythm Of Life,Common Bond,209.8ø
Cup Of Feel,Rhythm Of Life,Common Bond,287.3ø
Second Guess,Power Trance Vol.1,Mallorca Lee,576.0ø
Take Time To Love Her,Nat Stuckey - His Very Best,Nat Stuckey,180.5ø
Sweet Thang And Cisco,Nat Stuckey - His Very Best,Nat Stuckey,156.9ø
She Wakes Me With A Kiss Every Morning,Sweet Thang,Nat Stuckey,176.9ø
Plastic Saddle,Back to Back - Faron Young & Nat Stuckey,Nat Stuckey,135.9ø
Only A Woman Like You,Sweet Thang,Nat Stuckey,171.8ø
Don't Pay The Ransom,Sweet Thang,Nat Stuckey,138.7ø
Cut Across Shorty,Sweet Thang,Nat Stuckey,137.5ø
Times Rough,Riddim Driven: Return To Big Street,Ky-enie,184.4ø
L'Argent Appelle L'Argent,L'essentiel,Pamelo Mounk'a,399.2ø
Cyclic Evolution,Our Acid Acperience,Microwave Prince,476.1ø
The Mill Was Made Of Marble,Textile Voices: Songs and Stories of the Mills,Joe Glazer,267.5ø
Solidarity Forever,I Will Win: Songs of the Wobblies,Joe Glazer,147.7ø
Automation,Joe Glazer Sings Labor Songs,Joe Glazer,156.0ø
Tricksters,Radikal Expression,Doniki,251.1ø
Things to do,Radikal Expression,Doniki,237.9ø
Poor man,Radikal Expression,Doniki,272.3ø
Passa passa,Radikal Expression,Doniki,239.9ø
My Bredren,Radikal Expression,Doniki,262.0ø
Melting Pot,Radikal Expression,Doniki,207.5ø
Gonna be there,Radikal Expression,Doniki,263.3ø
Eretrians,Radikal Expression,Doniki,253.2ø
A little love,Radikal Expression,Doniki,204.1ø