Everything'll Be Alright (Will's Lullaby),We Were Here,Joshua Radin,160.4ø
Amy's Song,We Were Here,Joshua Radin,219.8ø
What I Almost Was,Sinners Like Me,Eric Church,201.1ø
Two Pink Lines,Sinners Like Me,Eric Church,207.2ø
These Boots,Sinners Like Me,Eric Church,227.7ø
The Hard Way,Sinners Like Me,Eric Church,163.3ø
Sinners Like Me,Sinners Like Me,Eric Church,232.1ø
Pledge Allegiance To The Hag,Sinners Like Me,Eric Church,265.4ø
Livin' Part Of Life,Sinners Like Me,Eric Church,268.5ø
Lightning,Sinners Like Me,Eric Church,314.9ø
How 'Bout You,Sinners Like Me,Eric Church,229.6ø
Guys Like Me,Sinners Like Me,Eric Church,190.6ø
Can't Take It With You,Sinners Like Me,Eric Church,264.4ø
Before She Does,Sinners Like Me,Eric Church,199.1ø
The Shoop Shoop Song,Soul Sister: The Best Of Aretha Franklin,Aretha Franklin,143.5ø
Yell It Out,16 Wit' Dre Part 1,Mac Dre,118.9ø
Become The Catalyst,All That Remains: Live,All That Remains,193.2ø
Beep,Pussycat Dolls Hit Pac - 5 Series,The Pussycat Dolls | Will.I.Am,227.9ø
You Can Close Your Eyes,2007 Grammy Nominees,Sheryl Crow,127.5ø
You Got Me Up (Live At The Scala),Multiply Additions,Jamie Lidell,259.7ø
When I Come Back Around (Freeform Reform),Multiply Additions,Jamie Lidell,345.1ø
What's The Use? (Mocky Mix),Multiply Additions,Jamie Lidell,198.2ø
The City (Four Tet Mix),Multiply Additions,Jamie Lidell,302.0ø
Multiply (In A Minor Key) Piano by Gonzales,Multiply Additions,Jamie Lidell,270.4ø
Multiply (Herbert's Hoedown Bump Instrumental),Multiply Additions,Jamie Lidell,271.5ø
Game For Fools (Mara Carlyle Ukulady Mix),Multiply Additions,Jamie Lidell,229.2ø
Game For Fools (Live In Paris),Multiply Additions,Jamie Lidell,289.6ø
A Little Bit More (Luke Vibert Mix),Multiply Additions,Jamie Lidell,329.0ø
A Little Bit More (Herbert - A Little Bit Less Remix),Multiply Additions,Jamie Lidell,315.3ø
Won't Do,The Shining,J Dilla,232.5ø
So Far To Go,Dillanthology Vol. 3,J Dilla aka Jay Dee feat. Common & D'Angelo,338.8ø
Over The Breaks,...mixing,J-Dilla,135.1ø
Love Movin' feat. Black Thought (Album),The Shining,J Dilla,214.9ø
Love Jones,The Shining,J Dilla,61.6ø
Love feat. Pharoahe Monch (Album),The Shining,J Dilla,194.6ø
Jungle Love feat. MED & Guilty Simpson (Album),The Shining,J Dilla,164.7ø
Geek Down feat. Busta Rhymes (Album),The Shining,J Dilla,113.1ø
E=MC2 feat. Common (Album),The Shining,J Dilla,197.7ø
Dime Piece feat. Dwele (Remix) (remix),The Shining,J Dilla,195.3ø
Body Movin' feat. J. Rocc & Karriem Riggins (Album),The Shining,J Dilla,137.6ø
Baby feat. Guilty Simpson & Madlib (Album),The Shining,J Dilla,208.4ø
Si Te Veo,La Maravilla_ Vol. 2,Arcangel,108.2ø
The View From The Afternoon,Who The F*** Are Arctic Monkeys?,Arctic Monkeys,223.0ø
On The Streets I Ran,Ringleader Of The Tormentors,Morrissey,231.3ø
On The Street's I Ran,Ringleader Of The Tormentors,Morrissey,231.3ø
Life Is A Pigsty,Lifestyle2 - Acoustic Vol 2,Morrissey,441.5ø
I Knew I Was Next,Swords,Morrissey,225.0ø
At Last I Am Born,Ringleader Of The Tormentors,Morrissey,213.4ø
Why We Thugs,Why We Thugs,Ice Cube,224.6ø
Trigger Happy Tarantula,A Static Lullaby,A Static Lullaby,247.8ø
The Collision,A Static Lullaby,A Static Lullaby,241.9ø
The Art of Sharing Lovers,A Static Lullaby,A Static Lullaby,215.2ø
Static Slumber Party,A Static Lullaby,A Static Lullaby,227.2ø
Stare at the Air,A Static Lullaby,A Static Lullaby,177.5ø
Life in a Museum,A Static Lullaby,A Static Lullaby,236.7ø
Hang 'Em High,A Static Lullaby,A Static Lullaby,239.0ø
Eager Cannibals,A Static Lullaby,A Static Lullaby,175.6ø
Contagious,A Static Lullaby,A Static Lullaby,249.7ø
Don't say a word (single edit),Don't Say A Word,SONATA ARCTICA,255.5ø
Stay Fly,Most Known Unknown (Screwed and Chopped),Three 6 Mafia feat. Young Buck and Eightball & MJG,275.1ø
It's A Fight,Rocky Balboa: The Best Of Rocky,Three 6 Mafia,187.0ø
Weekend (James Iha Mix),Extended Play,Ladytron,242.7ø
Sugar (Jagz Kooner Mix),Extended Play,Ladytron,325.1ø
Last One Standing (Shipps & Tait Mix),Extended Play,Ladytron,227.4ø
High Rise (Club Mix),Extended Play,Ladytron,369.6ø
Destroy Everything You Touch (Catholic Version),Extended Play,Ladytron,285.7ø
Citadel,Extended Play,Ladytron,234.0ø
When Your Heart Stops Beating,AOL Music Sessions,44,198.1ø
Weatherman,When Your Heart Stops Beating,44,272.6ø
No_ It Isn't,When Your Heart Stops Beating,44,211.7ø
Make You Smile,When Your Heart Stops Beating,44,224.6ø
Lycanthrope,When Your Heart Stops Beating,44,237.6ø
Little Death,When Your Heart Stops Beating,44,245.8ø
Lillian,When Your Heart Stops Beating,44,278.5ø
Cliff Diving,When Your Heart Stops Beating,44,220.6ø
Baby Come On (Acoustic),Punk Goes Acoustic 2,44,171.5ø
Baby Come On,When Your Heart Stops Beating,44,170.8ø
155,When Your Heart Stops Beating,44,209.5ø
145,When Your Heart Stops Beating,44,218.1ø
Koop Island Blues,Lounge Classics : Classic Chillout / Bargrooves,Koop,273.7ø
I See A Different You,Brazilution 5.5,Koop feat. Yukimi Nagano,195.1ø
Come To Me,Buddha Lounge Classics - Classic Chilled Bar Grooves,Koop,167.8ø
Negative Sides Of Optimistic Eyes (Non-Album Track),Absolution For Idiots And Addicts,Less Than Jake,156.2ø
Let Her Go (Album Version),In With The Out Crowd,Less Than Jake,142.1ø
So Yesterday (Radio Remix),Best Of Hilary Duff,Hilary Duff,215.7ø
Soundtrack Of My Life (Album Version),In With The Out Crowd,Less Than Jake,179.3ø
P.S. Shock The World (Album Version),In With The Out Crowd,Less Than Jake,246.5ø
Mostly Memories (Album Version),In With The Out Crowd,Less Than Jake,193.8ø
Landmines And Landslides (Album Version),In With The Out Crowd,Less Than Jake,178.5ø
In-Dependence Day (Album Version),In With The Out Crowd,Less Than Jake,168.0ø
Fall Apart (Album Version),In With The Out Crowd,Less Than Jake,189.1ø
Don't Fall Asleep On The Subway (Album Version),In With The Out Crowd,Less Than Jake,196.4ø
Puttin' On The Dog,Orphans,Tom Waits,219.1ø
Down There By The Train,Orphans,Tom Waits,339.0ø
Dog Treat,Orphans,Tom Waits,176.7ø
Dog Door,Orphans,Tom Waits,163.5ø
Children's Story,Orphans,Tom Waits,103.0ø
All The Time,Orphans,Tom Waits,273.8ø
Comfortable (Album Version),Ten,Brian McKnight,216.7ø
You Light Up My Life,The Love Album,Westlife,210.2ø
The Rose,The Love Album,Westlife,221.1ø
The Dance,The Love Album,Westlife,241.6ø
Still Here,Amazing,Westlife,188.6ø
Nothing's Going To Change My Love For You,The Love Album,Westlife,227.3ø
Red Light Indicates Doors Are Secured,Whatever People Say I Am_ That's What I'm Not,Arctic Monkeys,143.6ø
Perhaps Vampires Is A Bit Strong But...,Wheatever People Say I Am_ That's What I'M Not - Digital,Arctic Monkeys,268.5ø
Leave Before The Lights Come On (Explicit),Leave Before The Lights Come On,Arctic Monkeys,231.8ø
Cigarette Smoker Fiona,Who The F*** Are Arctic Monkeys?,Arctic Monkeys,178.5ø
Baby I'm Yours,Leave Before The Lights Come On,Arctic Monkeys,152.6ø
Wings Of Forgiveness,Testimony: Vol. 1 Life & Relationship,India.Arie,299.4ø
This Too Shall Pass,Testimony: Vol. 1 Life & Relationship,India.Arie,351.6ø
These Eyes,Testimony: Vol. 1 Life & Relationship,India.Arie,271.4ø
There's Hope,Testimony: Vol. 1 Life & Relationship,India.Arie,235.8ø
The Heart Of The Matter,Testimony: Vol. 1 Life & Relationship,India.Arie,315.3ø
Summer,Testimony: Vol. 1 Life & Relationship,India.Arie | Rascal Flatts | Victor Wooten,194.3ø
Private Party,Testimony: Vol. 1 Life & Relationship,India.Arie,232.3ø
Outro: Learning,Testimony: Vol. 1 Life & Relationship,India.Arie,92.2ø
Intro: Loving,Testimony: Vol. 1 Life & Relationship,India.Arie,90.4ø
Interlude: Living,Testimony: Vol. 1 Life & Relationship,India.Arie,83.4ø
India'Song,Testimony: Vol. 1 Life & Relationship,India.Arie,326.8ø
I Choose,Testimony: Vol. 1 Life & Relationship,India.Arie | Bonnie Raitt,225.5ø
I Am Not My Hair,I Am Not My Hair,India.Arie | Swizz Beats,216.9ø
Great Grandmother,Testimony: Vol. 1 Life & Relationship,India.Arie,34.6ø
Better People,Testimony: Vol. 1 Life & Relationship,India.Arie,223.2ø
Your Guts (I Hate 'Em),We're Not Happy 'til You're Not Happy,Reel Big Fish,127.0ø
Stray Cat Strut,Go Cat Go! A Tribute to Stray Cats,Reel Big Fish,199.7ø
Out Of My Head,Coming Home,Lionel Richie,194.0ø
Love Oh Love,Gold,Lionel Richie,346.1ø
Little Drummer Boy,Why,Lionel Richie,235.5ø
I'm Missing Her,Coming Home,Lionel Richie,237.4ø
I'm Coming Home,Coming Home,Lionel Richie,258.0ø
I Love You,Coming Home,Lionel Richie,251.9ø
I Call It Love,Coming Home,Lionel Richie,198.4ø
The Blues Are Still Blue,The Blues Are Still Blue,Belle & Sebastian,251.5ø
For The Price Of A Cup Of Tea,The Life Pursuit,Belle & Sebastian,199.6ø
Your Crowbar_ So Far,iTunes Originals,Fiona Apple,60.4ø
It Was Just A Plastic Bag,iTunes Originals,Fiona Apple,112.5ø
It Didn't Turn Out How I Expected It To Turn Out,iTunes Originals,Fiona Apple,113.6ø
I?m Feeling Hopeful,iTunes Originals,Fiona Apple,86.9ø
I Want To Make People Happy,iTunes Originals,Fiona Apple,244.7ø
I Just Wanted To Leave,iTunes Originals,Fiona Apple,39.1ø
I Can't Remember How I Got There,iTunes Originals,Fiona Apple,82.7ø
Finding The Key,iTunes Originals,Fiona Apple,133.4ø
A Pep Talk To Myself,iTunes Originals,Fiona Apple,125.0ø
A Bird?s Eye View Of All Of My Relationships,iTunes Originals,Fiona Apple,102.7ø
A 90 Word Album Title,iTunes Originals,Fiona Apple,153.3ø
This Will Never End,A Twist in the Myth,Blind Guardian,307.3ø
Fly,A Twist in the Myth,Blind Guardian,345.8ø
Another Stranger Me,Another Stranger Me,Blind Guardian,276.0ø
The Long Island Sound,The Lon Gisland EP,Beirut,79.0ø
The Gulag Orkestar,The Gulag Orkestar,Beirut,279.8ø
The Bunker,The Gulag Orkestar,Beirut,193.2ø
Prenzlauerberg,The Gulag Orkestar,Beirut,226.7ø
Elephant Gun,The Gulag Orkestar,Beirut,345.3ø
Carousels,The Gulag Orkestar,Beirut,263.3ø
Brandenburg,The Gulag Orkestar,Beirut,218.8ø
The Arrival (Instrumental),Demonica,Behemoth,57.9ø
Monumentum (Instrumental),Demonica,Behemoth,78.0ø
Goat With A Thousand Young (Instrumental),Demonica,Behemoth,188.0ø
You Raise Me Up,I'm In The Mood For Love ... The Most Romantic Melodies Of All Time,Kenny G,194.4ø
The Way You Move,At Last...The Duets Album,Kenny G featuring Earth_ Wind & Fire,249.7ø
"Love Theme From ""Romeo & Juliet",I'm In The Mood For Love ... The Most Romantic Melodies Of All Time,Kenny G,223.6ø
If,I'm In The Mood For Love ... The Most Romantic Melodies Of All Time,Kenny G,205.2ø
Fly Me To The Moon/ You Make Me Feel So Young,I'm In The Mood For Love ... The Most Romantic Melodies Of All Time,Kenny G,210.2ø
We Got It For Cheap (Intro),Hell Hath No Fury,Clipse,221.9ø
Trill,Hell Hath No Fury,Clipse,284.0ø
Ride Around Shining,Hell Hath No Fury,Clipse featuring AB-Liva of the Re-Up Gang,236.2ø
Nightmares,Hell Hath No Fury,Clipse featuring Bilal and Pharrell Williams,290.3ø
Mr. Me Too,Hell Hath No Fury,Clipse,221.9ø
Momma I'm So Sorry,Hell Hath No Fury,Clipse,237.4ø
Keys Open Doors,Hell Hath No Fury,Clipse,199.4ø
Hello New World,Hell Hath No Fury,Clipse,252.1ø
Dirty Money,Hell Hath No Fury,Clipse,226.5ø
Chinese New Year,Hell Hath No Fury,Clipse,234.6ø
Tu Y Yo,Ananda,Paulina Rubio,215.9ø
Retrato,Ananda,Paulina Rubio,193.2ø
Que Me Voy A Quedar,Ananda,Paulina Rubio,200.5ø
No Te Cambio,Ananda,Paulina Rubio,221.5ø
Nada Puede Cambiarme,Ananda,Paulina Rubio,218.3ø
Aunque No Sea Conmigo,Ananda,Paulina Rubio,219.8ø
Work In Progress,Mutiny: Deluxe Edition,Set Your Goals,133.6ø
This Very Moment,Mutiny: Deluxe Edition,Set Your Goals,153.2ø
This Song Is Definitely NOT About a Girl,Mutiny: Deluxe Edition,Set Your Goals,175.7ø
Mutiny!,Mutiny: Deluxe Edition,Set Your Goals,241.6ø
Flight of the Navigator,Mutiny: Deluxe Edition,Set Your Goals,166.2ø
Echoes,Mutiny: Deluxe Edition,Set Your Goals,264.7ø
Don't Let This Win Over You,Mutiny: Deluxe Edition,Set Your Goals,60.3ø
Dead Men Tell No Tales,Mutiny: Deluxe Edition,Set Your Goals,57.9ø
An Old Book Misread,Mutiny: Deluxe Edition,Set Your Goals,231.5ø