To The Princes,The Kingdom,Danny Elfman,69.6ø
The Sales Pitch,The Kingdom,Danny Elfman,132.2ø
The Marble,The Kingdom,Danny Elfman,68.2ø
The Kingdom - Titles,The Kingdom,Danny Elfman,269.8ø
The Killing Room / Trouble Coming,The Kingdom,Danny Elfman,121.7ø
Starting To Click / Saving Leavitt,The Kingdom,Danny Elfman,295.0ø
Digging Deep,The Kingdom,Danny Elfman,77.8ø
Attack On The Compound,The Kingdom,Danny Elfman,163.7ø
Ella Me Levanto,El Cartel: The Big Boss,Daddy Yankee,209.6ø
Spare-Ohs,Armchair Apocrypha,Andrew Bird,247.2ø
Simple X,Armchair Apocrypha,Andrew Bird,216.8ø
Touch Your Toes,Ghettoblaster Remixes,Armand Van Helden,349.1ø
NYC Beat (Emperor Machine Vocal),NYC Beat,Armand Van Helden,486.4ø
I Want Your Soul (Crookers Crunk Remix),I Want Your Soul,Armand Van Helden,301.9ø
Unreleased Backgrounds,Falling Out,Peter Bjorn And John,404.5ø
Fortune Favours Only The Brave,Falling Out,Peter Bjorn And John,198.7ø
Untouched (Album Version),Untouched,The Veronicas,254.4ø
Take Me On The Floor (Album Version),Hook Me Up,The Veronicas,210.5ø
Everything I'm Not (Album Version),Hook Me Up,The Veronicas,202.0ø
Tea Leaf Dancers,Gilles Peterson Presents Brownswood Bubblers Two,Flying Lotus,190.1ø
Spicy Sammich,Reset EP,Flying Lotus,255.0ø
Massage Situation,Reset EP,Flying Lotus,167.2ø
Dance Floor Stalker,Reset EP,Flying Lotus,250.0ø
Bonus Beat,Reset EP,Flying Lotus,51.1ø
Shift (Alternate Version),Friend EP,Grizzly Bear,212.9ø
He Hit Me,Friend EP,Grizzly Bear,263.0ø
Alligator (Choir Version),Friend EP,Grizzly Bear,314.8ø
The Church Channel,In Defense Of The Genre,Say Anything,186.3ø
Viridian (Album Version),Colors,Between The Buried And Me,171.1ø
Viridian,Colors_Live,Between The Buried And Me,125.8ø
Prequel To The Sequel (Album Version),Colors,Between The Buried And Me,516.6ø
Prequel To The Sequel,Colors_Live,Between The Buried And Me,548.0ø
Informal Gluttony (Album Version),Colors,Between The Buried And Me,407.8ø
Informal Gluttony,Colors_Live,Between The Buried And Me,407.8ø
Foam Born (A) The Backtrack (Album Version),Colors,Between The Buried And Me,133.8ø
(B) The Decade Of Statues (Album Version),Colors,Between The Buried And Me,320.3ø
Wasted Weekend,Province,TV On The Radio,242.3ø
Dumb Animal,Province,TV On The Radio,174.8ø
Tumba El Fronte,Sobrenatural,Alexis & Fido,179.2ø
Lento_ Lento_ Lento,Sobrenatural,Alexis & Fido,214.7ø
Go Go Girls,Sobrenatural,Alexis & Fido Feat. Erick Right,281.5ø
Dale Uso,Sobrenatural,Alexis & Fido,187.8ø
A Que No Me Duras,Sobrenatural,Alexis & Fido,168.9ø
5 Letras,5 Letras,Alexis & Fido,191.6ø
With The Dark,The Else,They Might Be Giants,197.3ø
Take Out The Trash,The Else,They Might Be Giants,194.7ø
Typical (Explicit),My Manic And I,Laura Marling,161.9ø
Tap At My Window,Alas I Cannot Swim,Laura Marling,167.5ø
Night Terror,Alas I Cannot Swim,Laura Marling,189.2ø
New Romantic (Explicit),My Manic And I,Laura Marling,172.6ø
My Manic And I,Alas I Cannot Swim,Laura Marling,236.0ø
Failure,Alas I Cannot Swim,Laura Marling,199.7ø
Try Your Best,Yours Truly_ Angry Mob,Kaiser Chiefs,221.1ø
The Angry Mob,The Angry Mob,Kaiser Chiefs,286.0ø
Thank You Very Much,Yours Truly_ Angry Mob,Kaiser Chiefs,156.3ø
Telling Me To Go,The Angry Mob,Kaiser Chiefs,188.9ø
Ruby,Yours Truly_ Angry Mob,Kaiser Chiefs,201.4ø
Retirement,Yours Truly_ Angry Mob,Kaiser Chiefs,231.8ø
Out Of My Depth,Everything Is Average Nowadays,Kaiser Chiefs,184.7ø
My Kind Of Guy,Yours Truly_ Angry Mob,Kaiser Chiefs,246.6ø
Love's Not A Competition (But I'm Winning),Yours Truly_ Angry Mob,Kaiser Chiefs,195.8ø
Learnt My Lesson Well,Yours Truly_ Angry Mob,Kaiser Chiefs,233.9ø
I Like To Fight,Everything Is Average Nowadays,Kaiser Chiefs,218.6ø
I Can Do It Without You,Yours Truly_ Angry Mob,Kaiser Chiefs,203.2ø
Highroyds,Yours Truly_ Angry Mob,Kaiser Chiefs,209.4ø
Heat Dies Down,Yours Truly_ Angry Mob,Kaiser Chiefs,223.8ø
From The Neck Down,Ruby,Kaiser Chiefs,149.3ø
Everything Is Average Nowadays,NME Presents The Essential Bands - Festival Edition,Kaiser Chiefs,166.5ø
Boxing Champ,Yours Truly_ Angry Mob,Kaiser Chiefs,91.1ø
Admire You,Ruby,Kaiser Chiefs,253.5ø
Untitled (Album Version),Downtown Battle Mountain,Dance Gavin Dance,48.4ø
Turn Off the Lights_ I'm Watching Back to the Future (Album Version),Downtown Battle Mountain,Dance Gavin Dance,239.5ø
The Backwards Pumpkin Song (Album Version),Downtown Battle Mountain,Dance Gavin Dance,246.8ø
Surprise! I'm From Cuba_ Everyone Has One Brain (Album Version),Downtown Battle Mountain,Dance Gavin Dance,294.8ø
Open Your Eyes and Look North (Album Version),Downtown Battle Mountain,Dance Gavin Dance,269.7ø
Lemon Meringue Tie (Album Version),Downtown Battle Mountain,Dance Gavin Dance,231.0ø
It's Safe to Say You Dig the Backseat (Album Version),Downtown Battle Mountain,Dance Gavin Dance,314.1ø
Antlion (Album Version),Downtown Battle Mountain,Dance Gavin Dance,199.4ø
And I Told Them I Invented Times New Roman (Album Version),Downtown Battle Mountain,Dance Gavin Dance,288.1ø
12 Hours_ 630 Miles (Album Version),Downtown Battle Mountain,Dance Gavin Dance,84.7ø
OnThatNewThing,Beat Konducta Vol. 3 & 4: In India,Madlib,91.2ø
Indian Bells,Beat Konducta Vol. 3 & 4: In India,Madlib,96.1ø
(Variations),Beat Konducta Vol. 3 & 4: In India,Madlib,167.0ø
You're Just No Good For Me,Romantic Type,The Pigeon Detectives,203.5ø
You Better Not Look My Way,Wait For Me,The Pigeon Detectives,266.6ø
Wouldn't Believe It (Full Version),Take Her Back,The Pigeon Detectives,158.3ø
Take Her Back (Statik Remix),Take Her Back,The Pigeon Detectives,225.5ø
Take Her Back (Live at Leeds Town Hall),Take Her Back,The Pigeon Detectives,204.6ø
Take Her Back,Wait For Me,The Pigeon Detectives,197.2ø
Stop Or Go,Wait For Me,The Pigeon Detectives,192.2ø
Let's Go,Romantic Type,The Pigeon Detectives,215.5ø
Left Alone (Live at Leeds Town Hall),Take Her Back,The Pigeon Detectives,147.9ø
I'm Not The One,I Found Out,The Pigeon Detectives,185.5ø
I Found Out (New Version),I Found Out,The Pigeon Detectives,130.3ø
I Can't Control Myself,Wait For Me,The Pigeon Detectives,166.2ø
Don't Know How To Say Goodbye,Wait For Me,The Pigeon Detectives,116.8ø
Dick'ead,I'm Not Sorry,The Pigeon Detectives,163.3ø
Caught In Your Trap,Wait For Me,The Pigeon Detectives,123.3ø
All I Know,I Found Out,The Pigeon Detectives,234.7ø
A Kick In The Shins (Demo),I'm Not Sorry,The Pigeon Detectives,219.2ø
Church Heathen,The Boombastic Collection - Best of Shaggy,Shaggy,245.9ø
Can't Hold Me,Intoxication,Shaggy,158.2ø
Breathe In Breathe Out,Grey's Anatomy Original Soundtrack,Mat Kearney,223.1ø
Up The Cuts (Album Version),New Wave,Against Me!,172.7ø
The Ocean (Album Version),New Wave,Against Me!,278.5ø
Piss And Vinegar (Album Version),New Wave,Against Me!,147.1ø
New Wave [Acoustic],Thrash Unreal,Against Me!,203.5ø
New Wave (Album Version),New Wave,Against Me!,209.0ø
Borne On The FM Waves Of The Heart (Album Version),New Wave,Against Me!,249.6ø
Animal (Album Version),New Wave,Against Me!,200.0ø
Americans Abroad (Album Version),New Wave,Against Me!,135.6ø
Our King (LP Version),Songs Of The Season,Randy Travis,195.4ø
Nothin's Gonna Bring Me Down [At Christmas Time] (LP Version),Songs Of The Season,Randy Travis,189.8ø
Let It Snow_ Let It Snow_ Let It Snow (LP Version),Songs Of The Season,Randy Travis,140.1ø
Labor Of Love (LP Version),Songs Of The Season,Randy Travis,280.1ø
(There's No Place Like) Home For The Holidays (LP Version),Songs Of The Season,Randy Travis,171.0ø
Still In Love,The Fight Of My Life,Kirk Franklin,319.9ø
It Would Take All Day,The Fight Of My Life,Kirk Franklin,311.3ø
I Am God,The Fight Of My Life,Kirk Franklin featuring tobyMac,305.8ø
How It Used To Be,The Fight Of My Life,Kirk Franklin,293.2ø
A Whole Nation,The Fight Of My Life,Kirk Franklin,299.0ø
Dreaming Of Andromeda (Jean F. Cochois Remix),The Platinum Collection,Enigma,447.9ø
The Modern Leper,The Midnight Organ Fight,Frightened Rabbit,228.0ø
It's Christmas So We'll Stop (Choir Version),It's Christmas So We'll Stop,The Pretend It's December Choir,265.5ø
It's Christmas So We'll Stop,It's Christmas So We'll Stop,Frightened Rabbit,327.2ø
Play,Made of Bricks,Kate Nash,72.8ø
When Did Your Heart Go Missing?,When Did Your Heart Go Missing?,Rooney,210.2ø
What For,What For,Rooney,223.0ø
Too Late,When Did Your Heart Go Missing?,Rooney,131.1ø
Tell Me Soon,Calling The World,Rooney,199.9ø
Sleep Song,When Did Your Heart Go Missing?,Rooney,263.2ø
Paralyzed,Paralyzed,Rooney,154.8ø
Love Me Or Leave Me,Love Me Or Leave Me,Rooney,192.7ø
Jump In My Bed,Calling The World,Rooney,199.3ø
I Should've Been After You,Calling The World,Rooney,263.9ø
Help Me Find My Way,Calling The World,Rooney,253.5ø
Get Away,Calling The World,Rooney,171.9ø
Don't Come Around Again,Calling The World,Rooney,242.8ø
Calling The World,Calling The World,Rooney,182.6ø
Believe In Me,Calling The World,Rooney,242.6ø
Are You Afraid?,Calling The World,Rooney,251.6ø
All In Your Head,Calling The World,Rooney,225.3ø
Those Days,Intoxication,Shaggy (feat. Nash),203.6ø
Out Of Control,Intoxication,Shaggy (feat. Rayvon),207.9ø
Mad Mad World,Intoxication,Shaggy (feat. Sizzla Kalonji & Collie Buddz),231.9ø
Intoxication,Intoxication,Shaggy,213.0ø
Criteria,Intoxication,Shaggy,223.5ø
Body A Shake,Intoxication,Shaggy,198.2ø
All About Love,Intoxication,Shaggy,216.6ø
Restless Soul,Steel Meets Steel - 10 Years Of Glory,HAMMERFALL,326.6ø
When Acting As A Wave,Ire Works,The Dillinger Escape Plan,93.3ø
Whan Acting As A Particle,Ire Works,The Dillinger Escape Plan,83.0ø
Sick On Sunday,Ire Works,The Dillinger Escape Plan,130.1ø
Party Smasher,Ire Works,The Dillinger Escape Plan,116.9ø
Nong Eye Gong,Ire Works,The Dillinger Escape Plan,76.1ø
Mouth Of Ghosts,Ire Works,The Dillinger Escape Plan,409.8ø
Milk Lizard,Ire Works,The Dillinger Escape Plan,235.3ø
Lurch,Ire Works,The Dillinger Escape Plan,123.2ø
Horse Hunter,Ire Works,The Dillinger Escape Plan,191.1ø
Fix Your Face,Ire Works,The Dillinger Escape Plan,161.7ø
Dead As History,Ire Works,The Dillinger Escape Plan,329.0ø
Black Bubblegum,Ire Works,The Dillinger Escape Plan,244.2ø
82588,Ire Works,The Dillinger Escape Plan,116.6ø
We Need Love (Album Version),Once Upon A Time In The West,Hard-FI,244.1ø
Watch Me Fall Apart (Album Version),Once Upon A Time In The West,Hard-FI,173.2ø
Tonight [Acoustic Version],Once Upon A Time In The West,Hard-FI,257.6ø
Tonight (Album Version),Once Upon A Time In The West,Hard-FI,237.1ø
These Four Walls and I,Can't Get Along [Without You],Hard-FI,252.8ø
The King (Album Version),Once Upon A Time In The West,Hard-FI,197.4ø
Television (Album Version),Once Upon A Time In The West,Hard-FI,222.5ø
Suburban Knights [DJ Wrongtom's Delight],Suburban Knights,Hard-FI,220.7ø
Suburban Knights [Acoustic Version],Once Upon A Time In The West,Hard-FI,214.1ø
Suburban Knights (Album Version),Once Upon A Time In The West,Hard-FI,272.3ø
Little Angel (Album Version),Once Upon A Time In The West,Hard-FI,174.1ø
I Shall Overcome (Album Version),Once Upon A Time In The West,Hard-FI,258.8ø
Help Me Please (Album Version),Once Upon A Time In The West,Hard-FI,194.6ø
Can't Get Along [Without You] (Album Version),Once Upon A Time In The West,Hard-FI,180.5ø
Just Because You're So Pretty,In Our Lifetime? Expanded Love Man Edition,Marvin Gaye,306.1ø
A Lover's Plea,In Our Lifetime? Expanded Love Man Edition,Marvin Gaye,370.2ø
I'm Walkin',Goin' Home_ A Tribute To Fats Domino,Tom Petty & The Heartbreakers,166.1ø
No One Knows,Stop Me,Mark Ronson featuring Domino,279.2ø
Wind Up [Demo],Kill The House Lights,Thursday,223.8ø
Voices On A String (Album Version),Kill The House Lights,Thursday,214.4ø
The Roar Of Far Off Black Jets (Album Version),Kill The House Lights,Thursday,120.6ø
Telegraph Avenue Kiss [Rich Costey Mix],Kill The House Lights,Thursday,249.5ø
Signals Over The Air [Live At The Starland Ballroom] (Album Version),Kill The House Lights,Thursday,267.4ø
Paris In Flames [Demo],Kill The House Lights,Thursday,273.6ø
Panic On The Streets Of Health Care City (Album Version),Kill The House Lights,Thursday,196.6ø
Music From Kill The House Lights [Demo],Kill The House Lights,Thursday,76.4ø
How Long Is The Night [Original Intro] (Album Version),Kill The House Lights,Thursday,406.8ø
Dead Songs (Album Version),Kill The House Lights,Thursday,174.2ø
A Sketch For Time's Arrow (Album Version),Kill The House Lights,Thursday,100.8ø
The Salmon Dance (Crookers 'Wow' Mix),The Salmon Dance,The Chemical Brothers,317.0ø
The Salmon Dance,The Salmon Dance,The Chemical Brothers,222.1ø
Snooprah,B-Sides - Vol. 1,The Chemical Brothers,435.8ø
Do It Again (Oliver Huntemann Dub),Do It Again,The Chemical Brothers,428.5ø
Clip Kiss,B-Sides - Vol. 1,The Chemical Brothers,416.2ø
Battle Scars (Beyond The Wizard's Sleeve Re-Animation),Battle Scars / The Salmon Dance - Remixes,The Chemical Brothers,516.3ø
You Wear Your Dresses Too Short,Sweeping Up the Spotlight - Jefferson Airplane Live at the Fillmore East 1969,Jefferson Airplane,556.6ø
Tonada Yanomaminista,Smokey Rolls Down Thunder Canyon,Devendra Banhart,176.1ø
The Other Woman,Smokey Rolls Down Thunder Canyon,Devendra Banhart,229.4ø
So Long Old Bean,Smokey Rolls Down Thunder Canyon,Devendra Banhart,176.0ø
Shabop Shalom,Smokey Rolls Down Thunder Canyon,Devendra Banhart,278.3ø
Sea Side,Smokey Rolls Down Thunder Canyon,Devendra Banhart,275.8ø
Sea Horse,Smokey Rolls Down Thunder Canyon,Devendra Banhart,483.7ø
Saved,Smokey Rolls Down Thunder Canyon,Devendra Banhart,333.5ø
Samba Vexillographica,Smokey Rolls Down Thunder Canyon,Devendra Banhart,288.9ø
Rosa,Smokey Rolls Down Thunder Canyon,Devendra Banhart,307.6ø
My Dearest Friend,Smokey Rolls Down Thunder Canyon,Devendra Banhart,155.6ø
Lover,Smokey Rolls Down Thunder Canyon,Devendra Banhart,223.4ø
Freely,Smokey Rolls Down Thunder Canyon,Devendra Banhart,298.6ø
Cristobal,Smokey Rolls Down Thunder Canyon,Devendra Banhart,270.3ø
Carmensita,Smokey Rolls Down Thunder Canyon,Devendra Banhart,289.4ø
Bad Girl,Smokey Rolls Down Thunder Canyon,Devendra Banhart,288.2ø
Go Too Far,Jibbs feat. Jibbs,Jibbs | Melody Thornton,236.0ø
Whatcha' Got,The Undisputed Truth,Brother Ali,273.3ø
Walking Away,The Undisputed Truth,Brother Ali,238.9ø
Truth Is,The Undisputed Truth,Brother Ali,260.3ø
The Puzzle,The Undisputed Truth,Brother Ali,204.5ø
Take Me Home,The Undisputed Truth,Brother Ali,301.9ø
Pedigree,The Undisputed Truth,Brother Ali,216.3ø
Here,The Undisputed Truth,Brother Ali,241.0ø
Faheem,The Undisputed Truth,Brother Ali,169.6ø
Daylight,The Undisputed Truth,Brother Ali,242.1ø
Wedding Dress,Some Mad Hope,Matt Nathanson,234.8ø
To The Beat Of Our Noisy Hearts,Some Mad Hope,Matt Nathanson,181.3ø
Still,Some Mad Hope,Matt Nathanson,231.6ø
Sooner Surrender,Some Mad Hope,Matt Nathanson,269.6ø
Heartbreak World,Some Mad Hope,Matt Nathanson,207.3ø
Gone,Some Mad Hope,Matt Nathanson,209.3ø
Falling Apart,Some Mad Hope,Matt Nathanson,208.0ø
Detroit Waves,Some Mad Hope,Matt Nathanson,195.7ø
Car Crash,Some Mad Hope,Matt Nathanson,208.4ø
Bulletproof Weeks,Some Mad Hope,Matt Nathanson,241.1ø
You're A Wolf (Album),Leaves In The River,Sea Wolf,215.6ø
Winter Windows,Leaves in the River,Sea Wolf,229.6ø
The Rose Captain,Leaves in the River,Sea Wolf,219.3ø
The Garden You Planted,Get To The River Before It Runs Too Low,Sea Wolf,241.8ø
The Cold_ The Dark & The Silence (Album),Leaves In The River,Sea Wolf,265.5ø
Song For The Dead,Leaves in the River,Sea Wolf,206.3ø
Ses Monuments,Get To The River Before It Runs Too Low,Sea Wolf,265.5ø
Neutral Ground,Leaves in the River,Sea Wolf,233.8ø
Middle Distance Runner (Album),Leaves In The River,Sea Wolf,207.7ø
Leaves In The River,Leaves in the River,Sea Wolf,299.8ø
I Made A Resolution,Get To The River Before It Runs Too Low,Sea Wolf,232.6ø
I Don't Know If I'll Be Back This Time,Get To The River Before It Runs Too Low,Sea Wolf,146.2ø
Black Leaf Falls (Album),Leaves In The River,Sea Wolf,205.6ø
Black Dirt (Album),Leaves In The River,Sea Wolf,225.8ø
Where Is Home?,Flux,Bloc Party,333.8ø
Waiting For The 7.18,A Weekend In The City,Bloc Party,255.1ø
The Prayer,Stadium Drum and Bass,Bloc Party,340.3ø
Sunday,A Weekend In The City,Bloc Party,299.5ø
SRXT,A Weekend In The City,Bloc Party,291.9ø
Song For Clay (Disappear Here),A Weekend In The City,Bloc Party,289.6ø
Say It Right,Live Lounge 2,Bloc Party,231.3ø
On,A Weekend In The City,Bloc Party,286.9ø
Kreuzberg,A Weekend In The City,Bloc Party,325.1ø
I Still Remember,A Weekend In The City,Bloc Party,261.3ø
Hunting For Witches,A Weekend In The City,Bloc Party,210.1ø
Emma Kate's Accident,Flux,Bloc Party,338.7ø
Top Of The Charts,Secret Weapon,MxPx,152.5ø
Shut It Down,Secret Weapon,MxPx,178.8ø
Sad Sad Song,Secret Weapon,MxPx,164.4ø
Punk Rawk Celebrity,Secret Weapon,MxPx,161.3ø
Not Nothing,Secret Weapon,MxPx,185.7ø
Never Better Than Now,Secret Weapon,MxPx,167.0ø
Here's To The Life,Secret Weapon,MxPx,176.3ø
Drowning,Secret Weapon,MxPx,230.8ø
Contention,Secret Weapon,MxPx,77.6ø
Biting The Bullet (Is Bad For Business),Secret Weapon,MxPx,198.2ø
Tuolumne,Music For The Motion Picture Into The Wild,Eddie Vedder,60.3ø
The Wolf,Music For The Motion Picture Into The Wild,Eddie Vedder,92.2ø
Society,Music For The Motion Picture Into The Wild,Eddie Vedder,236.3ø
Setting Forth,Music For The Motion Picture Into The Wild,Eddie Vedder,97.9ø
No Ceiling,Music For The Motion Picture Into The Wild,Eddie Vedder,94.0ø
Long Nights,Music For The Motion Picture Into The Wild,Eddie Vedder,151.8ø
Hard Sun,Music For The Motion Picture Into The Wild,Eddie Vedder,321.8ø
Guaranteed,Music For The Motion Picture Into The Wild,Eddie Vedder,164.2ø
Far Behind,Music For The Motion Picture Into The Wild,Eddie Vedder,135.3ø
End Of The Road,Music For The Motion Picture Into The Wild,Eddie Vedder,199.2ø
Worst Case Scenario,Worst Case Scenario,The Hoosiers,162.0ø
Worried About Ray,Goodbye Mr A,The Hoosiers,198.7ø
We Didn't Start The Fire,Worried About Ray,The Hoosiers,113.5ø
The Trick To Life,The Trick To Life,The Hoosiers,168.9ø
The Feeling You Get When,The Trick To Life,The Hoosiers,263.1ø
Run Rabbit Run,The Trick To Life,The Hoosiers,193.7ø
Money To Be Made,The Trick To Life,The Hoosiers,123.5ø
Killer,The Trick To Life,The Hoosiers,229.5ø
Goodbye Mr A,Goodbye Mr. A,The Hoosiers,260.7ø
Everything Goes Dark,The Trick To Life,The Hoosiers,218.3ø
Cops And Robbers,Cops And Robbers,The Hoosiers,287.2ø
Clinging On For Life,The Trick To Life,The Hoosiers,159.8ø
A Sadness Runs Through Him,The Trick To Life,The Hoosiers,193.1ø
Sirens,I-Empire,Angels and Airwaves,259.4ø
Secret Crowds,I-Empire,Angels and Airwaves,302.9ø
Rite Of Spring,I-Empire,Angels and Airwaves,262.2ø
Love Like Rockets,I-Empire,Angels and Airwaves,290.6ø
Lifeline,I-Empire,Angels and Airwaves,255.9ø
Jumping Rooftops,I-Empire,Angels and Airwaves,44.7ø
Heaven,I-Empire,Angels and Airwaves,398.6ø
Everything's Magic,Everything's Magic,Angels and Airwaves,182.7ø
Call To Arms,I-Empire,Angels and Airwaves,305.4ø
You Got Served,White Lies,Lovehatehero,156.5ø
White Lies,White Lies,Lovehatehero,241.8ø
She Puts The Ho In Homewrecker,White Lies,Lovehatehero,224.7ø
Running With Scissors,White Lies,Lovehatehero,241.1ø
Red Dress,White Lies,Lovehatehero,216.7ø
Of Sound And Fury,White Lies,Lovehatehero,198.5ø
Move On,White Lies,Lovehatehero,199.3ø
I'll Make It To The Brigades,White Lies,Lovehatehero,212.8ø
Hollywoodemia,White Lies,Lovehatehero,207.0ø
Goodbye My Love,White Lies,Lovehatehero,213.4ø
Amity,White Lies,Lovehatehero,190.5ø
Waiting For Nothing (Album Version),Happiness LTD.,Hot Hot Heat,269.6ø
So So Cold (Album Version),Happiness LTD.,Hot Hot Heat,247.0ø
Setting Son (Non-Album Track),Let Me In,Hot Hot Heat,185.8ø
Outta Heart (Album Version),Happiness LTD.,Hot Hot Heat,251.6ø
My Best Fiend (Album Version),Happiness LTD.,Hot Hot Heat,173.1ø
Money & Reputation (Non-Album Track),Let Me In,Hot Hot Heat,240.7ø
Let Me In [Josh Harris Remix Edit],Let Me In,Hot Hot Heat,249.0ø
Let Me In [JNRSNCHZ Edit],Let Me In,Hot Hot Heat,300.0ø
Let Me In [Chameleonic Remix Edit],Let Me In,Hot Hot Heat,298.3ø
Let Me In (Album Version),Let Me In,Hot Hot Heat,255.9ø
Harmonicas & Tambourines (Album Version),Happiness LTD.,Hot Hot Heat,184.8ø
Happiness LTD. (Album Version),Happiness LTD.,Hot Hot Heat,274.7ø
Good Day To Die (Album Version),Happiness LTD.,Hot Hot Heat,198.1ø
Give Up? (Album Version),Happiness LTD.,Hot Hot Heat,214.4ø
Conversation (Album Version),Happiness LTD.,Hot Hot Heat,158.3ø
5 Times Out Of 100 (Album Version),Happiness LTD.,Hot Hot Heat,181.2ø
Thrash Unreal (Album Version),New Wave,Against Me!,254.2ø
You Don't Have To Go Home,One Of The Boys,Gretchen Wilson,197.2ø
To Tell You The Truth,One Of The Boys,Gretchen Wilson,211.6ø
There's A Place In The Whiskey,One Of The Boys,Gretchen Wilson,181.7ø
There Goes The Neighborhood,One Of The Boys,Gretchen Wilson,177.2ø
The Girl I Am,One Of The Boys,Gretchen Wilson,209.6ø
Pain Killer,One Of The Boys,Gretchen Wilson,222.4ø
One Of The Boys,One Of The Boys,Gretchen Wilson,217.4ø
If You Want A Mother,One Of The Boys,Gretchen Wilson,213.0ø
Heaven Help Me,One Of The Boys,Gretchen Wilson,204.4ø
Good Ole Boy,One Of The Boys,Gretchen Wilson,171.3ø
Young Modern Station,Young Modern,Silverchair,191.3ø
Waiting All Day,Young Modern,Silverchair,268.6ø
Those Thieving Birds (Part 1) / Strange Behaviour / Those Thieving Birds (Part 2),Young Modern,Silverchair,446.0ø
Reflections Of A sound,Young Modern,Silverchair,249.4ø
Low,Young Modern,Silverchair,228.1ø
Insomnia,Young Modern,Silverchair,186.3ø
All Across The World,Young Modern,Silverchair,241.3ø
Hearts On Fire,Hearts Of Fire,Cut Copy,339.2ø
Soul Singer In A Session Band,Cassadaga,Bright Eyes,253.0ø
Do It Again (Edit),Brotherhood,The Chemical Brothers,219.3ø
Wolves (Song of the Shepherd's Dog) (Album),The Shepherd's Dog,Iron And Wine,297.6ø
O Holy Night (LP Version),Songs Of The Season,Randy Travis,221.4ø
Joy To The World (LP Version),Songs Of The Season,Randy Travis,166.8ø
Angels We Have Heard On High (LP Version),Songs Of The Season,Randy Travis,204.3ø
The Tune,Hope & Sorrow,Wax Tailor,177.7ø
Radio Broadcast,Hope & Sorrow,Wax Tailor,54.7ø
What You Think Of That (Amended Album Version),The Makings Of A Man,Jaheim,206.3ø
Voice Of R&B (Explicit Album Version),The Makings Of A Man,Jaheim,175.6ø
She Ain't You (Amended Album Version),The Makings Of A Man,Jaheim,203.3ø
Never (Amended Album Version),The Makings Of A Man,Jaheim,266.4ø
Make A Wish (Amended Album Version),The Makings Of A Man,Jaheim,231.2ø
Lonely (Amended Album Version),The Makings Of A Man,Jaheim,284.6ø
Life Of A Thug (Explicit Album Version),The Makings Of A Man,Jaheim,269.8ø
Just Don't Have A Clue (Explicit Album Version),The Makings Of A Man,Jaheim,247.2ø
I've Changed [feat. Keyshia Cole] (Amended Album Version),The Makings Of A Man,Jaheim,213.8ø
Hush (Explicit Album Version),The Makings Of A Man,Jaheim,224.6ø
Have You Ever (Amended Album Version),The Makings Of A Man,Jaheim,231.4ø
Back Together Again (Amended Album Version),The Makings Of A Man,Jaheim,243.6ø
No Sitar (outro),Beat Konducta Vol. 3 & 4: In India,Madlib,114.4ø
New Bombay,Beat Konducta Vol. 3 & 4: In India,Madlib,131.7ø
Masala,Beat Konducta Vol. 3 & 4: In India,Madlib,68.5ø
Malfunction,Beat Konducta Vol. 3 & 4: In India,Madlib,68.6ø
Main Title,Beat Konducta Vol. 3 & 4: In India,Madlib,91.2ø
Indian Deli,Beat Konducta Vol. 3 & 4: In India,Madlib,107.8ø
In The Cave,Beat Konducta Vol. 3 & 4: In India,Madlib,82.9ø
Dark Alley Incidental Music,Beat Konducta Vol. 3 & 4: In India,Madlib,143.2ø
Club Scene,Beat Konducta Vol. 3 & 4: In India,Madlib,86.6ø
What I Want,Garage Classics Volume II Summer Edition,Bob Sinclar Presents Fireball,371.6ø
The Beat Goes On (Mousse T Remix),Defected Clubland Adventures - 10 Years In The House Volume 2,Bob Sinclar,508.5ø
Sound Of Freedom,SOUND OF FREEDOM,Bob Sinclar feat. Gary Pine & Dollarman,409.7ø
To Be Surprised,Dan In Real Life (Original Motion Picture Soundtrack),Sondre Lerche,261.0ø
My Hands Are Shaking,Dan In Real Life (Original Motion Picture Soundtrack),Sondre Lerche,179.9ø
Let My Love Open The Door,Dan In Real Life (Original Motion Picture Soundtrack),Sondre Lerche,146.0ø
I'll Be OK (Instrumental Reprise),Dan In Real Life (Original Motion Picture Soundtrack),Sondre Lerche,219.5ø
I'll Be OK,Dan In Real Life (Original Motion Picture Soundtrack),Sondre Lerche,219.2ø
Family Theme Waltz,Dan In Real Life (Original Motion Picture Soundtrack),Sondre Lerche,49.7ø
Dan and Marie Picking Hum,Dan In Real Life (Original Motion Picture Soundtrack),Sondre Lerche,55.4ø
Worms,All Hour Cymbals,Yeasayer,247.1ø
Waves,All Hour Cymbals,Yeasayer,296.6ø
Wait For The Wintertime,All Hour Cymbals,Yeasayer,292.3ø
Wait For The Summer,All Hour Cymbals,Yeasayer,293.0ø
Sunrise,All Hour Cymbals,Yeasayer,246.9ø
Red Cave,All Hour Cymbals,Yeasayer,298.9ø
no Need to Worry,All Hour Cymbals,Yeasayer,326.9ø
Germs,All Hour Cymbals,Yeasayer,192.5ø
Final Path,Wait For The Summer,Yeasayer,295.5ø
ah_ Weir,All Hour Cymbals,Yeasayer,81.4ø
2080,All Hour Cymbals,Yeasayer,323.4ø
You Don't Know Me featuring D. Woods (Explicit Album Version),Welcome To The Zoo,Gorilla Zoe featuring D. Woods,208.7ø
Tryna Make A Jug featuring Big Gee (Amended Album Version),Welcome To The Zoo,Gorilla Zoe featuring Big Gee,250.6ø
Take Your Shoes Off featuring Yung Joc (Explicit Album Version),Welcome To The Zoo,Gorilla Zoe featuring Yung Joc,265.6ø
Real Mother***** featuring Boyz N Da Hood (Amended Album Version),Welcome To The Zoo,Gorilla Zoe featuring Boyz N Da Hood,304.3ø
Real Mother**** featuring Boyz N Da Hood (Explicit Album Version),Welcome To The Zoo,Gorilla Zoe featuring Boyz N Da Hood,304.4ø
Money Up (Explicit Album Version),Welcome To The Zoo,Gorilla Zoe,217.7ø
