Kameleon,Aerial,2652,335.9ø
Zenith,The Blue,Novembre,431.8ø
Animal Hides,Subcultures,Dr. Syntax,148.0ø
Viimeiseen mieheen -Only One Woman-,Ensiaskeleet,Kristian Meurman,197.6ø
The Entertainer,IDOLS 2007,Kristian Meurman,218.2ø
Nousta sain aamuun -Morning Has Broken-,Ensiaskeleet,Kristian Meurman,179.6ø
Nousevan auringon talo -House Of The Rising Sun-,Ensiaskeleet,Kristian Meurman,242.3ø
Mennyt,Ensiaskeleet,Kristian Meurman,247.6ø
Halleluja -Hallelujah-,Ensiaskeleet,Kristian Meurman,335.9ø
Aamu,Ensiaskeleet,Kristian Meurman,206.2ø
Give You,Riddim Driven: Dem Time Deh,Alaine,145.1ø
Perfect Sky featuring Joy Rose,Seven Ways To Wonder,Reel People,416.3ø
Who Wants to Ride This Train (Bonus Track),Rearview Mirror Tears,Kendel Carson,191.3ø
There's No Angel on my Shoulder (Bonus Track),Rearview Mirror Tears,Kendel Carson,229.3ø
Take Me Down to the River,Rearview Mirror Tears,Kendel Carson,294.9ø
Run to the Middle of the Mornin',Rearview Mirror Tears,Kendel Carson,171.9ø
Ribbons and Bows,Rearview Mirror Tears,Kendel Carson,180.4ø
Just What Happened to the Moon,Rearview Mirror Tears,Kendel Carson,184.4ø
In the Middle of a Think About You,Rearview Mirror Tears,Kendel Carson,169.7ø
I Like Trucks,Rearview Mirror Tears,Kendel Carson,233.1ø
I Certainly Know Why,Rearview Mirror Tears,Kendel Carson,185.7ø
Gold in the Hills (of Saltery Bay),Rearview Mirror Tears,Kendel Carson,246.3ø
Especially for a Girl,Rearview Mirror Tears,Kendel Carson,215.9ø
Child All Over Again,Rearview Mirror Tears,Kendel Carson,155.9ø
Ain't That a Sun,Rearview Mirror Tears,Kendel Carson,265.4ø
Play It Loud (Noise Provider Remix),Jump 2.0,Jeckyll & Hyde,251.1ø
Dancing With the Goddess (Yak Mix),97 | 07,Atman,193.5ø
Loose Gardener,This Is Djs Choice / Soulinus & Pun,Flevans,237.3ø
Listening Garden (5),Listening Garden,Taylor Deupree and Christopher Willits,249.9ø
Listening Garden (4),Listening Garden,Taylor Deupree and Christopher Willits,461.6ø
Listening Garden (2),Listening Garden,Taylor Deupree and Christopher Willits,367.8ø
Listening Garden (1),Listening Garden,Taylor Deupree and Christopher Willits,317.7ø