1979 (Live From UK Tour),American Gothic,Smashing Pumpkins,271.7ø
In My Arms (Chris Lake Vocal Mix),In My Arms,Kylie Minogue,397.1ø
Younglife,New Surrender,Anberlin,219.5ø
The Resistance,New Surrender,Anberlin,196.9ø
Soft Skeletons,New Surrender,Anberlin,249.3ø
Retrace,New Surrender,Anberlin,230.4ø
miserabile visu {ex malo bonum},New Surrender,Anberlin,396.9ø
Haight St,New Surrender,Anberlin,179.3ø
Feel Good Drag,New Surrender,Anberlin,187.8ø
Burn Out Brighter (Northern Lights),New Surrender,Anberlin,214.0ø
Breaking,New Surrender,Anberlin,206.4ø
Blame Me! Blame Me!,New Surrender,Anberlin,189.1ø
Out From Under,Circus (Deluxe Version),Britney Spears,233.8ø
If U Seek Amy,If U Seek Amy,Britney Spears,269.0ø
"Gimme More (""Kimme More"" Remix)",Piece Of Me,Britney Spears featuring Lil Kim,252.7ø
Video Girl,A Little Bit Longer,Jonas Brothers,173.9ø
Tonight,Music from the 3D Concert Experience,Jonas Brothers,210.7ø
Shelf,When You Look Me In The Eyes,Jonas Brothers,294.9ø
Pushin' Me Away,A Little Bit Longer,Jonas Brothers,183.1ø
One Man Show,A Little Bit Longer,Jonas Brothers,188.5ø
Live To Party,A Little Bit Longer,Jonas Brothers,175.5ø
Got Me Going Crazy,A Little Bit Longer,Jonas Brothers,155.9ø
Can't Have You,A Little Bit Longer,Jonas Brothers,268.0ø
Burnin' Up,2009 GRAMMY Nominees,Jonas Brothers,175.1ø
BB Good,Music from the 3D Concert Experience,Jonas Brothers,255.1ø
A Little Bit Longer,A Little Bit Longer,Jonas Brothers,205.0ø
Torn (Album Version),Indestructible,Disturbed,249.3ø
The Night (Album Version),Indestructible,Disturbed,286.0ø
The Curse (Album Version),Indestructible,Disturbed,204.5ø
Enough (Album Version),Indestructible,Disturbed,259.9ø
Criminal (Album Version),Indestructible,Disturbed,255.9ø
What Them Girls Like,Theater Of The Mind,Ludacris | Chris Brown | Sean Garrett,242.1ø
Undisputed,Theater Of The Mind,Ludacris | Floyd Mayweather,273.0ø
One More Drink,Theater Of The Mind,Ludacris | T-Pain,220.8ø
MVP,Theater Of The Mind,Ludacris,229.9ø
Everybody Hates Chris,Theater Of The Mind,Ludacris | Chris Rock,293.7ø
Do The Right Thang (co-starring Common and Spike Lee),Theater Of The Mind,Ludacris | Common | Spike Lee,313.9ø
Way Away (Live),Live From Las Vegas At The Palms,Yellowcard,243.0ø
The Takedown (Live),Live From Las Vegas At The Palms,Yellowcard,278.4ø
Shadows and Regrets (Live),Live From Las Vegas At The Palms,Yellowcard,309.0ø
Rough Landing_ Holly (Live),Live From Las Vegas At The Palms,Yellowcard,294.1ø
Only One (Acoustic) (Live),Live From Las Vegas At The Palms,Yellowcard,347.4ø
Ocean Avenue (Live),Live From Las Vegas At The Palms,Yellowcard,236.3ø
Light Up The Sky (Live),Live From Las Vegas At The Palms,Yellowcard,217.5ø
Keeper (Live),Live From Las Vegas At The Palms,Yellowcard,301.3ø
Fighting (Live),Live From Las Vegas At The Palms,Yellowcard,188.0ø
Severe Area,I Don't Care,Apocalyptica,262.0ø
Refuse / Resist,Inquisition Symphony,Apocalyptica,193.1ø
Sorrow (acoustic),New Maps of Hell Deluxe Version,Bad Religion,192.1ø
God Song (acoustic),New Maps of Hell Deluxe Version,Bad Religion,159.0ø
Dearly Beloved (acoustic),New Maps of Hell Deluxe Version,Bad Religion,156.9ø
Adam's Atoms (acoustic),New Maps of Hell Deluxe Version,Bad Religion,155.8ø
Pox [American Gothic EP],American Gothic,Smashing Pumpkins,217.8ø
Womanizer,The Singles Collection,Britney Spears,223.4ø
Shattered Glass,Circus,Britney Spears,172.4ø
Mmm Papi,Circus,Britney Spears,202.3ø
Kill The Lights,Circus,Britney Spears,239.2ø
Dez Moines,With Roots Above And Branches Below,The Devil Wears Prada,243.6ø
Piece Of Me (Main Version),Now That's What I Call Music! 69,Britney Spears,210.6ø
My Baby,Circus,Britney Spears,198.7ø
Live Every Second,Ready_ Set_ Go!,Tokio Hotel,229.8ø
Why Did You Leave Me,Ego Trippin',Snoop Dogg,247.2ø
Sets Up,Ego Trippin',Snoop Dogg,206.9ø
No More Games,R & B Legends,Snoop Dogg ft. Prince Ital Joe & Nate Dogg,286.8ø
Can't Say Goodbye,Ego Trippin',Snoop Dogg | Charlie Wilson,247.6ø
Womanizer ,Dance Nation,Britney Spears,397.0ø
Mannequin,Circus,Britney Spears,246.5ø
Blur,Circus,Britney Spears,187.9ø
TAPP (Album Version),WANT,3OH!3,61.8ø
STILLAROUND [BIGMIX] (Bonus Version),WANT,3OH!3,205.8ø
STILLAROUND (Album Version),WANT,3OH!3,187.9ø
STARSTRUKK [FEATURINGKATYPERRY] (Explicit Bonus Version),WANT,3OH!3,202.7ø
RICHMAN (Explicit Album Version),WANT,3OH!3,199.6ø
PUNKB*TCH (Explicit Album Version),WANT,3OH!3,231.0ø
PHOTOFINNISH (Explicit Album Version),WANT,3OH!3,234.7ø
IMNOTYOURBOYFRIENDBABY (Amended Album Version),WANT,3OH!3,224.7ø
HOLLERTILYOUPASSOUT (Amended Album Version),WANT,3OH!3,250.7ø
DONTTRUSTME [BENNYBLANCOREMIX] FEATURINGKIDCUDI (Explicit Bonus Version),WANT,3OH!3,196.3ø
COLORADOSUNRISE (Explicit Album Version),WANT,3OH!3,202.7ø
Run,Spirit,Leona Lewis,314.7ø
Forgive Me,R&B Love Songs 2010,Leona Lewis,203.9ø
Lovebug,A Little Bit Longer,Jonas Brothers,220.7ø
Comin' Around,Shake It,Metro Station,160.2ø
Skyscraper (acoustic),New Maps of Hell Deluxe Version,Bad Religion,180.0ø
Yamaha Mama,iSouljaBoyTellem,Soulja Boy Tell'em | Sean Kingston,278.7ø
Turn My Swag On,R&B Collection,Soulja Boy Tell'em,208.6ø
Into My Web (Non-Album Track),Shallow Believer,The Used,217.5ø
You'll Always Be My Best Friend (Album Version),The Bird And The Bee Sides,Relient K,99.6ø
Wit's All Been Done Before (Album Version),The Bird And The Bee Sides,Relient K,210.1ø
Who I Am Hates Who I've Been (Acoustic),Punk Goes Acoustic 2,Relient K,201.5ø
Where Do I Go From Here (Album Version),The Bird And The Bee Sides,Relient K,135.4ø
There Was No Thief (Album Version),The Bird And The Bee Sides,Relient K,202.8ø
There Was Another Time In My Life (Album Version),The Bird And The Bee Sides,Relient K,171.5ø
The Vinyl Countdown (Album Version),The Bird And The Bee Sides,Relient K,169.7ø
The Stenographer [Demo],The Bird And The Bee Sides,Relient K,150.5ø
The Scene And Herd (Album Version),The Bird And The Bee Sides,Relient K,173.7ø
The Lining Is Silver (Album Version),The Bird And The Bee Sides,Relient K,221.1ø
The Last_ The Lost_ The Least (Album Version),The Bird And The Bee Sides,Relient K,145.4ø
Nothing Without You (Album Version),The Bird And The Bee Sides,Relient K,254.2ø
No Reaction (Album Version),The Bird And The Bee Sides,Relient K,63.5ø
Jefferson Aeroplane [Demo],The Bird And The Bee Sides,Relient K,238.9ø
I Just Want You To Know (Album Version),The Bird And The Bee Sides,Relient K,177.4ø
Here I Go [Demo],The Bird And The Bee Sides,Relient K,154.6ø
For The Band (Album Version),The Bird And The Bee Sides,Relient K,255.0ø
Five Iron Frenzy Is Either Dead Or Dying [Ska Version],The Bird And The Bee Sides,Relient K,42.0ø
Five Iron Frenzy Is Either Dead Or Dying (Album Version),The Bird And The Bee Sides,Relient K,32.4ø
Curl Up And Die (Album Version),The Bird And The Bee Sides,Relient K,248.4ø
Bee Your Man (Album Version),The Bird And The Bee Sides,Relient K,98.3ø
Beaming (Album Version),The Bird And The Bee Sides,Relient K,60.8ø
At Least We Made It This Far (Album Version),The Bird And The Bee Sides,Relient K,173.8ø
A Penny Loafer Saved Is A Penny Loafer Earned (Album Version),The Bird And The Bee Sides,Relient K,139.3ø
Who's Going Home With You Tonight?,Only Through The Pain,Trapt,214.5ø
Wherever She Goes,Only Through The Pain,Trapt,222.4ø
The Last Tear,Only Through The Pain,Trapt,254.7ø
Ready When You Are,Only Through The Pain,Trapt,296.5ø
Only One In Color,Only Through The Pain,Trapt,257.9ø
Curiosity Kills,Only Through The Pain,Trapt,261.0ø
Cover Up,Only Through The Pain,Trapt,224.3ø
Contagious,Only Through The Pain,Trapt,262.8ø
Black Rose,Only Through The Pain,Trapt,280.7ø
Play My Music,Camp Rock OST,Jonas Brothers,196.9ø
Show Me The Meaning,Just Want You To Know,Backstreet Boys,284.4ø
The Fear,The Fear,Lily Allen,207.6ø
Youthless (Mix K),Youthless,Beck,181.1ø
Volcano,Modern Guilt,Beck,267.8ø
Soul Of A Man,Modern Guilt,Beck,158.4ø
Orphans,Modern Guilt,Beck,197.9ø
Modern Guilt,Modern Guilt,Beck,196.5ø
Gold Chains,Odelay - Deluxe Edition,Beck,299.5ø
You Can't See The Forest For The Wolves,Memory And Humanity,Funeral For A Friend,204.9ø
Waterfront Dance Club,Memory And Humanity,Funeral For A Friend,264.5ø
To Die Like Mouchette,Memory And Humanity,Funeral For A Friend,202.8ø
Someday The Fire&,Memory And Humanity,Funeral For A Friend,195.9ø
Rules And Games,Rules And Games,Funeral For A Friend,189.7ø
Maybe I Am?,Memory And Humanity,Funeral For A Friend,218.3ø
Kicking And Screaming,Kicking & Screaming,Funeral For A Friend,229.2ø
Constant Resurrections,Memory And Humanity,Funeral For A Friend,265.8ø
Constant Illuminations,Memory And Humanity,Funeral For A Friend,178.9ø
Charlie Don't Surf,Memory And Humanity,Funeral For A Friend,226.6ø
Building,Memory And Humanity,Funeral For A Friend,160.2ø
Beneath The Burning Tree,Memory And Humanity,Funeral For A Friend,214.2ø
Not Now But Soon,Not Now But Soon,Imogen Heap,224.1ø
POV,radio:ACTIVE,McFly,233.8ø
Only The Strong Survive,radio:ACTIVE,McFly,211.9ø
Lies (Johnny Phonetti Remix),Lies (Johnny Phonetti Remix),McFly,252.0ø
Falling In Love,radio:ACTIVE,McFly,267.6ø
Do Ya,Nokia Green Room Xmas Special,McFly,177.2ø
Corrupted,radio:ACTIVE,McFly,219.5ø
Roadkill Morning,Blooddrunk,Children Of Bodom,212.4ø
One Day You Will Cry,Blooddrunk,Children Of Bodom,245.3ø
Lookin' Out My Back Door,Blooddrunk,Children Of Bodom,128.7ø
Lobodomy,Blooddrunk,Children Of Bodom,263.6ø
Hellhounds on My Trail,Blooddrunk,Children Of Bodom,238.1ø
Done with Everything_ Die for Nothing,Blooddrunk,Children Of Bodom,209.2ø
Another Heart Calls,When The World Comes Down,The All-American Rejects,247.7ø
You Left Me,Can't Stop Won't Stop,The Maine,209.0ø
Whoever She Is,Can't Stop Won't Stop,The Maine,221.1ø
We'll All Be...,Can't Stop Won't Stop,The Maine,330.6ø
We All Roll Along,Can't Stop Won't Stop,The Maine,228.8ø
Time To Go,Can't Stop Won't Stop,The Maine,174.9ø
This Is The End,Can't Stop Won't Stop,The Maine,174.0ø
Santa Stole My Girlfriend,... And A Happy New Year,The Maine,181.6ø
Mr. Winter,... And A Happy New Year,The Maine,200.7ø
Kiss And Sell,Can't Stop Won't Stop,The Maine,187.3ø
I Must Be Dreaming,Can't Stop Won't Stop,The Maine,166.2ø
Girls Do What They Want,Can't Stop Won't Stop,The Maine,192.6ø
Everything I Ask For,Can't Stop Won't Stop,The Maine,157.5ø
Count 'Em One_ Two_ Three,Can't Stop Won't Stop,The Maine,173.6ø
Pretend That You're Alone,Perfect Symmetry,Keane,267.2ø
Playing Along,Perfect Symmetry,Keane,333.5ø
Again & Again,Perfect Symmetry,Keane,250.3ø
Twinkle,New Amerykah Part One (4th World War),Erykah Badu,416.8ø
The Cell,New Amerykah Part One (4th World War),Erykah Badu,260.9ø
That Hump,New Amerykah Part One (4th World War),Erykah Badu,324.6ø
My People,New Amerykah Part One (4th World War),Erykah Badu,205.0ø
Me,New Amerykah Part One (4th World War),Erykah Badu,336.5ø
Master Teacher,New Amerykah Part One (4th World War),Erykah Badu,407.8ø
Honey,Honey,Erykah Badu,260.2ø
Tonight You're In For A Special Treat (Live in Pittsburgh_ May 2_ 1970),Live In Pittsburgh 1970,The Doors,88.9ø
Love Hides (Live in Pittsburgh_ May 2_ 1970),Live In Pittsburgh 1970,The Doors,143.8ø
Five To One (Live in Pittsburgh_ May 2_ 1970),Live In Pittsburgh 1970,The Doors,318.5ø
Back Door Man (Live in Pittsburgh_ May 2_ 1970),Live In Pittsburgh 1970,The Doors,167.6ø
One Pure Thought (Toddla T Remix),One Pure Thought,Hot Chip,163.3ø
Music From Electric And Musical Industries,Colours (The B-Sides),Hot Chip,342.0ø
Talking Bird (Album Version),Narrow Stairs,Death Cab for Cutie,203.0ø
Grapevine Fires (Album Version),Narrow Stairs,Death Cab for Cutie,247.4ø
You Won't Make A Fool Out of me,Float,Flogging Molly,163.2ø
us of Lesser Gods,Float,Flogging Molly,199.7ø
The Story so Far,Float,Flogging Molly,251.4ø
The Lightning Storm,Live at the Greek Theatre,Flogging Molly,251.8ø
Punch Drunk Grinning Soul,Float,Flogging Molly,260.8ø
Man With No Country,Live at the Greek Theatre,Flogging Molly,248.6ø
From The Back of A Broken Dream,Float,Flogging Molly,201.5ø
(No More) Paddy's Lament,Live at the Greek Theatre,Flogging Molly,233.3ø
Cars Hiss By My Window ( LP Version ),The Platinum Collection,The Doors,249.5ø
Away In India (Live in Pittsburgh_ May 2_ 1970),Live In Pittsburgh 1970,The Doors,188.9ø
Yellow Angels,Life Is Not A Waiting Room,Senses Fail,222.2ø
Wolves At The Door,Life Is Not A Waiting Room,Senses Fail,207.7ø
Map Out The Streets,Life Is Not A Waiting Room,Senses Fail,207.3ø
Lungs Like Gallows,Life Is Not A Waiting Room,Senses Fail,201.0ø
Hair Of The Dog,Life Is Not A Waiting Room,Senses Fail,230.3ø
Garden State,Life Is Not A Waiting Room,Senses Fail,218.8ø
Four Years,Life Is Not A Waiting Room,Senses Fail,255.6ø
Fireworks At Dawn,Life Is Not A Waiting Room,Senses Fail,130.0ø
Family Tradition,Life Is Not A Waiting Room,Senses Fail,214.6ø
Chandelier,Life Is Not A Waiting Room,Senses Fail,220.9ø
Blackout,Life Is Not A Waiting Room,Senses Fail,294.6ø
Ali For Cody,Life Is Not A Waiting Room,Senses Fail,242.2ø
Your Call (Radio Version),A Twist In My Story (Deluxe),Secondhand Serenade,234.5ø
Suppose,A Twist In My Story,Second Hand Serenade,226.7ø
Stranger,A Twist In My Story,Second Hand Serenade,286.4ø
Stay Close_ Don't Go,A Twist In My Story,Second Hand Serenade,214.0ø
Pretend,A Twist In My Story,Second Hand Serenade,210.1ø
Like A Knife (Acoustic),A Twist In My Story (Deluxe),Secondhand Serenade,265.6ø
Fall For You (Acoustic),A Twist In My Story (Deluxe),Secondhand Serenade,188.7ø
Fall For You,A Twist In My Story,Second Hand Serenade,183.6ø
A Twist In My Story,A Twist In My Story,Second Hand Serenade,247.6ø
The Panda Rat,The Mix Up Bonus Tracks,Beastie Boys,220.6ø
The Spy  (LP Version),The Platinum Collection,The Doors,255.4ø
We Carry On,Third,Portishead,387.8ø
Threads,Third,Portishead,347.8ø
The Rip,Third,Portishead,271.0ø
Silence,Third,Portishead,300.8ø
Nylon Smile,Third,Portishead,196.6ø
Magic Doors,Third,Portishead,211.9ø
Deep Water,Third,Portishead,93.2ø
Y.O.U.,Avant,Avant,244.4ø
Sensuality,Avant,Avant,190.3ø
Sailing,Avant,Avant,255.0ø
Out of Character,Avant,Avant,223.0ø
Involve Yourself,Avant,Avant,220.2ø
French Pedicure,Avant,Avant,227.8ø
Break Ya Back,Avant,Avant,204.7ø
Attention,Avant,Avant featuring Snoop Dogg,207.2ø
Face Down (Album Version),Don't You Fake It,The Red Jumpsuit Apparatus,191.8ø
Feedback,Feedback,Janet Jackson,226.4ø
Tell That Mick He Just Made My List Of Things To Do Today,**** Live In Phoenix,Fall Out Boy,211.7ø
Sugar_ We're Goin Down,**** Live In Phoenix,Fall Out Boy,217.2ø
Grand Theft Autumn / Where Is Your Boy,**** Live In Phoenix,Fall Out Boy,195.4ø
Beat It,Believers Never Die - Greatest Hits,Fall Out Boy | John Mayer,229.4ø
America's Suitehearts,Alternative Summer 2009,Fall Out Boy,214.3ø
"A Little Less Sixteen Candles_ A Little More ""Touch Me",**** Live In Phoenix,Fall Out Boy,166.2ø
Dear Katie (Single Version),Carry You Home,James Blunt,150.0ø
Carry You Home (Radio Edit),Carry You Home,James Blunt,230.8ø
Carry You Home (Live Acoustic),Carry You Home,James Blunt,240.8ø
Breakfast In America (Live),All The Lost Souls,James Blunt,278.2ø
Wish It Would Break (Live),Greatest Hits / Every Mile A Memory 2003 - 2008,Dierks Bentley,272.7ø
Sweet & Wild,Greatest Hits / Every Mile A Memory 2003 - 2008,Dierks Bentley,289.2ø
So So Long (Live),Greatest Hits / Every Mile A Memory 2003 - 2008,Dierks Bentley,223.0ø
Lot Of Leavin' Left To Do (Live),Greatest Hits / Every Mile A Memory 2003 - 2008,Dierks Bentley,343.1ø
Free And Easy (Down The Road I Go),Greatest Hits / Every Mile A Memory 2003 - 2008,Dierks Bentley,200.9ø
Feel That Fire,Feel That Fire,Dierks Bentley,200.0ø
Come A Little Closer (Live),Greatest Hits / Every Mile A Memory 2003 - 2008,Dierks Bentley,346.0ø
Somebody To Love Me,Kellie Pickler (Deluxe Version),Kellie Pickler,259.1ø
Rocks Instead Of Rice,Kellie Pickler (Deluxe Version),Kellie Pickler,199.3ø
One Last Time,Kellie Pickler (Deluxe Version),Kellie Pickler,205.7ø
Makin' Me Fall In Love Again,Kellie Pickler (Deluxe Version),Kellie Pickler,205.9ø
Lucky Girl,Kellie Pickler (Deluxe Version),Kellie Pickler,150.2ø
I'm Your Woman,Kellie Pickler (Deluxe Version),Kellie Pickler,176.3ø
Going Out In Style,Kellie Pickler (Deluxe Version),Kellie Pickler,215.5ø
Best Days Of Your Life,Kellie Pickler (Deluxe Version),Kellie Pickler,226.8ø
Two Worlds Collide,Don't Forget,Demi Lovato,198.2ø
Trainwreck,Don't Forget,Demi Lovato,197.5ø
This Is Me,La La Land,Jonas Brothers | Demi Lovato,202.1ø
The Middle,Don't Forget,Demi Lovato,185.2ø
Party,Don't Forget,Demi Lovato,233.2ø
La La Land,La La Land,Demi Lovato,369.3ø
Gonna Get Caught,Don't Forget,Demi Lovato,190.9ø
Get Back,Don't Forget,Demi Lovato,200.2ø
Don't Forget,Don't Forget,Demi Lovato,223.2ø
Believe In Me,Don't Forget,Demi Lovato,221.9ø
The Warrior Inside (Album Version),Ultra Beatdown,Dragonforce,434.7ø
The Last Journey Home (Album Version),Ultra Beatdown,Dragonforce,492.5ø
The Fire Still Burns (Album Version),Ultra Beatdown,Dragonforce,470.0ø
Strike of the Ninja (Album Version),Ultra Beatdown,Dragonforce,198.2ø
Scars of Yesterday (Album Version),Ultra Beatdown,Dragonforce,466.9ø
Reasons to Live (Album Version),Ultra Beatdown,Dragonforce,385.7ø
Inside The Winter Storm (Album Version),Ultra Beatdown,Dragonforce,491.5ø
Heroes of Our Time (Album Version),Heroes Of Our Time,Dragonforce,433.9ø
Heartbreak Armageddon (Album Version),Ultra Beatdown,Dragonforce,460.9ø
A Flame For Freedom (Album Version),Ultra Beatdown,Dragonforce,320.2ø
Peace Sign / Index Down [feat. Busta Rhymes] (Explicit Album Version),The Quilt,Gym Class Heroes,243.3ø
No Place To Run (Album Version),The Quilt,Gym Class Heroes,225.2ø
Live Forever [Fly With Me] [feat. Daryl Hall],The Quilt,Gym Class Heroes,428.8ø
Live A Little (Explicit Album Version),The Quilt,Gym Class Heroes,223.2ø
Like Father_ Like Son [Papa's Song]  (Explicit Album Version),The Quilt,Gym Class Heroes,256.8ø
Kissin' Ears [feat. The-Dream] (Explicit Album Version),The Quilt,Gym Class Heroes,222.5ø
Home (Explicit Album Version),The Quilt,Gym Class Heroes,309.1ø
Guilty As Charged [feat. Estelle] (Explicit Album Version),The Quilt,Gym Class Heroes,240.7ø
Drnk Txt Rmeo (Album Version),The Quilt,Gym Class Heroes,204.9ø
Don't Tell Me It's Over (Explicit Album Version),The Quilt,Gym Class Heroes,251.3ø
Coming Clean (Album Version),The Quilt,Gym Class Heroes,180.0ø
Blinded By The Sun   (Explicit Album Version),The Quilt,Gym Class Heroes,180.9ø
Temblor,Talento De Barrio,Daddy Yankee,195.0ø
Talento De Barrio,Talento De Barrio,Daddy Yankee,187.4ø
Suelta,Talento De Barrio,Daddy Yankee,209.2ø
Somos De Calle,Talento De Barrio,Daddy Yankee,214.8ø
Salgo Pa' La Calle,Talento De Barrio,Daddy Yankee | Randy,267.6ø
Que Tengo Que Hacer,Talento De Barrio,Daddy Yankee,218.2ø
Pose,Talento De Barrio,Daddy Yankee,216.6ø
Pasion,Talento De Barrio,Daddy Yankee | Arcangel,235.9ø
Pa-Kumpa!!,Talento De Barrio,Daddy Yankee,200.6ø
Llamado De Emergencia,Talento De Barrio,Daddy Yankee,239.9ø
K-dela,Talento De Barrio,Daddy Yankee,221.6ø
Infinito,Talento De Barrio,Daddy Yankee,196.3ø
De La Paz Y De La Guerra,Talento De Barrio,Daddy Yankee,235.1ø
Como Y Vete,Talento De Barrio,Daddy Yankee,221.4ø
Clumsy,The Dutchess,Fergie,240.5ø
Hold It Don't Drop It,Brave,Jennifer Lopez,235.3ø
Shifty,Black Shines Through The Black EP,Fergie,455.7ø
Senderon,The Me EP,Fergie,420.8ø
Senderoff,The Me EP,Fergie,507.1ø
Ireland,Great Summergames Stuff,Fergie,415.2ø
Anon,The Me EP,Fergie,438.9ø
Uh Huh,Underdog Alma Mater,Forever The Sickest Kids,178.2ø
The Way She Moves,Underdog Alma Mater,Forever The Sickest Kids,222.8ø
That For Me,Underdog Alma Mater,Forever The Sickest Kids,176.6ø
Phone Call,Underdog Alma Mater,Forever The Sickest Kids,198.9ø
My Worst Nightmare,Underdog Alma Mater,Forever The Sickest Kids,225.6ø
Hurricane Haley,Woah Oh!,Forever The Sickest Kids,222.6ø
Catastrophe,Underdog Alma Mater,Forever The Sickest Kids,198.2ø
Believe Me_ I'm Lying,Underdog Alma Mater,Forever The Sickest Kids,185.3ø
Superstar,Live Lounge 3,Lupe Fiasco,313.5ø
Welcome Back,The Recession,Young Jeezy,247.0ø
The Corner (Album Version),The Illusion Of Progress,Staind,317.8ø
Schizophrenic Conversations [Live at Hiro Ballroom],The Illusion Of Progress,Staind,286.5ø
Rainy Day Parade (Album Version),The Illusion Of Progress,Staind,257.1ø
Raining Again (Album Version),The Illusion Of Progress,Staind,233.5ø
Pardon Me (Album Version),The Illusion Of Progress,Staind,302.8ø
Nothing Left To Say (Album Version),The Illusion Of Progress,Staind,280.5ø
It's Been Awhile [Acoustic Live at Hiro Ballroom],The Illusion Of Progress,Staind,289.4ø
Break Away (Album Version),The Illusion Of Progress,Staind,250.3ø
Believe [Radio Edit],Believe,Staind,243.4ø
All I Want (Explicit Album Version),The Illusion Of Progress,Staind,210.0ø
You Complete Me,R&B Collection Summer 2009,Keyshia Cole,222.6ø
The Greatest,Juicy Hip Hop,Nas,249.6ø
Queens Get The Money,Untitled,Nas,132.3ø
Like Me,Untitled,Nas,227.5ø
America,Untitled,Nas,231.8ø