Mass Ignorance Culture,Archive From 1959 - The Billy Childish Story,Jack Ketch And The Crowmen,204.8ø
Prince Ali,Magical Movie Music,London Pops Orchestra,256.3ø
Part of Your World,Magical Movie Music,London Pops Orchestra,243.4ø
I've Got No Strings,Plays Disney,The London Pops Orchestra,222.8ø
Circle of Life,The Best Of Movie Music_ Vol. 1,World Famous Orchestra,284.5ø
Be Our Guest,Magical Movie Music,London Pops Orchestra,247.1ø
Arabian Knights,Magical Movie Music,London Pops Orchestra,200.9ø
A Whole New World,The Best Of Movie Music_ Vol. 2,World Famous Orchestra,239.7ø
Quem Sou Eu,Gilles Peterson Brazilika (Full Track Version),Krishnanda,151.5ø
Esta Tudo Ai,Gilles Peterson Brazilika,Krishnanda,103.2ø
To All The Girls,Hello Kitty LP,Jennifer Marks,179.8ø
Brown Bag,Right On Brother,Boogaloo Joe Jones,305.3ø
Darlin' You Can Count On Me,Where The Action Is! Los Angeles Nuggets 1965-1968,The Everpresent Fullness,137.2ø
Knotty Pine,Dark Was The Night (Red Hot Compilation),Dirty Projectors + David Byrne,142.9ø
Service Bell,Dark Was The Night (Red Hot Compilation),Grizzly Bear + Feist,143.4ø