Welcome To Mystery,Almost Alice,Plain White T's,268.4ø
Pursuit Of Happiness (nightmare),Pursuit Of Happiness,Kid Cudi | MGMT | Ratatat,295.7ø
I Corinthians 15:55,American VI:  Ain't No Grave,Johnny Cash,217.7ø
Ink My Whole Body,Ink My Whole Body,Wiz Khalifa,155.4ø
I'm A Believer,Shrek Forever After,Weezer,178.8ø
I Swear It's True,Weezer,Weezer,177.1ø
Good Time Women,Exile On Main Street,The Rolling Stones,201.4ø
Following The River,Exile On Main Street,The Rolling Stones,291.7ø
Ordinary,All In Good Time,Barenaked Ladies,248.3ø
I Saw It,All In Good Time,Barenaked Ladies,230.8ø
When You Got A Good Thing,Need You Now,Lady Antebellum,297.5ø
Stars Tonight,Need You Now,Lady Antebellum,243.9ø
Ready To Love Again,Need You Now,Lady Antebellum,175.7ø
Perfect Day,Need You Now,Lady Antebellum,200.9ø
Our Kind Of Love,Need You Now,Lady Antebellum,248.5ø
Love This Pain,Need You Now,Lady Antebellum,183.2ø
If I Knew Then,Need You Now,Lady Antebellum,254.9ø
Hello World,Need You Now,Lady Antebellum,326.0ø
The Reward Is Cheese,William Orbit Odyssey,Deadmau5,370.3ø
Strobe (Radio Edit),Strobe,Deadmau5,214.0ø
Strobe (Plump DJs Remix),Strobe,Deadmau5,342.0ø
Strobe (Michael Woods Remix),Strobe,Deadmau5,406.4ø
Strobe (DJ Marky & S.P.Y. Remix),Strobe,Deadmau5,417.4ø
Strobe (Club Edit),Strobe,Deadmau5,380.9ø
I Said,I Said,Deadmau5 & Chris Lake,449.8ø
I Remember (Caspa Remix),I Remember,Deadmau5 & Kaskade,335.2ø
Chosen Generation,Passion: Awakening (Special Edition),Chris Tomlin,347.2ø