Undead (Album Version),Archangels In Black,Adagio,278.9,0.663,0.474,2009ø
The Fifth Ankh (Album Version),Archangels In Black,Adagio,281.0,0.663,0.474,2009ø
The Astral Pathway (Album Version),Archangels In Black,Adagio,301.9,0.663,0.474,2009ø
Getsu Senshi (Album Version),Archangels In Black,Adagio,220.1,0.663,0.474,2009ø
Fear Circus (Album Version),Archangels In Black,Adagio,237.2,0.663,0.474,2009ø
Codex Oscura (Album Version),Archangels In Black,Adagio,545.8,0.663,0.474,2009ø
Archangels In Black (Album Version),Archangels In Black,Adagio,335.3,0.663,0.474,2009ø