Serenata Suburbana,Grandes Interpretacoes De Agostinho Dos Santos,Agostinho Dos Santos,177.3,0.431,0.302,1992ø
Nossos Momentos,Grandes Interpretacoes De Agostinho Dos Santos,Agostinho Dos Santos,133.0,0.431,0.302,1992ø
Maria Dos Meus Pecados,Bossa Nova Story Vol. 2,Agostinho Dos Santos,203.6,0.431,0.302,1992ø
Eu Sei Que Vou Te Amar,Grandes Interpretacoes De Agostinho Dos Santos,Agostinho Dos Santos,187.0,0.431,0.302,1992ø
Chora Tua Tristeza,Grandes Interpretacoes De Agostinho Dos Santos,Agostinho Dos Santos,183.8,0.431,0.302,1992ø
A Noite Do Meu Bem,Grandes Interpretacoes De Agostinho Dos Santos,Agostinho Dos Santos,157.5,0.431,0.302,1992ø
A Felicidade,Black Orpheus (Simple),Agostinho Dos Santos,164.7,0.431,0.302,1992ø