Stella,The Ultimate Most Relaxing New Age Music In the Universe,Andreas Vollenweider,204.6,0.631,0.454,1999ø
See_ my Love...,Dancing With The Lion,Andreas Vollenweider,181.6,0.631,0.454,1989ø
Pearls & Tears,The Magical Journeys of Andreas Vollenweider,Andreas Vollenweider,198.5,0.631,0.454,1989ø
Pace Verde,White Winds,Andreas Vollenweider,318.0,0.631,0.454,1990ø
Hey You! Yes_ You...,Book of Roses,Andreas Vollenweider,192.5,0.631,0.454,1991ø
Hey You_ Yes... You! (at the gate of sound),VOX,Andreas Vollenweider,296.0,0.631,0.454,2004ø
Flight feet & Root Hands,White Winds,Andreas Vollenweider,347.1,0.631,0.454,1984ø
First Piece - Live 1989,Dancing With The Lion,Andreas Vollenweider,249.6,0.631,0.454,1989ø
Down to the Moon,The Magical Journeys of Andreas Vollenweider,Andreas Vollenweider,161.3,0.631,0.454,1986ø