Transparent (Album Version),Love Like This,Ayiesha Woods,346.5,0.629,0.44,2008ø
Take Me There (Album Version),Love Like This,Ayiesha Woods,264.6,0.128,0.44,2008ø
Refine Me (Album Version),Love Like This,Ayiesha Woods,256.3,0.629,0.44,2008ø
New Beginnings (Album Version),Love Like This,Ayiesha Woods,224.7,0.629,0.44,2008ø
Never (Album Version),Love Like This,Ayiesha Woods,237.9,0.629,0.44,2008ø
Love Like This (Album Version),Love Like This,Ayiesha Woods,230.3,0.629,0.44,2008ø
Love Can't Wait (Album Version),Love Like This,Ayiesha Woods,229.4,0.629,0.44,2008ø
Fight (Album Version),Love Like This,Ayiesha Woods,233.8,0.629,0.44,2008ø
Because Of You (Album Version),Love Like This,Ayiesha Woods,226.2,0.629,0.44,2008ø
Alive (Album Version),Love Like This,Ayiesha Woods,248.1,0.629,0.44,2008ø