Vix 9 (LP Version),Greatest Hits Of The 20th Century,Bela Fleck And The Flecktones,269.3,0.567,0.463,1999ø
The West County (LP Version),UFO Tofu,Bela Fleck And The Flecktones,270.2,0.732,0.463,1992ø
The Big Blink (LP Version),Left Of Cool,Bela Fleck And The Flecktones,477.4,0.732,0.463,1998ø
Sex In A Pan (LP Version),UFO Tofu,Bela Fleck And The Flecktones,214.4,0.732,0.463,1992ø
Let Me Be The One (LP Version),Left Of Cool,Bela Fleck And The Flecktones,278.0,0.732,0.463,1998ø
Hole In The Wall (LP Version),Flight Of The Cosmic Hippo,Bela Fleck And The Flecktones,279.1,0.732,0.463,1991ø
Flight Of The Cosmic Hippo (LP Version),Flight Of The Cosmic Hippo,Bela Fleck And The Flecktones,268.0,0.567,0.463,1991ø
Almost 12 (LP Version),Left Of Cool,Bela Fleck And The Flecktones,195.2,0.732,0.463,1998ø