Whistle Me Higher,Whistle Me Higher,Bingo Palace,291.8,0.389,0.275,2005ø
Pony Star (I'm Gonna Find You),Whistle Me Higher,Bingo Palace,453.4,0.389,0.275,2005ø
Panaming Mountain Queens,Whistle Me Higher,Bingo Palace,293.2,0.389,0.275,2005ø
Midnight Waltz for My Old Lady,Whistle Me Higher,Bingo Palace,181.4,0.389,0.275,2005ø
Live at the Bingo Palace,Whistle Me Higher,Bingo Palace,309.6,0.389,0.275,2005ø
I Want Some More,Whistle Me Higher,Bingo Palace,501.2,0.389,0.275,2005ø
I Think I Have Double Bingo,Whistle Me Higher,Bingo Palace,265.2,0.389,0.275,2005ø
Devil's Golf Course,Whistle Me Higher,Bingo Palace,389.3,0.389,0.275,2005ø
Baby Baby Oh Yeah,Whistle Me Higher,Bingo Palace,247.2,0.389,0.275,2005ø