The Mating Game (Yes King Remix),The Remix Game,Bitter:Sweet,322.4,0.703,0.427,2007ø
The Mating Game (Original),The Mating Game Remixes,Bitter:Sweet,206.3,0.703,0.427,2006ø
The Mating Game (Kraak & Smaak Remix),The Mating Game (Single),Bitter:Sweet,467.5,0.703,0.427,2006ø
The Mating Game (Dublex Remix),The Mating Game Remixes,Bitter:Sweet,355.2,0.703,0.427,2006ø
The Mating Game (Blackjoy Remix),The Mating Game (Single),Bitter:Sweet,376.1,0.703,0.427,2006ø
Take 2 Blue (Roy Dubb Remix),The Remix Game,Bitter:Sweet,221.3,0.703,0.427,2007ø
Take 2 Blue,The Mating Game,Bitter:Sweet,160.8,0.703,0.427,2006ø
Salty Air (Fort Knox Five Remix),The Remix Game,Bitter:Sweet,257.4,0.703,0.427,2007ø
Salty Air,The Mating Game,Bitter:Sweet,182.3,0.703,0.427,2006ø
Overdue (Blackbeard Remix),The Remix Game,Bitter:Sweet,309.1,0.703,0.427,2007ø
Our Remains (JAB Remix Feat. Menez One),The Remix Game,Bitter:Sweet,247.3,0.703,0.427,2007ø
Our Remains,The Mating Game,Bitter:Sweet,214.5,0.703,0.427,2006ø
Moving Forward (Atjazz Remix),Moving Forward - Remixes,Bitter:Sweet,391.0,0.703,0.427,2007ø
Moody (Marsmobil Remix),The Remix Game,Bitter:Sweet,331.2,0.703,0.427,2007ø
Moody,The Mating Game,Bitter:Sweet,159.2,0.703,0.427,2006ø
Heaven (Nicola Conte's West Coast Vibes Version),Heaven (Digital Single),Bitter:Sweet,371.6,0.703,0.427,2007ø
Heaven (Nicola Conte 'West Coast Vibes Remix'),The Remix Game,Bitter:Sweet,367.1,0.703,0.427,2007ø
Heaven (Buscemi's Afroclub Remix),Heaven (Digital Single),Bitter:Sweet,321.7,0.703,0.427,2006ø
Heaven (Buscemi's Afrobossa Remix),Heaven (Digital Single),Bitter:Sweet,298.3,0.703,0.427,2006ø
Drink You Sober,Drama,Bitter:Sweet,261.4,0.703,0.427,2008ø
Don't Forget to Breathe (Solid Doctor 'Don't Forget the Beat Remix'),The Remix Game,Bitter:Sweet,326.1,0.703,0.427,2007ø
Don't Forget To Breathe,The Mating Game,Bitter:Sweet,194.2,0.703,0.427,2006ø
Dirty Laundry (Tom Middleton Vox Remix),Dirty Laundry (Single),Bitter:Sweet,348.9,0.703,0.427,2006ø
Dirty Laundry (Tom Middleton Dub Remix),Dirty Laundry (Single),Bitter:Sweet,441.8,0.703,0.427,2006ø
Dirty Laundry (Tom Middleton Amba Remix),Quango 2007 Winter Chill,Bitter:Sweet,297.1,0.703,0.427,2006ø
Dirty Laundry (Skeewiff Remix),Dirty Laundry (Single),Bitter:Sweet,297.1,0.703,0.427,2006ø
Dirty Laundry (Morgan Page Remix),Dirty Laundry (Single),Bitter:Sweet,470.8,0.703,0.427,2006ø
Come Along With Me,Drama,Bitter:Sweet,141.2,0.703,0.427,2008ø
Bittersweet Faith (Thievery Corporation Remix),The Remix Game,Bitter:Sweet,238.2,0.703,0.427,2007ø