Watching You Die (live) (Album Version),Last Rites,Buried Alive,123.8,0.467,0.35,2001ø
Our Time Is At Hand (live) (Album Version),Last Rites,Buried Alive,159.3,0.467,0.35,2001ø
Numb (Album Version),Last Rites,Buried Alive,140.4,0.467,0.35,2001ø
My Sacrifice (live) (Album Version),Last Rites,Buried Alive,132.4,0.467,0.35,2001ø
My Sacrifice (Album Version),Last Rites,Buried Alive,128.4,0.467,0.35,2001ø
Kill Their Past (live) (Album Version),Last Rites,Buried Alive,113.4,0.467,0.35,2001ø
Hang Yourself In Shame (Album Version),Last Rites,Buried Alive,173.8,0.467,0.35,2001ø
Engraved (live) (Album Version),Last Rites,Buried Alive,160.2,0.467,0.35,2001ø
Engraved (Album Version),Last Rites,Buried Alive,178.4,0.467,0.35,2001ø
Do You Remember (Album Version),Last Rites,Buried Alive,131.7,0.467,0.35,2001ø
Cleanse Yourself (Album Version),Last Rites,Buried Alive,138.7,0.467,0.35,2001ø
Cant Take This From Me (Album Version),Last Rites,Buried Alive,121.2,0.467,0.35,2001ø
Burning Holes Through Myself (Album Version),Last Rites,Buried Alive,143.8,0.467,0.35,2001ø
A Cowards Eyes (Album Version),Last Rites,Buried Alive,134.9,0.467,0.35,2001ø