You're Still My Baby,Don't Deceive Me,Chuck Willis,190.9,0.48,0.35,2006ø
What Am I Living For?,Rock 'n' Roll And Pop Hits_ The 50s_ Vol. 29,Chuck Willis,146.9,0.48,0.35,1989ø
What Am I Living for,Roots of Rock and Soul 7,Chuck Willis,146.3,0.48,0.35,1994ø
My Story,Golden Decade - Music Of My Life (Vol.  09),Chuck Willis,190.3,0.48,0.35,2009ø
Let's Jump Tonight,The Complete Okeh Recordings 1951-1956,Chuck Willis,137.6,0.48,0.35,1993ø
It's Too Late,The Atlantic Records Story Vol 3,Chuck Willis,152.7,0.48,0.35,1989ø
I Feel So Bad,Don't Deceive Me,Chuck Willis,174.6,0.48,0.35,1998ø
C.C. Rider,The Very Best Of Oldies - Volume 7 - Tribute To Rock'n'Roll,Chuck Willis,156.5,0.48,0.35,1979ø
C C Rider,Roots of Rock and Soul 1,Chuck Willis,155.0,0.48,0.35,1998ø