Waiting Hopefully (Faze Action Dub),Waiting Hopefully EP,D*Note,317.2,0.551,0.434,1996ø
Waiting Hopefully,D*Note,D*Note,393.3,0.551,0.434,1997ø
V,Criminal Justice,D*Note,200.1,0.551,0.434,1995ø
Tri-cyclic,D*Note,D*Note,189.6,0.551,0.434,1997ø
The More I See (Main Feature),The More I See,D*Note,334.1,0.551,0.434,1993ø
The More I See (B-Movie),The More I See,D*Note,322.3,0.551,0.434,1993ø
The More I See,The More I See,D*Note,244.1,0.551,0.434,1993ø
The Garden Of Earthly Delights (Kumo Instrumental),The Garden of Earthly Delights,D*Note,236.0,0.551,0.434,1995ø
The Garden Of Earthly Delights (Kumo Dub),The Garden of Earthly Delights,D*Note,410.0,0.551,0.434,1995ø
The Garden Of Earthly Delights,Criminal Justice,D*Note,551.1,0.551,0.434,1995ø
Soloman's Blade,Criminal Justice,D*Note,413.6,0.551,0.434,1995ø
Scheme Of Things,A Compilation,D*Note,408.1,0.551,0.434,1992ø
Say What You Mean,D*Note,D*Note,386.0,0.551,0.434,1997ø
Rain,A Compilation,D*Note,370.1,0.551,0.434,1992ø
Place In The City,Criminal Justice,D*Note,433.0,0.551,0.434,1995ø
Perspex,Criminal Justice,D*Note,32.5,0.551,0.434,1995ø
Now Is The Time (Village Vanguard Mix),Now Is The Time,D*Note,357.3,0.551,0.434,1993ø
Now Is The Time (Village Gate DJ Smash Remix),Now Is The Time,D*Note,310.6,0.551,0.434,1993ø
Now Is The Time (5 Spot Radio Edit),Now Is The Time,D*Note,243.8,0.551,0.434,1993ø
Moody,D*Note,D*Note,260.5,0.551,0.434,1997ø
Lost And Found,Coming Down: The Soundtrack,D*Note,384.3,0.551,0.434,1997ø
Kite Hill,Coming Down: The Soundtrack,D*Note,431.0,0.551,0.434,1997ø
Iniquity Worker (Roni Size Remix),Iniquity Worker,D*Note,311.7,0.551,0.434,1997ø
Iniquity Worker (Number Of The Beast Mix),Iniquity Worker,D*Note,340.5,0.551,0.434,1995ø
Iniquity Worker (Cloven Hoof Mix),Iniquity Worker,D*Note,329.7,0.551,0.434,1995ø
Iniquity Worker,Criminal Justice,D*Note,342.9,0.551,0.434,1995ø
Garden Of Earthly Delights(X-Press 2 Inner London Ambience),The Garden of Earthly Delights,D*Note,241.9,0.551,0.434,1995ø
Garden Of Earthly Delights (X-Press 2 Remix),The Garden of Earthly Delights,D*Note,227.8,0.551,0.434,1995ø
Garden Of Earthly Delights (X-Press 2 Dope Drums),The Garden of Earthly Delights,D*Note,272.2,0.551,0.434,1995ø
Deep Water,Coming Down: The Soundtrack,D*Note,204.6,0.551,0.434,1995ø
Criminal Justice (The Presumed Guilty Radio Edit),Criminal Justice,D*Note,224.6,0.551,0.434,1995ø
Criminal Justice,Criminal Justice,D*Note,330.7,0.551,0.434,1995ø
Coming Up,D*Note,D*Note,317.8,0.551,0.434,1997ø
Changeless,D*Note,D*Note,337.9,0.551,0.434,1997ø
'Avin' It,Coming Down: The Soundtrack,D*Note,79.6,0.551,0.434,1997ø