Why Am I Lovin' You,The Complete Introduction To Northern Soul,Debbie Dean,164.3,0.394,0.348,1968ø
Something About You,A Cellarful Of Motown Volume 3,Debbie Dean,164.2,0.394,0.348,2007ø
Itsy Bity Pity Love,The Complete Motown Singles_ Volume 1: 1959-1961,Debbie Dean,167.3,0.394,0.348,2005ø
I Cried All Night,The Complete Motown Singles_ Volume 2: 1962,Debbie Dean,149.9,0.394,0.348,2005ø
Everybody's Talking About My Baby,The Complete Motown Singles_ Volume 2: 1962,Debbie Dean,142.3,0.394,0.348,2005ø
Don't Let Him Shop Around,The Complete Motown Singles_ Volume 1: 1959-1961,Debbie Dean,164.6,0.394,0.348,2005ø
But I'm Afraid,The Complete Motown Singles_ Volume 1: 1959-1961,Debbie Dean,171.3,0.394,0.348,2005ø
Baby Baby I'm In Love Again,Cellar Full Of Motown Volume 2,Debbie Dean,146.3,0.394,0.348,2005ø
A New Girl,The Complete Motown Singles_ Volume 1: 1959-1961,Debbie Dean,145.6,0.394,0.348,2005ø