Wrong (Thin White Duke Dub),Wrong,Depeche Mode,364.1,0.814,0.606,2009ø
Wrong (D.I.M. Vs Boys Noize Remix),Wrong,Depeche Mode,309.7,0.814,0.606,2009ø
World In My Eyes (Mode To Joy),DMBX5 (Part 1),Depeche Mode,390.6,0.814,0.606,1990ø
World In My Eyes (Mayhem Mode),DMBX5 (Part 1),Depeche Mode,297.0,0.814,0.606,1990ø
World In My Eyes (Dub In My Eyes),DMBX5 (Part 1),Depeche Mode,417.0,0.814,0.606,1990ø
Work Hard (East End Remix),DMBX2 (Part 1),Depeche Mode,419.8,0.814,0.606,1988ø
Work Hard,Mute Audio Documents: Volume 3: 1983,Depeche Mode,264.0,0.814,0.606,1983ø
Waiting For The Night,Violator,Depeche Mode,366.7,0.814,0.606,1990ø
Two Minute Warning,Construction Time Again,Depeche Mode,253.5,0.814,0.606,1983ø
Told You So,Construction Time Again,Depeche Mode,266.5,0.814,0.606,1983ø
The Meaning Of Love (Single Version),The Singles 81-85,Depeche Mode,184.9,0.814,0.606,1985ø
The Meaning Of Love (Fairly Odd Mix),DMBX1,Depeche Mode,301.6,0.814,0.606,1991ø
The Great Outdoors!,DMBX2 (Part 1),Depeche Mode,303.0,0.814,0.606,1983ø
The Dead Of Night,Exciter,Depeche Mode,290.1,0.814,0.606,2001ø
The Bottom Line,Ultra,Depeche Mode,265.2,0.814,0.606,1997ø
Suffer Well (Single Version),Suffer Well,Depeche Mode,171.0,0.814,0.606,2006ø
Suffer Well (Narcotic Thrust Vocal Dub),Suffer Well,Depeche Mode,404.6,0.814,0.606,2006ø
Suffer Well (M83 Remix),Suffer Well,Depeche Mode,273.2,0.814,0.606,2006ø
Suffer Well (Live In Milan),Touring The Angel: Live In Milan,Depeche Mode,221.2,0.814,0.606,2006ø
Stjarna (2006 Digital Remaster),Music For The Masses,Depeche Mode,262.1,0.814,0.606,1987ø
Sonata No.14 In C#m (Moonlight Sonata) (2006 Digital Remaster),Music For The Masses,Depeche Mode,337.9,0.814,0.606,1987ø
Sometimes,Black Celebration,Depeche Mode,114.0,0.814,0.606,1986ø
Somebody (Remix),Mute Audio Documents: Volume 4: 1984,Depeche Mode,259.1,0.814,0.606,1984ø
Sister Of Night,Ultra,Depeche Mode,363.4,0.814,0.606,1997ø
Shame,Construction Time Again,Depeche Mode,231.7,0.814,0.606,1983ø
See You (Live In Hammersmith) (2006 Digital Remaster),A Broken Frame,Depeche Mode,250.5,0.814,0.606,1982ø
Sea Of Sin (Tonal Mix),DMBX5 (Part 1),Depeche Mode,286.2,0.839,0.606,1990ø
Satellite (Live In Hammersmith) (2006 Digital Remaster),A Broken Frame,Depeche Mode,264.1,0.814,0.606,1982ø
Precious (Motor Remix),Precious,Depeche Mode,397.4,0.814,0.606,2005ø
Precious (Misc Full Vocal Mix),Precious,Depeche Mode,344.4,0.814,0.606,2005ø
Precious (Live In Milan),Touring The Angel: Live In Milan,Depeche Mode,278.3,0.814,0.606,2006ø
Precious,Precious,Depeche Mode,250.0,0.814,0.606,2005ø
"Policy Of Truth (7"" Version)",DMBX5 (Part 1),Depeche Mode,311.4,0.814,0.606,1990ø
Pimpf (Contains Hidden Track Mission Impossible),Music For The Masses,Depeche Mode,324.2,0.814,0.606,1987ø
Photographic (Some Bizzare Version),The Singles 81-85,Depeche Mode,193.0,0.814,0.606,1998ø
Photographic (Rex The Dog Faithful Mix),PHOTOGRAPHIC - REX THE DOG FAITHFUL MIX,Depeche Mode,281.9,0.814,0.606,2004ø
Personal Jesus,Violator,Depeche Mode,295.2,0.814,0.606,1985ø
Perfect (Roger Sanchez Club Mix),Fragile Tension / Hole To Feed,Depeche Mode,446.5,0.814,0.606,2009ø
Peace (The Exploding Plastic Inevitable JK Disco Dub),Peace,Depeche Mode,451.5,0.814,0.606,2009ø
Peace (Sid LeRock Remix),Peace,Depeche Mode,396.8,0.814,0.606,2009ø
Peace (Ben Klock Remix),Peace,Depeche Mode,467.6,0.814,0.606,2009ø
Oberkorn (It's A Small Town) (Development Mix),DMBX1,Depeche Mode,460.4,0.814,0.606,1991ø
Now This Is Fun (Extended Version),DMBX1,Depeche Mode,282.5,0.814,0.606,1988ø
Nothing (2006 Digital Remaster),Music For The Masses,Depeche Mode,253.8,0.814,0.606,1987ø
Newborn,A Pain That I'm Used To,Depeche Mode,333.7,0.814,0.606,2005ø
More Than A Party (Live),DMBX3 (Part 2),Depeche Mode,305.9,0.814,0.606,1991ø
Master And Servant,Mute: Audio Documents,Depeche Mode,227.1,0.814,0.606,1984ø
Martyr (Radio Version),Martyr,Depeche Mode,187.5,0.814,0.606,2006ø
Martyr (Alex Smoke Bare Bones Edit),Martyr,Depeche Mode,189.0,0.814,0.606,2006ø
Lovetheme,Exciter,Depeche Mode,121.8,0.814,0.606,2001ø
Love In Itself.4,DMBX2 (Part 1),Depeche Mode,279.5,0.814,0.606,1991ø
Love In Itself,Construction Time Again,Depeche Mode,269.6,0.814,0.606,1983ø
Kaleid (When Worlds Mix),DMBX5 (Part 1),Depeche Mode,323.3,0.814,0.606,1990ø
Just Can't Get Enough (Single Version),The Singles 81-85,Depeche Mode,222.5,0.814,0.606,1985ø
Just Can't Get Enough (Schizo Mix),The Singles 81-85,Depeche Mode,404.8,0.814,0.606,1981ø
Junior Painkiller,Ultra,Depeche Mode,129.6,0.814,0.606,1997ø
John The Revelator (Single Version),John The Revelator,Depeche Mode,198.2,0.814,0.606,2006ø
John The Revelator (Live In Milan),Touring The Angel: Live In Milan,Depeche Mode,214.2,0.814,0.606,2006ø
John The Revelator (James T. Cotton Dub),John The Revelator,Depeche Mode,364.5,0.814,0.606,2006ø
John The Revelator (Bill Hamel's Audio Magnetics Edit),John The Revelator (Bill Hamel's Audio Magnetics Edit),Depeche Mode,282.0,0.814,0.606,2006ø
Jazz Thieves,Ultra,Depeche Mode,174.4,0.814,0.606,1997ø
It Doesn't Matter Two,Black Celebration,Depeche Mode,170.8,0.814,0.606,1986ø
I Want It All (Live In Milan),Touring The Angel: Live In Milan,Depeche Mode,288.7,0.814,0.606,2006ø
I Want It All,Playing The Angel,Depeche Mode,369.6,0.814,0.606,2005ø
I Feel You (Babylon Mix),DMBX5 (Part 1),Depeche Mode,475.0,0.814,0.606,1993ø
Hole To Feed (Paul Woolford's Easyfun Ethereal Disco Mix),Fragile Tension / Hole To Feed,Depeche Mode,429.8,0.814,0.606,2009ø
Happiest Girl (The Pulsating Orbital Mix),DMBX5 (Part 1),Depeche Mode,388.9,0.814,0.606,1990ø
Happiest Girl (Jack Mix),DMBX5 (Part 1),Depeche Mode,298.4,0.814,0.606,1990ø
Halo,Violator,Depeche Mode,269.6,0.814,0.606,1990ø
Freestate,Ultra,Depeche Mode,403.3,0.814,0.606,1997ø
Fragile Tension (Solo Loves Panorama Remix),Fragile Tension / Hole To Feed,Depeche Mode,371.3,0.814,0.606,2009ø
Enjoy The Silence) (Ewan Pearson Remix Radio Edit),Enjoy The Silence,Depeche Mode,216.0,0.814,0.606,1990ø
Enjoy The Silence (Timo Maas Extended Remix),Enjoy The Silence,Depeche Mode,524.0,0.814,0.606,2004ø
Enjoy The Silence (Richard X Mix),Enjoy The Silence - Richard X Mix,Depeche Mode,212.0,0.814,0.606,2004ø
Enjoy The Silence (Contains Hidden Track 'Crucifx'),Violator,Depeche Mode,372.5,0.814,0.606,1990ø
Enjoy the Silence,Club Collection 6 Part 2,Depeche Mode,294.6,0.814,0.606,1985ø
Come Back,Sounds Of The Universe,Depeche Mode,314.7,0.814,0.606,2009ø
Black Celebration (Black Tulip Mix),DMBX3 (Part 2),Depeche Mode,392.6,0.814,0.606,1986ø
Better Days (Basteroid 'Dance Is Gone' Vocal Mix),Suffer Well,Depeche Mode,431.3,0.814,0.606,2006ø
Behind The Wheel (2006 Digital Remaster),Music For The Masses,Depeche Mode,318.9,0.814,0.606,1987ø
Agent Orange (2006 Digital Remaster),Music For The Masses,Depeche Mode,309.0,0.814,0.606,1987ø
A Question Of Time (Extended Remix),DMBX3 (Part 2),Depeche Mode,399.6,0.814,0.606,1986ø
A Photograph of You (Live In Hammersmith) (2006 Digital Remaster),A Broken Frame,Depeche Mode,209.7,0.814,0.606,1982ø
A Pain That I'm Used To (Live In Milan),Touring The Angel: Live In Milan,Depeche Mode,261.1,0.814,0.606,2006ø
A Pain That I'm Used To (Jacques Lu Cont Remix),A Pain That I'm Used To,Depeche Mode,473.5,0.814,0.606,2005ø
A Pain That I'm Used To (Bitstream Spansule Mix),A Pain That I'm Used To,Depeche Mode,445.9,0.814,0.606,2005ø