Volle Kraft voraus (Spetsnaz remix),Volle Kraft null acht,Die Krupps,242.5,0.628,0.41,2009ø
Volle Kraft 08 (Heckmann remix),Volle Kraft null acht,Die Krupps,331.8,0.628,0.41,2009ø
Neue Helden (Girls Under Glassremix),Volle Kraft null acht,Die Krupps,290.5,0.628,0.41,2009ø
Goldfinger (Remix),Volle Kraft voraus (Re-Release),Die Krupps,363.4,0.628,0.41,1984ø
Goldfinger (Leaetherstrip remix),Volle Kraft null acht,Die Krupps,345.7,0.628,0.41,2009ø
Battery,A Tribute To The Four Horsemen,Die Krupps,319.5,0.628,0.41,1992ø
2 Herzen_ 1 Rhythmus (Stormtrooper remix),Volle Kraft null acht,Die Krupps,244.3,0.628,0.41,2009ø