You're Gonna Miss Me,Live At The Rat,DMZ,184.8,0.47,0.327,1977ø
When I Get Off,Live At The Rat,DMZ,264.7,0.47,0.327,1977ø
Watch For Me Girl (Album Version),DMZ,DMZ,143.0,0.47,0.327,1978ø
Watch For Me Girl,Live At The Rat,DMZ,153.3,0.47,0.327,1978ø
Shirt Loop,Relics (180g Ltd Edition),DMZ,95.7,0.47,0.327,1993ø
Pretty Girl,Relics (180g Ltd Edition),DMZ,199.5,0.47,0.327,1993ø
Out Of Our Tree (Album Version),DMZ,DMZ,180.9,0.47,0.327,1978ø
Out Of Our Tree,Live At The Rat,DMZ,161.0,0.47,0.327,1978ø
Oedipus Show,Relics (180g Ltd Edition),DMZ,144.0,0.47,0.327,1993ø
Mighty Idy (Album Version),DMZ,DMZ,148.0,0.47,0.327,1978ø
Mighty Idy,Live At The Rat,DMZ,180.1,0.47,0.327,1978ø
Might He I.D.,Relics (180g Ltd Edition),DMZ,152.8,0.47,0.327,1993ø
Lift Up Your Hood,Live At The Rat,DMZ,97.9,0.47,0.327,1977ø
Guilty Child,Relics (180g Ltd Edition),DMZ,172.0,0.47,0.327,1993ø
From Home (Album Version),DMZ,DMZ,95.1,0.47,0.327,1978ø
First Time,Relics (180g Ltd Edition),DMZ,97.4,0.47,0.327,1993ø
Don't Jump Me Mother (Album Version),DMZ,DMZ,202.8,0.47,0.327,1978ø
Don't Jump Me Mother,Live At The Rat,DMZ,210.2,0.47,0.327,2000ø
Do Not Enter (Album Version),DMZ,DMZ,135.0,0.47,0.327,1978ø
Do Not Enter,Relics (180g Ltd Edition),DMZ,141.0,0.619,0.327,1978ø
Destroyer (Album Version),DMZ,DMZ,136.9,0.47,0.327,1978ø
Cinderella (Album Version),DMZ,DMZ,163.1,0.47,0.327,1978ø
Cinderella,Live At The Rat,DMZ,168.5,0.47,0.327,1978ø
Can't Stand The Pain,Relics (180g Ltd Edition),DMZ,161.1,0.47,0.327,1993ø
Busy Man,Relics (180g Ltd Edition),DMZ,199.7,0.47,0.327,1977ø
Boy From Nowhere,Live At The Rat,DMZ,106.1,0.47,0.327,1976ø
Border Line (Album Version),DMZ,DMZ,157.6,0.47,0.327,1978ø
Bloody Englishmen,Relics (180g Ltd Edition),DMZ,175.6,0.47,0.327,1993ø
Ball Me Out,Live At The Rat,DMZ,141.4,0.47,0.327,1976ø
Bad Attitude (Album Version),DMZ,DMZ,180.2,0.47,0.327,1978ø
Baby Boom (Album Version),DMZ,DMZ,139.7,0.47,0.327,1978ø