We Techno Prisoners,Drive-By Argument,Drive-By Argument,189.2,0.479,0.357,2008ø
There's Nothing As Epic As Golden Axe,Drive-By Argument,Drive-By Argument,228.0,0.479,0.357,2008ø
The Sega Method,Drive-By Argument,Drive-By Argument,237.2,0.479,0.357,2008ø
Sex Line's Are Expensive Comedy,Drive-By Argument,Drive-By Argument,185.1,0.479,0.357,2008ø
Lower Your Pieces,Drive-By Argument,Drive-By Argument,269.5,0.479,0.357,2008ø
How The Tree's Sleep,Drive-By Argument,Drive-By Argument,340.5,0.479,0.357,2008ø
Eye Fish Star Fish Eye,Drive-By Argument,Drive-By Argument,256.0,0.479,0.357,2008ø
Disco Storm,Drive-By Argument,Drive-By Argument,196.0,0.479,0.357,2008ø
Dance Like No One's Watching (Re-Mixed By Alan Moulder),Drive-By Argument,Drive-By Argument,201.2,0.479,0.357,2008ø
Cyclists Run Red Lights,Drive-By Argument,Drive-By Argument,261.1,0.479,0.357,2008ø