Well_ I Never...  (Album Version),In Vogue,Drop Dead_ Gorgeous,122.1,0.77,0.518,2006ø
Marietta (Album Version),In Vogue,Drop Dead_ Gorgeous,171.6,0.77,0.518,2006ø
Knife Vs. Face: Round One (Album Version),In Vogue,Drop Dead_ Gorgeous,242.4,0.77,0.518,2006ø
In Vogue (Album Version),In Vogue,Drop Dead_ Gorgeous,165.1,0.77,0.518,2006ø
Girl_ Are You On Your... (Album Version),In Vogue,Drop Dead_ Gorgeous,184.8,0.77,0.518,2006ø
E.r. (Album Version),In Vogue,Drop Dead_ Gorgeous,146.1,0.77,0.518,2006ø
Dressed For Friend Requests (Album Version),In Vogue,Drop Dead_ Gorgeous,156.7,0.77,0.518,2006ø
Daniel_ Where's The Boat? (Album Version),In Vogue,Drop Dead_ Gorgeous,147.4,0.77,0.518,2006ø
Are You Happy (Album Version),In Vogue,Drop Dead_ Gorgeous,96.1,0.77,0.518,2006ø