Unfold feat. Spoonface,Phoenix,Dublex Inc.,252.6,0.591,0.384,2009ø
Sorrover,Mole Listening Pearls - The Collection Vol. 2 (2001 - 2005),Dublex Inc.,270.5,0.591,0.384,2002ø
Rhodes Knight,Breaking The Ice (Edition One),Dublex Inc.,322.6,0.591,0.384,2000ø
Rainy Day feat. Mayka Edjole,Phoenix,Dublex Inc.,222.2,0.591,0.384,2009ø
My Thrill feat. Mayka Edjole,Phoenix,Dublex Inc.,303.6,0.591,0.384,2009ø
Izquitos,MEZZANINE de L'ALCAZAR volume 4,Dublex Inc.,318.0,0.591,0.384,2000ø
It Takes Time feat. Bridgette Amofah,Phoenix,Dublex Inc.,215.3,0.591,0.384,2009ø
Hell In A Handbag feat. Tuomo,Phoenix,Dublex Inc.,241.0,0.591,0.384,2009ø
Changes feat. Stee Downes,Phoenix,Dublex Inc.,239.9,0.591,0.384,2009ø
Black Pearl,Phoenix,Dublex Inc.,230.1,0.591,0.384,2009ø