Hot Mama (Sinden Remix),Hot Mama,Edu K,410.9,0.536,0.411,2006ø
Hot Mama (Original Mix),Hot Mama,Edu K,181.2,0.536,0.411,2006ø
Hot Mama (EDU K Jamekian Remix),Hot Mama,Edu K,259.3,0.536,0.411,2006ø
Hot Mama (Bonde Do Role Remix),Hot Mama,Edu K,154.3,0.536,0.411,2006ø
Gatas Gatas Gatas (Original Mix),Gatas Gatas Gatas,Edu K,183.6,0.536,0.411,2007ø
Gatas Gatas Gatas (Crookers Remix),Gatas Gatas Gatas,Edu K,307.8,0.536,0.411,2007ø
Gatas Gatas Gatas (Chernobyl Baile Funk Mix),Gatas Gatas Gatas,Edu K,129.4,0.536,0.411,2007ø
Gatas Gatas Gatas (Acappella),Gatas Gatas Gatas,Edu K,105.3,0.536,0.411,2007ø