Shake It In The Uh-Huh,Blood Cape,Elliott The Letter Ostrich,128.3,0.466,0.268,2005ø
Power Glove,Blood Cape,Elliott The Letter Ostrich,127.3,0.466,0.268,2005ø
Pink Dracula,Blood Cape,Elliott The Letter Ostrich,290.2,0.466,0.268,2005ø
Out Come The Vampires,Blood Cape,Elliott The Letter Ostrich,215.6,0.466,0.268,2005ø
My Baroness,Blood Cape,Elliott The Letter Ostrich,203.0,0.466,0.268,2005ø
Love Song For The Walking Dead,Blood Cape,Elliott The Letter Ostrich,212.5,0.466,0.268,2005ø
Knife Fight Baby (Get Stabbed Get Stabbed),Blood Cape,Elliott The Letter Ostrich,180.6,0.466,0.268,2005ø
Get Plenty Of Sleep_ You'll Need It To Keep Your Eyes Open,Blood Cape,Elliott The Letter Ostrich,210.3,0.466,0.268,2005ø
Eat Yourself So You Can Be Invisible (Ryan 88),Blood Cape,Elliott The Letter Ostrich,207.6,0.466,0.268,2005ø
Do The Reign In Blood,Blood Cape,Elliott The Letter Ostrich,112.3,0.466,0.268,2005ø
Ballad Of Voorhees,Blood Cape,Elliott The Letter Ostrich,217.4,0.466,0.268,2005ø