You Are The Only One,All The Right Wrongs,Emily Osment,175.3,0.734,0.549,2009ø
What About Me,All The Right Wrongs,Emily Osment,222.2,0.734,0.549,2009ø
Unaddicted,All The Right Wrongs,Emily Osment,216.9,0.734,0.549,2009ø
One Of Those Days,All The Right Wrongs,Emily Osment,208.1,0.734,0.549,2009ø
I Hate The Homecoming Queen,All The Right Wrongs,Emily Osment,165.6,0.734,0.549,2009ø
I Don't Think About It,I Don't Think About It,Emily Osment,177.6,0.734,0.549,2008ø
Found Out About You,All The Right Wrongs,Emily Osment,203.7,0.681,0.549,2009ø
All The Way Up,All The Right Wrongs,Emily Osment,190.2,0.734,0.549,2009ø