Turkish Bazar (Samuel L Sessions Remix),Turkish Bazar,Emmanuel Top,381.7,0.503,0.348,2002ø
Turkish Bazar (Reloop Remix),Turkish Bazar,Emmanuel Top,475.9,0.503,0.348,2002ø
Turkish Bazar (Radio Edit),Turkish Bazar,Emmanuel Top,249.3,0.503,0.348,2002ø
Turkish Bazar (Original Club Mix),Turkish Bazar,Emmanuel Top,394.0,0.503,0.348,2002ø
Acid Phase (Original Radio Mix),Acid Phase,Emmanuel Top,215.4,0.503,0.348,2002ø
Acid Phase (Kai Tracid Remix),Acid Phase,Emmanuel Top,397.4,0.503,0.348,2002ø
Acid Phase (Elektrochemie LK Remix),Acid Phase,Emmanuel Top,522.3,0.503,0.348,2002ø