Sound-Support Surface Noises Reaching Out To You,Ceux Qui Inventent N'Ont Jamis Vecu (?),Fly Pan Am,435.9,0.542,0.352,2001ø
Partially Sabotaged Distraction Partiellement Sabotee,Ceux Qui Inventent N'Ont Jamis Vecu (?),Fly Pan Am,255.1,0.542,0.352,2001ø
Nice Est En Feu!,Fly Pan Am,Fly Pan Am,575.8,0.542,0.352,1999ø
Et Aussi L'eclairage De Plastique Au Centre De Tout Ces Compartiments Lateraux,Fly Pan Am,Fly Pan Am,569.6,0.542,0.352,1999ø
Erreur; Errance; Interdits De Par Leurs Nouvelles Possibilites,Ceux Qui Inventent N'Ont Jamis Vecu (?),Fly Pan Am,273.9,0.542,0.352,2001ø
Buvez Nos Larmes De Metal,N'Ecoutez Pas,Fly Pan Am,97.6,0.542,0.352,2004ø
Bibi A Nice_ 1921,Fly Pan Am,Fly Pan Am,597.3,0.542,0.352,1999ø
Arcades-Pamelor,Ceux Qui Inventent N'Ont Jamis Vecu (?),Fly Pan Am,221.2,0.542,0.352,2001ø