You'll never be alone,Don't look back,Fury In The Slaughterhouse,287.8,0.6,0.427,2008ø
Where you fly,Every heart is a revolutionary cell,Fury In The Slaughterhouse,205.7,0.6,0.427,2006ø
Welcome To The Other World,Nimby/Special Edition,Fury In The Slaughterhouse,215.9,0.6,0.427,2004ø
Time to Wonder (Live & Akustisch 2006),Don't look back,Fury In The Slaughterhouse,445.6,0.6,0.427,2008ø
Three Little Piggies,Nimby/Special Edition,Fury In The Slaughterhouse,212.5,0.6,0.427,2004ø
Homesick,Every heart is a revolutionary cell,Fury In The Slaughterhouse,207.6,0.6,0.427,2006ø
Congratulations,Don't look back,Fury In The Slaughterhouse,204.0,0.6,0.427,2008ø