We're Gonna Hold On,Greatest Hits,George Jones;Tammy Wynette,176.2,0.73,0.399,1973ø
We Loved It Away,George Jones and Tammy Wynette - 16 Biggest Hits,George Jones;Tammy Wynette,143.2,0.428,0.399,2006ø
Two Story House,Super Hits,George Jones;Tammy Wynette,163.6,0.428,0.399,1995ø
Let's Build A World Together,George Jones and Tammy Wynette - 16 Biggest Hits,George Jones;Tammy Wynette,173.5,0.428,0.399,1973ø
If Loving You Starts Hurting Me,Love Songs,George Jones;Tammy Wynette,175.9,0.428,0.399,1973ø
(We're Not) The Jet Set,George Jones and Tammy Wynette - 16 Biggest Hits,George Jones;Tammy Wynette,145.4,0.428,0.399,1973ø