Un'Estate Al Mare,Le Piu' Belle Canzoni,Giuni Russo,194.1,0.49,0.329,1981ø
Niente Senza Di Te,La Sposa,Giuni Russo,238.2,0.49,0.329,1995ø
Lettera Al Governatore Della Libia,Le Piu' Belle Canzoni,Giuni Russo,189.6,0.49,0.329,1981ø
L'attesa,Le Piu' Belle Canzoni,Giuni Russo,170.1,0.49,0.329,1981ø
L'addio,Le Piu' Belle Canzoni,Giuni Russo,289.1,0.49,0.329,1981ø
Bing Bang Being,Un'estate al mare / Bing bang being [Digital 45],Giuni Russo,188.4,0.49,0.329,1981ø
Atmosfera,Le Piu' Belle Canzoni,Giuni Russo,233.4,0.49,0.329,1981ø