Wouldn't It Be Loverly,At Basin Street East - At the Las Vegas Thunderbird,Gloria Lynne,164.6,0.441,0.269,2000ø
Serenade in Blue,The Jazz in You,Gloria Lynne,163.1,0.441,0.269,1997ø
Out Of This World,Love Songs,Gloria Lynne,279.5,0.441,0.269,1997ø
Indian Love Call,Love Songs,Gloria Lynne,178.9,0.441,0.269,2000ø
I Should Care,The Jazz in You,Gloria Lynne,178.0,0.441,0.269,1997ø
I Know Love,Love Songs,Gloria Lynne,189.1,0.441,0.269,2000ø
I Can't Give You Anything But Love,I Wish You Love - Go! Go! Go!,Gloria Lynne,215.7,0.441,0.269,2000ø
Fly Me To The Moon,Love Songs,Gloria Lynne,225.6,0.441,0.269,1997ø