The World's Gone Mad featuring Del The Funky Homosapien_ Barrington Levy & Alex Kapranos (Instrumental),White People,Handsome Boy Modeling School,321.0,0.587,0.411,2004ø
The World's Gone Mad featuring Del The Funky Homosapien_ Barrington Levy & Alex Kapranos (Album Version),White People,Handsome Boy Modeling School,324.4,0.587,0.411,2004ø
The Runway Song Part 2 (Kid Koala & DJ Shadow ready for their close-ups) (Instrumental),White People,Handsome Boy Modeling School,237.7,0.587,0.411,2004ø
The Hours (Instrumental),White People,Handsome Boy Modeling School,276.1,0.587,0.411,2004ø
The Hours (Album Version),White People,Handsome Boy Modeling School,268.8,0.587,0.411,2004ø
Rock And Roll (Could Never Hip Hop Like This) Part 2 featuring Lord Finesse_ Mike Shonoda_ Chester Bennington_ Rahzel_ Qbert_ Grand Wizard Theodore & Jazzy Jay + Knockers featuring Tim Meadows (Explicit CD Version),White People,Handsome Boy Modeling School,436.1,0.587,0.411,2004ø
Rock And Roll (Could Never Hip Hop Like This) Part 2 featuring Lord Finesse_ Mike Shonoda_ Chester Bennington_ Rahzel_ Qbert_ Grand Wizard Theodore & Jazzy Jay (Instrumental),White People,Handsome Boy Modeling School,384.7,0.587,0.411,2004ø
Outro Featuring Father Guido Sarducci (Skit),White People,Handsome Boy Modeling School,327.1,0.587,0.411,2004ø
Midnight (Instrumental),White People,Handsome Boy Modeling School,239.8,0.587,0.411,2004ø
It's Like That featuring Casual + I Am Complete featuring Tim Meadows (Album Version),White People,Handsome Boy Modeling School,290.9,0.587,0.411,2004ø
It's Like That featuring Casual (Instrumental),White People,Handsome Boy Modeling School,262.4,0.587,0.411,2004ø
Intro featuring Father Guido Sarducci (Skit),White People,Handsome Boy Modeling School,68.7,0.587,0.411,2004ø
If It Wasn't For You featuring De La Soul and Starchild Excalibur (Instrumental Version),White People,Handsome Boy Modeling School,279.5,0.587,0.411,2004ø
If It Wasn't For You featuring De La Soul and Starchild Excalibur (Album Version),White People,Handsome Boy Modeling School,277.3,0.587,0.411,2004ø
I've Been Thinking featuring Cat Power (Album Version),White People,Handsome Boy Modeling School,324.1,0.587,0.411,2004ø
I've Been Thinking (Instrumental),White People,Handsome Boy Modeling School,322.5,0.587,0.411,2004ø
Greatest Mistake featuring John Oates & Jamie Cullum (Album Version),White People,Handsome Boy Modeling School,258.5,0.587,0.411,2004ø
First... And Then featuring Dres (Album Version),White People,Handsome Boy Modeling School,259.4,0.587,0.411,2004ø
First... And Then (Instrumental),White People,Handsome Boy Modeling School,261.0,0.587,0.411,2004ø
Dating Game Part 2 featuring Tim Meadows_ Hines Buchanan & Neelam (Skit),White People,Handsome Boy Modeling School,36.3,0.587,0.411,2004ø
Dating Game featuring Tim Meadows_ Hines Buchanan and introducing Neelam (Explicit Skit),White People,Handsome Boy Modeling School,188.4,0.587,0.411,2004ø
Class System (Instrumental),White People,Handsome Boy Modeling School,270.3,0.587,0.411,2004ø
Are You Down With It featuring Mike Patton (Explicit Version),White People,Handsome Boy Modeling School,214.2,0.587,0.411,2004ø
Are You Down With It (Instrumental),White People,Handsome Boy Modeling School,238.2,0.587,0.411,2004ø
A Day In The Life featuring RZA_ The Mars Volta & AG + Good Hygiene featuring Tim Meadows (Amended CD Version),White People,Handsome Boy Modeling School,336.8,0.587,0.411,2004ø