We Need Love (Album Version),Once Upon A Time In The West,Hard-FI,244.1,0.778,0.541,2007ø
Watch Me Fall Apart (Album Version),Once Upon A Time In The West,Hard-FI,173.2,0.778,0.541,2007ø
Unnecessary Trouble (Album Version),Stars Of CCTV,Hard-FI,224.5,0.778,0.541,2004ø
Tonight [Acoustic Version],Once Upon A Time In The West,Hard-FI,257.6,0.778,0.541,2007ø
Tonight (Album Version),Once Upon A Time In The West,Hard-FI,237.1,0.778,0.541,2007ø
Tied Up Too Tight (BBC Radio 1 Live Lounge),Hard To Beat,Hard-FI,206.3,0.778,0.541,2005ø
Tied Up Too Tight (Album Version),Stars Of CCTV,Hard-FI,288.9,0.778,0.541,2004ø
These Four Walls and I,Can't Get Along [Without You],Hard-FI,252.8,0.778,0.541,2007ø
The King (Album Version),Once Upon A Time In The West,Hard-FI,197.4,0.778,0.541,2007ø
Television (Album Version),Once Upon A Time In The West,Hard-FI,222.5,0.778,0.541,2007ø
Suburban Knights [DJ Wrongtom's Delight],Suburban Knights,Hard-FI,220.7,0.778,0.541,2007ø
Suburban Knights [Acoustic Version],Once Upon A Time In The West,Hard-FI,214.1,0.778,0.541,2007ø
Suburban Knights (Album Version),Once Upon A Time In The West,Hard-FI,272.3,0.778,0.541,2007ø
Stronger,Hard To Beat,Hard-FI,203.0,0.778,0.541,2004ø
Stars Of CCTV (Album Version),Stars Of CCTV,Hard-FI,238.7,0.778,0.541,2004ø
Seven Nation Army,Hard To Beat,Hard-FI,235.9,0.778,0.541,2005ø
Polish Love Song [Single Version],Better Do Better,Hard-FI,193.5,0.778,0.541,2006ø
Peaches (Radio 1 Live Version),Living For The Weekend,Hard-FI,223.8,0.778,0.541,2005ø
Move On Now (Album Version),Stars Of CCTV,Hard-FI,307.9,0.778,0.541,2004ø
Move On Dub,CCTVersions,Hard-FI,258.8,0.778,0.541,2006ø
Middle Eastern Holiday [Wrongtom meets The Rockers East Of Medina] Dub,CCTVersions,Hard-FI,292.2,0.778,0.541,2006ø
Middle Eastern Holiday (Chicken Lips Vocal Mix),CCTVersions,Hard-FI,398.9,0.778,0.541,2006ø
Middle Eastern Holiday (Album Version),Stars Of CCTV,Hard-FI,224.0,0.778,0.541,2004ø
Living For The Weekend [Wolsey White & Fred Dub],CCTVersions,Hard-FI,130.4,0.778,0.541,2006ø
Little Angel (Album Version),Once Upon A Time In The West,Hard-FI,174.1,0.778,0.541,2007ø
I Shall Overcome [Shoes Remix],I Shall Overcome,Hard-FI,239.5,0.778,0.541,2008ø
I Shall Overcome [Per un pungo di Hard-Fi Version],I Shall Overcome,Hard-FI,352.2,0.778,0.541,2008ø
I Shall Overcome (Album Version),Once Upon A Time In The West,Hard-FI,258.8,0.778,0.541,2007ø
Help Me Please (Album Version),Once Upon A Time In The West,Hard-FI,194.6,0.778,0.541,2007ø
Hard To Beatmix,Hard To Beat,Hard-FI,208.5,0.778,0.541,2005ø
Hard To Beat (Axwell Mix),Living For The Weekend,Hard-FI,449.9,0.778,0.541,2005ø
Hard To Beat (Ashley Beedle Mix),CCTVersions,Hard-FI,537.4,0.778,0.541,2006ø
Gotta Reason (Album Version),Stars Of CCTV,Hard-FI,169.0,0.291,0.541,2004ø
Feltham Is Singing Out (Album Version),Stars Of CCTV,Hard-FI,276.8,0.778,0.541,2004ø
Dub Of CCTV [Wolsey White Dub],CCTVersions,Hard-FI,209.5,0.778,0.541,2006ø
Cash Machine [Roots Manuva Dub Remix],CCTVersions,Hard-FI,151.6,0.778,0.541,2006ø
Cash Machine (Radio Edit),Cash Machine [Re-Release],Hard-FI,223.3,0.778,0.541,2005ø
Cash Machine,Cash Machine,Hard-FI,216.3,0.778,0.541,2004ø
Cash Converter [Dub Machine Part 2],CCTVersions,Hard-FI,223.2,0.778,0.541,2006ø
Can't Get Along [Without You] (Album Version),Once Upon A Time In The West,Hard-FI,180.5,0.778,0.541,2007ø
Better Dub Better [Wolsey White Dub],Better Do Better,Hard-FI,303.9,0.778,0.541,2006ø
Better Do Better [Wrongtom Wild Inna 81 Version],CCTVersions,Hard-FI,194.3,0.778,0.541,2006ø
Better Do Better [Live from NYC Bowery Ballroom Version],Better Do Better,Hard-FI,313.8,0.778,0.541,2006ø
Better Do Better [Album Version],Stars Of CCTV,Hard-FI,277.6,0.778,0.541,2004ø