Nature Boy,Blue Ballads,Ike Quebec,162.0,0.507,0.356,1995ø
Jim Dawgs,The Legends of Savoy_ Vol 6,Ike Quebec,169.7,0.507,0.356,1999ø
How Long Has This Been Going On,Rhapsody In Blue (Blue Note Plays Music of George and Ira Gershwin),Ike Quebec,360.5,0.507,0.356,1988ø
But Not For Me,Blue Gershwin,Ike Quebec,225.0,0.507,0.356,1988ø
Blue Samba (Rudy Van Gelder Edition) (2007 Digital Remaster),Bossa Nova Soul Samba (Rudy Van Gelder Edition),Ike Quebec,317.0,0.507,0.356,2008ø
Blue Harlem,The History of Blue Note_ 70th Anniversary,Ike Quebec,272.8,0.507,0.356,1991ø