Wash_ Rinse_ Repeat,Iller Than Theirs,Iller Than Theirs,226.4,0.505,0.304,2007ø
To Be ILL,Iller Than Theirs,Iller Than Theirs,195.7,0.505,0.304,2007ø
The Same (featuring Masta Ace),Iller Than Theirs,Iller Than Theirs,282.0,0.505,0.304,2007ø
Splash,Iller Than Theirs,Iller Than Theirs,273.8,0.505,0.304,2007ø
Smorg,Iller Than Theirs,Iller Than Theirs,181.1,0.505,0.304,2007ø
Razor Bumps,Iller Than Theirs,Iller Than Theirs,242.7,0.505,0.304,2007ø
Lo-Top Sneakers (Featuring Baje One of Junk Science),Iller Than Theirs,Iller Than Theirs,189.6,0.505,0.304,2007ø
It Is What It Is (Featuring Cool Calm Pete),Iller Than Theirs,Iller Than Theirs,238.6,0.505,0.304,2007ø
Good People (Featuring Jah C of The Project),Iller Than Theirs,Iller Than Theirs,217.7,0.505,0.304,2007ø
Girl Song (Featuring Scott Thorough),Iller Than Theirs,Iller Than Theirs,223.3,0.505,0.304,2007ø
After All (Featuring Scott Thorough),Iller Than Theirs,Iller Than Theirs,249.1,0.505,0.304,2007ø