Zeitenende,Tesco Disco - Heavy Electronics II,INADE,289.0,0.492,0.374,1991ø
Under The Light Of Grace,Tesco Disco - Heavy Electronics II,INADE,194.9,0.492,0.374,1997ø
Titan In Shivering Sand,The Crackling of the Anonymous,INADE,398.3,0.492,0.374,2001ø
Through The Gates Of Death,Burning Flesh,INADE,400.6,0.492,0.374,2000ø
The Grinding Inside,Tesco Disco - Heavy Electronics II,INADE,452.6,0.492,0.374,1997ø
The Engine Of Space,The Crackling of the Anonymous,INADE,454.3,0.492,0.374,2001ø
The End Of The Beginning (II),Aldebaran,INADE,361.9,0.492,0.374,1996ø
The End Of The Beginning (I),Aldebaran,INADE,465.1,0.492,0.374,1996ø
The Crushing Of Earthly Foundations (II),Aldebaran,INADE,346.4,0.492,0.374,1996ø
The Crushing Of Earthly Foundations (I),Aldebaran,INADE,550.0,0.492,0.374,1996ø
The Conquest Of Being Separated (II),Aldebaran,INADE,289.9,0.492,0.374,1996ø
The Coming Of The Black Legions,Burning Flesh,INADE,189.2,0.492,0.374,2000ø
Tat Twam Asi,Burning Flesh,INADE,422.0,0.492,0.374,2000ø
Storm Of Fire,Burning Flesh,INADE,459.5,0.492,0.374,2000ø
Signals From 68 Dimensions (II),Aldebaran,INADE,421.8,0.492,0.374,1996ø
Shattered Bones,Burning Flesh,INADE,379.2,0.492,0.374,2000ø
Reiteration Of Void,The Crackling of the Anonymous,INADE,393.0,0.492,0.374,2001ø
Quartered Conclusion,The Crackling of the Anonymous,INADE,396.5,0.492,0.374,2001ø
Overture Bells,Burning Flesh,INADE,327.8,0.492,0.374,2000ø
Genius Loci Pt. IV,Burning Flesh,INADE,311.1,0.492,0.374,2000ø
Genius Loci Pt. III,Burning Flesh,INADE,388.6,0.492,0.374,2000ø
Genius Loci Pt. II,Burning Flesh,INADE,387.9,0.492,0.374,2000ø
Genius Loci Pt. I,Burning Flesh,INADE,397.7,0.492,0.374,2000ø
Final Prayer,Burning Flesh,INADE,199.8,0.492,0.374,2000ø
Eternity's Crevice,The Crackling of the Anonymous,INADE,411.4,0.492,0.374,2001ø
Disconnecting States,The Crackling of the Anonymous,INADE,402.4,0.492,0.374,2001ø
Chapel Perilous,The Crackling of the Anonymous,INADE,419.5,0.492,0.374,2005ø
Caldera,The Crackling of the Anonymous,INADE,410.6,0.492,0.374,2001ø
Burning Flesh,Burning Flesh,INADE,236.3,0.492,0.374,2000ø
Breath Like Ground Glass,The Crackling of the Anonymous,INADE,372.0,0.492,0.374,2001ø
Breaking The Walls,Tesco Disco - Heavy Electronics II,INADE,291.1,0.492,0.374,1996ø
Axxiarm Signals,Tesco Disco - Heavy Electronics II,INADE,339.7,0.492,0.374,1997ø