Whut You Want (Album Version),Still Ghetto,Jaheim,102.5,0.752,0.534,2002ø
Whoa (Album Version),Another Round,Jaheim,226.1,0.752,0.534,2010ø
What You Think Of That (Amended Album Version),The Makings Of A Man,Jaheim,206.3,0.752,0.534,2007ø
Voice Of R&B (Explicit Album Version),The Makings Of A Man,Jaheim,175.6,0.752,0.534,2007ø
Till It Happens To You (Album Version),Another Round,Jaheim,258.4,0.752,0.534,2010ø
Tight Jeans (Album Version),Still Ghetto,Jaheim,275.3,0.752,0.534,2002ø
Special Day (Album Version),Still Ghetto,Jaheim,282.6,0.752,0.534,2002ø
She Ain't You (Amended Album Version),The Makings Of A Man,Jaheim,203.3,0.752,0.534,2007ø
Ready_ Willing & Able (Album Version),Ghetto Love,Jaheim,297.2,0.752,0.534,2001ø
Put That Woman First (Clean Album Version),Still Ghetto,Jaheim,245.7,0.752,0.534,2002ø
Put That Woman First (Album Version),Still Ghetto,Jaheim,246.8,0.752,0.534,2002ø
Otha Half (Album Version),Another Round,Jaheim,247.5,0.752,0.534,2010ø
Never (Amended Album Version),The Makings Of A Man,Jaheim,266.4,0.752,0.534,2007ø
Me And My Bitch (Clean Album Version),Still Ghetto,Jaheim,199.3,0.752,0.534,2002ø
Masterpiece (Amended Album Version),Ghetto Classics,Jaheim,244.2,0.752,0.534,2006ø
Make A Wish (Amended Album Version),The Makings Of A Man,Jaheim,231.2,0.752,0.534,2007ø
Love Is Still Here (Album Version),Ghetto Love,Jaheim,90.9,0.752,0.534,2001ø
Looking For Love (Album Version),Ghetto Love,Jaheim,233.2,0.752,0.534,2001ø
Long As I Live (Album Version),Still Ghetto,Jaheim,285.5,0.752,0.534,2002ø
Lonely (Amended Album Version),The Makings Of A Man,Jaheim,284.6,0.752,0.534,2007ø
Like A DJ (Album Version),Ghetto Classics,Jaheim,228.7,0.752,0.534,2006ø
Life Of A Thug (Explicit Album Version),The Makings Of A Man,Jaheim,269.8,0.752,0.534,2007ø
Let's Talk About It (Clean Album Version),Still Ghetto,Jaheim,242.7,0.752,0.534,2002ø
Let's Talk About It (Album Version),Still Ghetto,Jaheim,242.7,0.752,0.534,2002ø
Just In Case (Album Version),Ghetto Love,Jaheim,265.7,0.752,0.534,2001ø
Just Don't Have A Clue (Explicit Album Version),The Makings Of A Man,Jaheim,247.2,0.752,0.534,2007ø
Interlude: Jah's Seed (Album Version),Ghetto Love,Jaheim,70.7,0.752,0.534,2001ø
Interlude (Album Version),Still Ghetto,Jaheim,48.9,0.752,0.534,2002ø
In My Hands (Album Version),Another Round,Jaheim,284.4,0.752,0.534,2010ø
Impossible (Album Version),Another Round,Jaheim,238.4,0.752,0.534,2010ø
II Pink Lines (Album Version),Another Round,Jaheim,200.0,0.752,0.534,2010ø
I've Changed [feat. Keyshia Cole] (Amended Album Version),The Makings Of A Man,Jaheim,213.8,0.752,0.534,2007ø
I Ain't Never (Amended Album Version),Ghetto Classics,Jaheim,241.5,0.752,0.534,2006ø
I Ain't Never (Album Version),Ghetto Classics,Jaheim,241.3,0.752,0.534,2006ø
Hush (Explicit Album Version),The Makings Of A Man,Jaheim,224.6,0.752,0.534,2007ø
Her (Album Version),Another Round,Jaheim,206.7,0.752,0.534,2010ø
Heaven In My Eyes (Album Version),Ghetto Love,Jaheim,230.6,0.752,0.534,2001ø
Have You Ever (Amended Album Version),The Makings Of A Man,Jaheim,231.4,0.752,0.534,2007ø
Happiness (Album Version),Ghetto Love,Jaheim,195.1,0.752,0.534,2001ø
Ghetto Love (Album Version),Ghetto Love,Jaheim,263.0,0.752,0.534,2001ø
Forgetful (Album Version),Ghetto Classics,Jaheim,222.9,0.752,0.534,2006ø
Forever (Album Version),Ghetto Love,Jaheim,244.6,0.752,0.534,2001ø
For Moms (Album Version),Ghetto Love,Jaheim,113.4,0.752,0.534,2001ø
Finding My Way Back (Album Version),Another Round,Jaheim,226.7,0.752,0.534,2010ø
Fabulous (Album Version),Still Ghetto,Jaheim,227.8,0.752,0.534,2002ø
Everywhere I Am (Album Version),Still Ghetto,Jaheim,317.7,0.752,0.534,2002ø
Everytime I Think About Her [Featuring Jadakiss] (Amended Album Version),Ghetto Classics,Jaheim,266.8,0.752,0.534,2006ø
Du & Jah (Album Version),Ghetto Love,Jaheim,46.0,0.752,0.534,2001ø
Diamond In Da Ruff (Album Version),Still Ghetto,Jaheim,201.8,0.752,0.534,2002ø
Daddy Thing (Amended Album Version),Ghetto Classics,Jaheim,230.5,0.752,0.534,2006ø
Daddy Thing (Album Version),Ghetto Classics,Jaheim,230.4,0.752,0.534,2006ø
Could It Be [Anything You Want Remix] (Radio Edit),Ghetto Love,Jaheim,184.3,0.752,0.534,2001ø
Conversation (Amended Album Version),Ghetto Classics,Jaheim,182.3,0.752,0.534,2006ø
Conversation (Album Version),Ghetto Classics,Jaheim,181.9,0.752,0.534,2006ø
Come Over (Amended Album Version),Ghetto Classics,Jaheim,181.9,0.752,0.534,2006ø
Come Over (Album Version),Ghetto Classics,Jaheim,181.4,0.752,0.534,2006ø
Closer (Album Version),Another Round,Jaheim,227.2,0.752,0.534,2010ø
Bed Is Listening (Album Version),Another Round,Jaheim,210.8,0.752,0.534,2010ø
Beauty And Thug [Featuring Mary J. Blige] (Album Version),Still Ghetto,Jaheim,297.5,0.752,0.534,2002ø
Backtight (Clean Album Version),Still Ghetto,Jaheim,223.5,0.752,0.534,2002ø
Back Together Again (Amended Album Version),The Makings Of A Man,Jaheim,243.6,0.752,0.534,2007ø
Anything [Featuring Next] (Album Version),Ghetto Love,Jaheim,287.2,0.752,0.534,2001ø
Another Round (Album Version),Another Round,Jaheim,200.7,0.752,0.534,2010ø
Ain't Leavin Without You [Remix] [feat. Jadakiss],Another Round,Jaheim,210.5,0.752,0.534,2010ø
Ain't Leavin Without You (Album Version),Another Round,Jaheim,200.6,0.752,0.534,2010ø
125th (Amended Album Version),Ghetto Classics,Jaheim,256.1,0.752,0.534,2006ø
125th (Album Version),Ghetto Classics,Jaheim,256.1,0.724,0.534,2006ø