White Van (feat. Alchemist_ Evidence & Prodigy),White Van Music,Jake One,196.1,0.615,0.436,2008ø
Turn it Down,White Van Music,Jake One,50.0,0.615,0.436,2008ø
Trap Door (feat. MF DOOM),White Van Music,Jake One,134.1,0.615,0.436,2008ø
The Truth (feat. Freeway & Brother Ali),White Van Music,Jake One,214.2,0.615,0.436,2008ø
Soil Raps (feat. Keak Da Sneak),White Van Music,Jake One,248.0,0.615,0.436,2008ø
R.I.P.,White Van Music,Jake One,98.8,0.615,0.436,2008ø
Oh Really (feat. Posdnuos & Slug),White Van Music,Jake One,168.9,0.615,0.436,2008ø
Kissin' the Curb (feat. Bishop Lamont & Busta Rhymes),White Van Music,Jake One,215.9,0.615,0.436,2008ø
I'm Coming (feat. Black Milk & Nottz),White Van Music,Jake One,187.2,0.615,0.436,2008ø
How We Ride (feat. Freeway),White Van Music,Jake One,277.0,0.615,0.436,2008ø
Home (feat. Vitamin D_ C Note_ Maine & Ish),White Van Music,Jake One,321.6,0.615,0.436,2008ø
Hi,White Van Music,Jake One,48.8,0.615,0.436,2008ø
Great Sound,White Van Music,Jake One,64.0,0.615,0.436,2008ø
God Like (feat. D. Black),White Van Music,Jake One,149.1,0.615,0.436,2008ø
Gangsta Boy (feat. M.O.P.),White Van Music,Jake One,191.4,0.615,0.436,2008ø
Feeling My Shit (feat. Casual),White Van Music,Jake One,203.4,0.615,0.436,2008ø
Dead Wrong (feat. Young Buck),White Van Music,Jake One,216.8,0.615,0.436,2008ø
Bless the Child (feat. Little Brother),White Van Music,Jake One,262.4,0.615,0.436,2008ø
Big Homie Style (feat. J. Pinder_ GMK & Spaceman),White Van Music,Jake One,264.3,0.615,0.436,2008ø