Where You Gonna Run To?,BareNaked,Jennifer Love Hewitt,213.7,0.601,0.372,2002ø
The Greatest Word (LP Version),Jennifer Love Hewitt,Jennifer Love Hewitt,255.1,0.601,0.372,1996ø
Stand In Your Way,BareNaked,Jennifer Love Hewitt,253.2,0.601,0.372,2002ø
Rock The Roll,BareNaked,Jennifer Love Hewitt,224.8,0.601,0.372,2002ø
No Ordinary Love (LP Version),Jennifer Love Hewitt,Jennifer Love Hewitt,245.4,0.601,0.372,1996ø
Never A Day Goes By  (LP Version),Jennifer Love Hewitt,Jennifer Love Hewitt,252.8,0.601,0.372,1996ø
Never A Day Goes By  (Acoustic Version),Jennifer Love Hewitt,Jennifer Love Hewitt,253.3,0.601,0.372,1996ø
Me And Bobby McGee,Barenaked,Jennifer Love Hewitt,215.2,0.601,0.372,2002ø
Last Night (LP Version),Jennifer Love Hewitt,Jennifer Love Hewitt,257.0,0.601,0.372,1996ø
Just Try,Barenaked,Jennifer Love Hewitt,223.9,0.601,0.372,2002ø
It's Good To Know I'm Alive (LP Version),Jennifer Love Hewitt,Jennifer Love Hewitt,182.6,0.601,0.372,1996ø
I Want A Love I Can See (LP Version),Jennifer Love Hewitt,Jennifer Love Hewitt,230.5,0.601,0.372,1996ø
I Know You Will,BareNaked,Jennifer Love Hewitt,198.7,0.601,0.372,2002ø
I Believe In  (LP Version),Jennifer Love Hewitt,Jennifer Love Hewitt,273.7,0.601,0.372,1996ø
I Always Was Your Girl (LP Version),Jennifer Love Hewitt,Jennifer Love Hewitt,272.6,0.601,0.372,1996ø
Hey Everybody,BareNaked,Jennifer Love Hewitt,247.9,0.601,0.372,2002ø
First Time,Barenaked,Jennifer Love Hewitt,229.5,0.601,0.372,2002ø
Don't Push The River (LP Version),Jennifer Love Hewitt,Jennifer Love Hewitt,217.0,0.601,0.372,1996ø
Cool With You (LP Version),Jennifer Love Hewitt,Jennifer Love Hewitt,195.4,0.601,0.372,1996ø
Can I Go Now,Barenaked,Jennifer Love Hewitt,216.0,0.601,0.372,2002ø
BareNaked,Barenaked,Jennifer Love Hewitt,222.2,0.601,0.372,2002ø
Avenue Of The Stars,BareNaked,Jennifer Love Hewitt,244.2,0.601,0.372,2002ø
(Our Love) Don't Throw It All Away  (LP Version),Jennifer Love Hewitt,Jennifer Love Hewitt,238.9,0.601,0.372,1996ø