Vengo De Amor (Album Version),Salsa Dura,Jimmy Bosch,300.2,0.577,0.333,1999ø
Speak No Evil (Album Version),Salsa Dura,Jimmy Bosch,313.8,0.577,0.333,1999ø
Sigo Cambiando (Album Version),Salsa Dura,Jimmy Bosch,265.9,0.577,0.333,1999ø
La Noticia (Album Version),Salsa Dura,Jimmy Bosch,253.5,0.577,0.333,1999ø
La Cacharra (Album Version),Salsa Dura,Jimmy Bosch,297.2,0.577,0.333,1999ø
Impacto Tendremos (Album Version),Salsa Dura,Jimmy Bosch,203.0,0.577,0.333,1999ø
El Embajador,Dj Lubi Presents Salsa Dura,Jimmy Bosch,410.4,0.577,0.333,2007ø
Canta Mi Mozambique (Album Version),Salsa Dura,Jimmy Bosch,344.2,0.577,0.333,1999ø