To Run (EP Version),Angels Undercover,Josiah Leming,219.7,0.736,0.451,2008ø
This Cigar (EP Version),Angels Undercover,Josiah Leming,288.6,0.736,0.451,2008ø
Theysay (EP Version),Angels Undercover,Josiah Leming,323.9,0.736,0.451,2008ø
Satisfied (Album Version),Punk Ass Rain EP,Josiah Leming,222.7,0.736,0.451,2009ø
Razor Blades And Hand Grenades (Album Version),Punk Ass Rain EP,Josiah Leming,297.9,0.736,0.451,2009ø
Punk Ass Rain (Album Version),Punk Ass Rain EP,Josiah Leming,146.2,0.736,0.451,2009ø
Over And Over (Album Version),Punk Ass Rain EP,Josiah Leming,252.4,0.736,0.451,2009ø
Dizzy On The Rooftops (Album Version),Punk Ass Rain EP,Josiah Leming,174.6,0.736,0.451,2009ø
Arctic Outcry Wind (EP Version),Angels Undercover,Josiah Leming,222.2,0.736,0.451,2008ø
Angels Undercover (EP Version),Angels Undercover,Josiah Leming,227.4,0.736,0.451,2008ø