Walk Away,Come Into My Life: The Very Best Of,Joyce Sims,335.1,0.501,0.36,1987ø
Love Makes A Woman,Come Into My Life: The Very Best Of,Joyce Sims,247.9,0.501,0.36,1987ø
Looking For A Love,Dave Pearce Best of the Dance Years 1988 - 1992,Joyce Sims,370.5,0.501,0.36,2009ø
Lifetime Love,Come Into My Life: The Very Best Of,Joyce Sims,382.5,0.501,0.36,1987ø
Come Into My Life,FFRR Black,Joyce Sims,501.4,0.501,0.36,1987ø
(You Are My) All And All,Come Into My Life: The Very Best Of,Joyce Sims,368.9,0.501,0.36,2010ø