You Can't Rush Spring,Sounds Of Winter,Karrin Allyson,251.8,0.575,0.368,1997ø
You Are Too Beautiful,Sweet Home Cookin',Karrin Allyson,331.4,0.575,0.368,1994ø
Yeh Yeh,Sweet Home Cookin',Karrin Allyson,257.9,0.575,0.368,1994ø
Why Was I Born?,Ballads: Remembering John Coltrane,Karrin Allyson,218.7,0.575,0.368,2002ø
What A Little Moonlight Can Do,I Didn't Know About You,Karrin Allyson,156.6,0.575,0.368,1993ø
The Moon Is A Harsh Mistress,Wild For You,Karrin Allyson,203.8,0.575,0.368,2004ø
The Meaning Of The Blues,In Blue,Karrin Allyson,454.9,0.575,0.368,2002ø
The First Time Ever I Saw Your Face,Wild For You,Karrin Allyson,288.9,0.575,0.368,2004ø
Strollin',Footprints,Karrin Allyson,283.1,0.575,0.368,2006ø
Sorry Seems To Be The Hardest Word,Wild For You,Karrin Allyson,306.9,0.575,0.368,2004ø
Something Worth Waiting For (Con Alma),Footprints,Karrin Allyson,214.9,0.575,0.368,2006ø
Social Call,Sweet Home Cookin',Karrin Allyson,283.5,0.575,0.368,1994ø
So Danco Samba,Daydream,Karrin Allyson,325.5,0.575,0.368,1997ø
Show Me,Daydream,Karrin Allyson,218.8,0.575,0.368,1997ø
Say It (Over And Over Again),Ballads: Remembering John Coltrane,Karrin Allyson,361.3,0.575,0.368,2002ø
Save That Time,I Didn't Know About You,Karrin Allyson,224.6,0.575,0.368,1993ø
Samba Saravah,From Paris To Rio,Karrin Allyson,310.0,0.575,0.368,1999ø
Outono (Stay),Imagina: Songs Of Brasil,Karrin Allyson,302.2,0.575,0.368,2008ø
O Barquinho,Saturday Afternoon Jazz,Karrin Allyson,268.1,0.575,0.368,2000ø
No Moon At All,Sweet Home Cookin',Karrin Allyson,256.7,0.575,0.368,1994ø
Ne Me Quitte Pas,From Paris To Rio,Karrin Allyson,280.5,0.575,0.368,1999ø
Nancy (With The Laughing Face),Ballads: Remembering John Coltrane,Karrin Allyson,283.8,0.575,0.368,2002ø
Naima,Ballads: Remembering John Coltrane,Karrin Allyson,396.8,0.575,0.368,2002ø
Monk Medley,Daydream,Karrin Allyson,381.9,0.575,0.368,1997ø
Medo De Amar (Surrender The Soul),Imagina: Songs Of Brasil,Karrin Allyson,222.6,0.575,0.368,2008ø
Long As You're Living,In Blue,Karrin Allyson,273.9,0.575,0.368,2002ø
Lightning (Lazy Bird),Footprints,Karrin Allyson,178.6,0.575,0.368,2006ø
Jesse,I Didn't Know About You,Karrin Allyson,269.2,0.575,0.368,1993ø
It's Easy To Remember,Ballads: Remembering John Coltrane,Karrin Allyson,360.6,0.575,0.368,2002ø
It Could Happen to You/Fried Bananas,Collage,Karrin Allyson,285.8,0.575,0.368,1996ø
Imagina,Imagina: Songs Of Brasil,Karrin Allyson,174.9,0.575,0.368,2008ø
I Wish I Knew,Ballads: Remembering John Coltrane,Karrin Allyson,259.5,0.575,0.368,2002ø
I Found The Turnaround (The Turnaround),Footprints,Karrin Allyson,243.0,0.575,0.368,2006ø
I Don't Stand A Ghost Of A Chance With You,I Didn't Know About You,Karrin Allyson,353.3,0.575,0.368,1993ø
I Didn't Know About You,I Didn't Know About You,Karrin Allyson,268.2,0.575,0.368,1993ø
I Cover The Waterfront,Sweet Home Cookin',Karrin Allyson,353.5,0.575,0.368,1994ø
I Can't Say (Teaneck),Footprints,Karrin Allyson,224.3,0.575,0.368,2006ø
Hum Drum Blues,In Blue,Karrin Allyson,338.7,0.575,0.368,2002ø
Here_ There And Everywhere,Collage,Karrin Allyson,291.4,0.575,0.368,1996ø
Guilty,I Didn't Know About You,Karrin Allyson,335.5,0.575,0.368,1993ø
Give Me A Break (Unit 7),Footprints,Karrin Allyson,228.3,0.575,0.368,2006ø
Give It Up Or Let Me Go,Collage,Karrin Allyson,252.4,0.575,0.368,1996ø
Follow The Footprints (Footprints),Footprints,Karrin Allyson,247.7,0.575,0.368,2006ø
Feel Like Makin' Love,Wild For You,Karrin Allyson,255.5,0.575,0.368,2004ø
Faltando  Um Pedaco,Collage,Karrin Allyson,371.1,0.575,0.368,1996ø
Evil Gal Blues,In Blue,Karrin Allyson,250.7,0.575,0.368,2002ø
Everything Must Change,Daydream,Karrin Allyson,404.1,0.575,0.368,1997ø
Estrada Do Sol,Imagina: Songs Of Brasil,Karrin Allyson,186.9,0.575,0.368,2008ø
Estrada Branca (This Happy Madness),Imagina: Songs Of Brasil,Karrin Allyson,289.3,0.575,0.368,2008ø
Double Rainbow,Imagina: Songs Of Brasil,Karrin Allyson,332.7,0.575,0.368,2008ø
Dindi,Sweet Home Cookin',Karrin Allyson,479.7,0.575,0.368,1994ø
Desafinado (Slightly Out Of Tune),Imagina: Songs Of Brasil,Karrin Allyson,313.3,0.575,0.368,2008ø
Correnteza,Imagina: Songs Of Brasil,Karrin Allyson,147.5,0.575,0.368,2008ø
Corcovado (Quiet Nights),Daydream,Karrin Allyson,416.5,0.575,0.368,1997ø
Coracao Vagabundo,From Paris To Rio,Karrin Allyson,267.0,0.575,0.368,1999ø
Catavento e Girasol,From Paris To Rio,Karrin Allyson,301.0,0.575,0.368,1999ø
But I Was Cool,Footprints,Karrin Allyson,246.2,0.575,0.368,2006ø
Blue Motel Room,In Blue,Karrin Allyson,363.0,0.575,0.368,2002ø
Bachinanas Brasileiras No. 5: Aria/Belo Horizonte,From Paris To Rio,Karrin Allyson,407.8,0.575,0.368,1999ø
Autumn Leaves (Les Fueilles Mortes),Centennial Celebration: Johnny Mercer,Karrin Allyson,286.1,0.575,0.368,1996ø
Autumn Leaves,Collage,Karrin Allyson,286.2,0.575,0.368,1996ø
Ask Me Now,Collage,Karrin Allyson,402.4,0.575,0.368,1996ø
And So It Goes,Collage,Karrin Allyson,224.4,0.575,0.368,1996ø
All You Need To Say (Never Say Yes),Footprints,Karrin Allyson,262.8,0.575,0.368,2006ø
All Or Nothing At All,Ballads: Remembering John Coltrane,Karrin Allyson,409.1,0.575,0.368,2002ø
All Of You,Collage,Karrin Allyson,284.7,0.575,0.368,1996ø
A Tree And Me,Footprints,Karrin Allyson,189.1,0.575,0.368,2006ø
A Felicidade (Happiness),Imagina: Songs Of Brasil,Karrin Allyson,260.4,0.575,0.368,2008ø
(Pack Your) Suitcase Blues,I Didn't Know About You,Karrin Allyson,200.2,0.575,0.368,1993ø