Stone Love,The Definitive Collection,Kashif,325.5,0.543,0.39,1983ø
Loving You Only,The Definitive Collection,Kashif,283.8,0.543,0.39,1987ø
Love Me All Over,The Definitive Collection,Kashif,317.0,0.543,0.39,1987ø
I Just Gotta Have You,The Definitive Collection,Kashif,344.7,0.543,0.39,1998ø
Dancing In The Dark (Heart To Heart),The Definitive Collection,Kashif,261.2,0.543,0.39,1985ø
Condition Of The Heart,The Definitive Collection,Kashif,282.1,0.543,0.39,1985ø
Baby Don't Break Your Baby's Heart,The Definitive Collection,Kashif,390.6,0.543,0.39,1998ø
Are You The Woman,The Definitive Collection,Kashif,326.7,0.543,0.39,1998ø
Ain't No Woman,The Definitive Collection,Kashif,324.0,0.543,0.39,1998ø