Where Hope Goes To Die,100% Pure Coka,La Coka Nostra,167.7,0.676,0.409,2007ø
The Stain,A Brand You Can Trust,La Coka Nostra,321.3,0.676,0.409,2009ø
That's Coke,A Brand You Can Trust,La Coka Nostra,188.9,0.676,0.409,2009ø
Soldier's Story (feat. Sick Jacken of Psycho Realm),A Brand You Can Trust,La Coka Nostra,230.3,0.676,0.409,2009ø
Nuclear Medicinemen (feat. Q-Unique & Immortal Technique),A Brand You Can Trust,La Coka Nostra,278.1,0.676,0.409,2009ø
I'm An American (feat. B-Real of Cypress Hill),A Brand You Can Trust,La Coka Nostra,239.4,0.676,0.409,2009ø
Hardcore Chemical,A Brand You Can Trust,La Coka Nostra,203.6,0.676,0.409,2009ø
Gun In Your Mouth,A Brand You Can Trust,La Coka Nostra,219.1,0.676,0.409,2009ø
Get You By,A Brand You Can Trust,La Coka Nostra,241.0,0.676,0.409,2009ø
Fuck Tony Montana (feat. Sick Jacken of Psycho Realm & B-Real of Cypress Hill),A Brand You Can Trust,La Coka Nostra,263.7,0.676,0.409,2009ø
Cousin of Death,A Brand You Can Trust,La Coka Nostra,258.2,0.676,0.409,2009ø
Choose Your Side (feat. Bun B),A Brand You Can Trust,La Coka Nostra,262.8,0.676,0.409,2009ø
Brujeria (feat. Sick Jacken of Psycho Realm),A Brand You Can Trust,La Coka Nostra,160.9,0.676,0.409,2009ø
Bloody Sunday (feat. Sen Dog of Cypress Hill and Big Left),A Brand You Can Trust,La Coka Nostra,192.9,0.676,0.409,2009ø
Bang Bang (feat. Snoop Dogg),A Brand You Can Trust,La Coka Nostra,210.5,0.676,0.409,2009ø