Voyage Voyage,Allez! On Danse Alors - 50 French Sax Club Hits,Legend B,226.5,0.47,0.324,2002ø
Lost In Love (Taucher RMX),Lost In Love,Legend B,506.8,0.47,0.324,1994ø
Lost In Love (Taucher Radio Mix),Lost In Love,Legend B,198.3,0.47,0.324,1997ø
Lost In Love (Red Jerry RMX),Lost In Love,Legend B,575.5,0.47,0.324,1994ø
Lost In Love (Original Mix),Lost In Love,Legend B,368.5,0.47,0.324,1996ø
Lost In Love (Kinetic Atom Mix),Lost In Love,Legend B,401.7,0.47,0.324,1994ø
End Of A Season,End Of A Season E.P.,Legend B,443.2,0.47,0.324,1994ø