Welcome To The Minstrel Show (featuring Yahzarah) (Explicit Album Version),The Minstrel Show,Little Brother,77.7,0.735,0.496,2005ø
We Got Now (Featuring Chaundon) (Explicit Version),The Minstrel Show,Little Brother,272.5,0.735,0.496,2005ø
Watch Me (Explicit Version),The Minstrel Show,Little Brother,259.3,0.735,0.496,2005ø
Watch Me (Amended Version),The Minstrel Show,Little Brother,212.2,0.735,0.496,2005ø
Two Step Blues feat. Darien Brockington ,LeftBack,Little Brother,267.7,0.735,0.496,2010ø
Tigallo For Dolo,LeftBack,Little Brother,174.6,0.735,0.496,2010ø
The Becoming (Explicit Version),The Minstrel Show,Little Brother,125.9,0.735,0.496,2005ø
Table For Two feat. Jozeemo & Yahzarah,LeftBack,Little Brother,278.4,0.735,0.496,2010ø
Still Lives Through (Explicit Version),The Minstrel Show,Little Brother,205.6,0.735,0.496,2005ø
Still Lives Through (Amended Version),The Minstrel Show,Little Brother,204.9,0.735,0.496,2005ø
So Cold feat. Chaundon,LeftBack,Little Brother,254.9,0.735,0.496,2010ø
Slow it Down (Explicit Version),The Minstrel Show,Little Brother,259.3,0.735,0.496,2005ø
Slow It Down (Amended Version),The Minstrel Show,Little Brother,258.6,0.735,0.496,2005ø
Sincerely Yours (Explicit Version),The Minstrel Show,Little Brother,195.8,0.735,0.496,2005ø
Second Chances feat. Bilal & Darien Brockington,LeftBack,Little Brother,245.3,0.735,0.496,2010ø
Say It Again (Explicit Version),The Minstrel Show,Little Brother,227.3,0.735,0.496,2005ø
Say It Again (Amended Version),The Minstrel Show,Little Brother,227.3,0.735,0.496,2005ø
Revenge feat. Truck North & Median,LeftBack,Little Brother,275.0,0.735,0.496,2010ø
Not Enough (Amended Version),The Minstrel Show,Little Brother,270.7,0.735,0.496,2005ø
Minstrel Show Closing Theme (Featuring Yahzarah) (Explicit Version),The Minstrel Show,Little Brother,88.9,0.735,0.496,2005ø
Minstrel Show Closing Theme (Featuring Yahzarah) (Amended Version),The Minstrel Show,Little Brother,88.7,0.735,0.496,2005ø
Lovin' It (feat. Joe Scudda) (Amended Album Version),The Minstrel Show,Little Brother,250.9,0.735,0.496,2005ø
Hold On (Explicit Version - bundle only w/iTunes),The Minstrel Show,Little Brother,274.1,0.735,0.496,2005ø
Hiding Place (Explicit Version),The Minstrel Show,Little Brother,240.6,0.735,0.496,2005ø
Hiding Place (Amended Version),The Minstrel Show,Little Brother,204.3,0.735,0.496,2005ø
Go Off Go On ,LeftBack,Little Brother,174.5,0.735,0.496,2010ø
Get Enough Pt. 2 feat. Khrysis,LeftBack,Little Brother,258.7,0.735,0.496,2010ø
Diary Of A Mad Black Daddy (Explicit Album Version),The Minstrel Show,Little Brother,40.7,0.735,0.496,2005ø
Curtain Call,LeftBack,Little Brother,192.0,0.735,0.496,2010ø
Cheatin' (Explicit Version),The Minstrel Show,Little Brother,223.7,0.735,0.496,2005ø
Before The Night Is Over ,LeftBack,Little Brother,264.0,0.735,0.496,2010ø
Beautiful Morning (Amended Version),The Minstrel Show,Little Brother,140.5,0.735,0.496,2005ø
All For You (Featuring Darien Brockington) (Explicit Version),The Minstrel Show,Little Brother,279.7,0.735,0.496,2005ø
After The Party feat. Carlitta Durand ,LeftBack,Little Brother,260.0,0.735,0.496,2010ø
5th And Fashion (Amended Version),The Minstrel Show,Little Brother,80.0,0.735,0.496,2005ø
24 feat. Torae ,LeftBack,Little Brother,237.4,0.735,0.496,2010ø