T-Bone Blues,Louis Jordan & His Tympany Five - Chapter 5,Louis Jordan & His Tympany Five,193.0,0.378,0.427,2001ø
Somebody Done Changed The Lock On My Door,Louis Jordan & His Tympany Five - Chapter 5,Louis Jordan & His Tympany Five,197.0,0.378,0.427,1996ø
Small Town Boy,Louis Jordan & His Tympany Five - Chapter 5,Louis Jordan & His Tympany Five,168.5,0.378,0.427,2001ø
Reet Petite And Gone,The R & B Years Volume 2,Louis Jordan & His Tympany Five,160.6,0.378,0.427,2001ø
Petootie Pie,Classic Years of Louis Jordan,Louis Jordan & His Tympany Five,160.3,0.378,0.427,1995ø
Mop! Mop!,Classic Years of Louis Jordan,Louis Jordan & His Tympany Five,178.3,0.378,0.427,1999ø
Boogie Woogie Blue Plate,Boogieology - The Boogie Woogie Masters,Louis Jordan & His Tympany Five,166.9,0.378,0.427,1999ø
Ain't Nobody Here But Us Chickens,Jazz For Kids: Sing_ Clap_ Wiggle_ And Shake,Louis Jordan & His Tympany Five,183.2,0.378,0.427,1946ø