Silence_ The Girl,Arrangements For Fulminating Vective,Lye By Mistake,128.1,0.558,0.374,2006ø
Ostrich Feathers and Apple Pie,Arrangements For Fulminating Vective,Lye By Mistake,284.7,0.558,0.374,2006ø
Nero's Intention,Arrangements For Fulminating Vective,Lye By Mistake,555.5,0.558,0.374,2006ø
John Nash and the Flipper,Arrangements For Fulminating Vective,Lye By Mistake,174.1,0.558,0.374,2006ø
If We Were Intense_ This Song Would Be A Boyscout,Arrangements For Fulminating Vective,Lye By Mistake,164.8,0.558,0.374,2006ø
Dream As I May_ I Feel It_ and It's So Wrong,Arrangements For Fulminating Vective,Lye By Mistake,215.7,0.558,0.374,2006ø
Aboriginal Negatives,Arrangements For Fulminating Vective,Lye By Mistake,158.5,0.558,0.374,2006ø
900 Seconds In Search of Jerry,Arrangements For Fulminating Vective,Lye By Mistake,196.4,0.558,0.374,2006ø