Why Didn't You Call Me,Ultimate 2000s,Macy Gray,192.0,0.743,0.5,1999ø
When I See You,When I See You,Macy Gray,338.4,0.743,0.5,2002ø
What I Gotta Do,Big,Macy Gray,187.1,0.743,0.5,2007ø
Walk This Way,The Very Best Of,Macy Gray,211.3,0.743,0.5,2004ø
Time Of My Life,8 Mile,Macy Gray,261.5,0.743,0.5,2002ø
This Christmas (Hang All The Mistletoe),A Very Special Christmas 5,Macy Gray,211.0,0.743,0.5,2001ø
Things That Made Me Change,The Trouble With Being Myself,Macy Gray,270.2,0.743,0.5,2003ø
The Letter,On How Life Is / The Id (Coffret 2 CD),Macy Gray,338.6,0.743,0.5,1999ø
Strange Behavior,Big,Macy Gray,214.6,0.743,0.5,2007ø
Still,On How Life Is / The Id (Coffret 2 CD),Macy Gray,256.8,0.743,0.5,1999ø
Speechless,The Trouble With Being Myself,Macy Gray,245.4,0.743,0.5,2003ø
Slowly,Big,Macy Gray,233.9,0.743,0.5,2007ø
Shoo Be Doo,Big,Macy Gray,244.8,0.743,0.5,2007ø
Shed,the id,Macy Gray,258.8,0.743,0.5,2001ø
She Don't Write Songs About You,The Trouble With Being Myself,Macy Gray,278.9,0.743,0.5,2003ø
She Ain't Right For You,The Very Best Of,Macy Gray,252.2,0.743,0.5,2003ø
Sexual Revolution,the id,Macy Gray,286.9,0.743,0.5,2001ø
Sex-o-matic Venus Freak,Macy Gray On How Life Is,Macy Gray,237.5,0.743,0.5,1999ø
Screamin',The Trouble With Being Myself,Macy Gray,195.9,0.743,0.5,2003ø
Santa Baby,Music from the Motion Picture Mona Lisa Smile,Macy Gray,209.1,0.743,0.5,2003ø
Relating To A Psychopath,the id,Macy Gray,290.1,0.743,0.5,2001ø
One For Me,Big,Macy Gray,249.1,0.743,0.5,2007ø
Okay,Big,Macy Gray,249.0,0.743,0.5,2007ø
Oblivion,the id,Macy Gray,168.1,0.743,0.5,2001ø
My Fondest Childhood Memories,The Trouble With Being Myself,Macy Gray,216.1,0.743,0.5,2003ø
Love Is Gonna Get You,Love Is Gonna Get Ya,Macy Gray,180.5,0.743,0.5,2004ø
Lie To Me,When I See You,Macy Gray,335.2,0.743,0.5,2003ø
Jesus For A Day,The Trouble With Being Myself,Macy Gray,209.9,0.743,0.5,2003ø
It's Love,When I See You,Macy Gray,336.7,0.743,0.5,2003ø
It Ain't The Money (featuring Pharoahe Monch),The Trouble With Being Myself,Macy Gray,246.5,0.743,0.5,2003ø
I've Committed Murder,Macy Gray On How Life Is,Macy Gray,300.1,0.743,0.5,1999ø
I Want To Be Your Mother's Son-In-Law,Divine Secrets Of The Ya-Ya Sisterhood - Music From The Motion Picture,Macy Gray,152.2,0.743,0.5,2002ø
I Try,When I See You,Macy Gray,296.6,0.743,0.5,1999ø
I Can't Wait To Meetchu,I Try: The Macy Gray Collection,Macy Gray,318.0,0.743,0.5,1999ø
Harry,On How Life Is / The Id (Coffret 2 CD),Macy Gray,190.5,0.743,0.5,2001ø
Happiness,The Trouble With Being Myself,Macy Gray,253.8,0.743,0.5,2003ø
Gimme All Your Lovin' or I Will Kill You,On How Life Is / The Id (Coffret 2 CD),Macy Gray,285.6,0.743,0.5,2001ø
Ghetto Love,Big,Macy Gray,188.2,0.743,0.5,2007ø
Freak Like Me,the id,Macy Gray,218.0,0.743,0.5,2001ø
Forgiveness,the id,Macy Gray,318.8,0.743,0.5,2001ø
Everybody,Big,Macy Gray,196.6,0.743,0.5,2007ø
Every Now And Then,The Trouble With Being Myself,Macy Gray,275.2,0.743,0.5,2003ø
Don't Forget Me,Confessions Of A Shopaholic,Macy Gray,157.3,0.743,0.5,2009ø
Do Something,2000 Grammy Nominees--Pop,Macy Gray,298.0,0.743,0.5,1999ø
Come Together,The Trouble With Being Myself,Macy Gray,274.5,0.743,0.5,2003ø
Caligula,On How Life Is / The Id (Coffret 2 CD),Macy Gray,278.3,0.743,0.5,1999ø
Blowin' Up Your Speakers,On How Life Is / The Id (Coffret 2 CD),Macy Gray,67.5,0.743,0.5,2001ø
AEIOU,Big,Macy Gray,195.2,0.743,0.5,2007ø