Y'all Ain't Ready (EP Version),Must Be The Water EP,Marc Broussard,237.9,0.711,0.48,2008ø
Why Should She Wait [Feat. Sara Bareilles] (Album Version),Keep Coming Back,Marc Broussard,212.3,0.711,0.48,2008ø
Try Me (EP Version),Must Be The Water EP,Marc Broussard,215.5,0.711,0.48,2008ø
Someone You Know (EP Version),Must Be The Water EP,Marc Broussard,264.8,0.711,0.48,2008ø
Saying I Love You (Album Version),Keep Coming Back,Marc Broussard,227.6,0.711,0.48,2008ø
Real Good Thing (Album Version),Keep Coming Back,Marc Broussard,232.9,0.711,0.48,2008ø
Power's In The People (Album Version),Keep Coming Back,Marc Broussard,349.1,0.711,0.48,2008ø
On Santa's Way Home,Christmas Gumbo,Marc Broussard,220.6,0.711,0.48,2004ø
Must Be The Water (Single Version),Must Be The Water EP,Marc Broussard,230.3,0.711,0.48,2008ø
Keep Coming Back (Album Version),Keep Coming Back,Marc Broussard,214.3,0.711,0.48,2008ø
It's Over Now (EP Version),Must Be The Water EP,Marc Broussard,233.5,0.711,0.48,2008ø
Hard Knocks (Album Version),Keep Coming Back,Marc Broussard,233.7,0.711,0.48,2008ø
Evil Things (Album Version),Keep Coming Back,Marc Broussard,242.1,0.711,0.48,2008ø
Evangeline Rose (Album Version),Keep Coming Back,Marc Broussard,187.4,0.711,0.48,2008ø
Another Night Alone (Album Version),Keep Coming Back,Marc Broussard,233.1,0.711,0.48,2008ø