Run For Cover (Original Mix),Run 4 Number One,Mastiksoul,358.2,0.612,0.445,2009ø
Jacobino (Original Mix),Run 4 Number One,Mastiksoul,432.3,0.612,0.445,2008ø
Funk Master Flex,The Remakes Volume One,Mastiksoul,434.2,0.612,0.445,2007ø
Emergency,Futurism - CD # 1,Mastiksoul,399.4,0.342,0.445,2008ø
Electronic Mambo (Original Mix),Bofe De Elite Ep,Mastiksoul,446.5,0.612,0.445,2009ø
Bofe De Elite (Original Mix),Run 4 Number One,Mastiksoul,393.4,0.612,0.445,2009ø
Bofe De Elite (Mucho Mas Remix),Bofe De Elite Ep,Mastiksoul,419.5,0.612,0.445,2009ø