You're Doomed,Variations On Swing,Meet Me In St Louis,141.3,0.523,0.358,2009ø
Well You Damn Well Should,Variations On Swing,Meet Me In St Louis,154.1,0.523,0.358,2009ø
Right This Way You Maverick Renegade,Variations On Swing,Meet Me In St Louis,329.5,0.523,0.358,2009ø
I Am Champagne You Are Shit,Variations On Swing,Meet Me In St Louis,292.3,0.523,0.358,2009ø
Eins Zwei Drei Hasslehoff,Variations On Swing,Meet Me In St Louis,351.6,0.523,0.358,2007ø
Come To New York_ There Were Fewer Murders Last Year,Variations On Swing,Meet Me In St Louis,331.7,0.523,0.358,2009ø