OK!,The Best of Cooking Vinyl 2008,Mexican Institute of Sound,203.1,0.629,0.433,2006ø
Karate Kid 2,Soy Sauce,Mexican Institute of Sound,212.4,0.629,0.433,2009ø
Dub-A El Tiempo Es Muy Largo,La Mujer De Mi Hermano: Music Inspired by the Film,Mexican Institute of Sound,239.9,0.629,0.433,2006ø
Chiflideur,Soy Sauce,Mexican Institute of Sound,85.0,0.629,0.433,2009ø
Bienvenidos a Mi Disco,Deficit,Mexican Institute of Sound,239.6,0.629,0.433,2006ø
Alocatel (Ad Rock Remix),Soy Sauce,Mexican Institute of Sound,290.1,0.629,0.433,2009ø
A Girl Like You,Temptation: Music From The Showtime Series Californication,Mexican Institute of Sound,222.5,0.629,0.433,2007ø
Jalale,Soy Sauce,Mexican Institute of Sound,174.6,0.623,0.36,2009ø