Transcend,Momentum,Mindless Faith,246.0,0.529,0.364,2004ø
This Is The Last Time,Momentum,Mindless Faith,285.2,0.529,0.364,2004ø
The World Behind The World,Medication For The Misinformed,Mindless Faith,238.0,0.529,0.364,2007ø
The Unseen,Momentum,Mindless Faith,196.4,0.529,0.364,2004ø
The Dust Of Centuries,Medication For The Misinformed,Mindless Faith,236.4,0.529,0.364,2007ø
Tell,Medication For The Misinformed,Mindless Faith,297.0,0.529,0.364,2007ø
So Much For Salvation (Spektral Groove),Momentum,Mindless Faith,305.2,0.529,0.364,2004ø
Singular,Momentum,Mindless Faith,366.3,0.529,0.364,2004ø
Red Lines,Medication For The Misinformed,Mindless Faith,234.5,0.529,0.364,2007ø
Looking For Something That Isnt There,Momentum,Mindless Faith,179.5,0.529,0.364,2004ø
Inevitability,Momentum,Mindless Faith,202.7,0.529,0.364,2004ø
Independence Day (version),Medication For The Misinformed,Mindless Faith,312.5,0.529,0.364,2007ø
Independence Day (Precursor Mix),Dependence Volume 2,Mindless Faith,326.9,0.529,0.364,2007ø
Incubation,Momentum,Mindless Faith,205.3,0.529,0.364,2000ø
Im Pretty Much Fucked,Medication For The Misinformed,Mindless Faith,314.5,0.529,0.364,2007ø
If Not Now_ When?,Momentum,Mindless Faith,299.1,0.529,0.364,2004ø
Down Here,Medication For The Misinformed,Mindless Faith,402.0,0.529,0.364,2007ø
Darkhall,Medication For The Misinformed,Mindless Faith,294.1,0.529,0.364,2007ø
Canaan (Ritual Mix),Momentum,Mindless Faith,385.6,0.529,0.364,2004ø
Another Empire Falls,Medication For The Misinformed,Mindless Faith,148.4,0.529,0.364,2007ø
A Blind Spot In Every Eye,Medication For The Misinformed,Mindless Faith,237.4,0.529,0.364,2007ø