The Kay Razzle Extravaganza Presents...The Fingerbang Legshake,A Thin Line Between Man And Machine,Misericordiam,237.0,0.601,0.392,2007ø
Social Jihad And Genocide. The Only Certainty In An Uncertain World With No Promise Of Tomorrow,A Thin Line Between Man And Machine,Misericordiam,112.6,0.601,0.392,2007ø
Sha Sha In Her Boomboxx. Mhmm Tastes Like Pussy,A Thin Line Between Man And Machine,Misericordiam,152.7,0.601,0.392,2007ø
Obsessive Compulsive. The Act Of Fornication Compulsive,A Thin Line Between Man And Machine,Misericordiam,145.7,0.601,0.392,2007ø
Indie Girl. Admiration For The Girl Without A Face,A Thin Line Between Man And Machine,Misericordiam,162.3,0.601,0.392,2007ø
Hefty Bag Disposal. The Promise Ring,A Thin Line Between Man And Machine,Misericordiam,259.8,0.601,0.392,2007ø
Cum Sucking Whore. Cold Stone Wins,A Thin Line Between Man And Machine,Misericordiam,269.3,0.601,0.392,2007ø