We Feel The Songs (album version),Moonlight Survived,Moments In Grace,204.1,0.56,0.375,2004ø
The Silencing Truth (EP Version),These Days Will Fade,Moments In Grace,215.8,0.56,0.375,2004ø
The Patient (album version),Moonlight Survived,Moments In Grace,188.6,0.56,0.375,2004ø
The Past (album version),Moonlight Survived,Moments In Grace,271.3,0.56,0.375,2004ø
The Blurring Lines Of Loss (album version),Moonlight Survived,Moments In Grace,212.5,0.56,0.375,2004ø
Stratus (EP Version),These Days Will Fade,Moments In Grace,254.4,0.56,0.375,2004ø
No Angels (album version),Moonlight Survived,Moments In Grace,225.7,0.56,0.375,2004ø
My Stunning Bride (album version),Moonlight Survived,Moments In Grace,238.7,0.56,0.375,2004ø
My Dying Day (Album Version),Moonlight Survived,Moments In Grace,166.4,0.56,0.375,2004ø
Monologue (album version),Moonlight Survived,Moments In Grace,228.3,0.56,0.375,2004ø
Freedom (Album Version),Moonlight Survived,Moments In Grace,234.9,0.56,0.375,2004ø
Don't Leave (album version),Moonlight Survived,Moments In Grace,280.0,0.56,0.375,2004ø
Distant And Longing Light (album version),Moonlight Survived,Moments In Grace,276.0,0.56,0.375,2004ø
Curtain Call (EP Version),These Days Will Fade,Moments In Grace,208.7,0.56,0.375,2004ø
Broken Promises (EP Version),These Days Will Fade,Moments In Grace,198.5,0.56,0.375,2004ø
Broken Promises (album version),Moonlight Survived,Moments In Grace,195.9,0.56,0.375,2004ø