Will There Be Music?,Mount Pleasure,Moneybrother,195.4,0.656,0.379,2007ø
What's The Use In Trying,To Die Alone,Moneybrother,220.3,0.656,0.379,2005ø
Under bordet (Off The Record),Pengabrorsan,Moneybrother,169.0,0.656,0.379,2006ø
They're Building Walls Around Us (SpCnka NKPG remix),They're Building Walls Around Us,Moneybrother,431.8,0.656,0.379,2005ø
Stormy Weather,Blood Panic,Moneybrother,205.0,0.656,0.379,2003ø
Reconsider Me,Blood Panic,Moneybrother,214.5,0.656,0.379,2003ø
Positive Vibrations,Blood Panic,Moneybrother,251.4,0.656,0.379,2003ø
No_ Damn! I Don't Love You,Mount Pleasure,Moneybrother,224.1,0.656,0.379,2007ø
My 'Lil Girl's Straight From Heaven,To Die Alone,Moneybrother,143.4,0.656,0.379,2005ø
Much Too Much,Mount Pleasure,Moneybrother,205.3,0.656,0.379,2007ø
Midnatt till sju (Working The Midnight Shift),Pengabrorsan,Moneybrother,219.6,0.656,0.379,2006ø
Keep The Hurt At Bay,Blood Panic,Moneybrother,204.9,0.656,0.379,2003ø
Just Another Summer,Mount Pleasure,Moneybrother,175.3,0.656,0.379,2007ø
It's Been Hurting All The Way With You Joanna,Blood Panic,Moneybrother,262.7,0.656,0.379,2003ø
It Might As Well Be Winter All Year Long,Thunder In My Heart,Moneybrother,257.3,0.656,0.379,2002ø
It Is Time For Falling Apart,Mount Pleasure,Moneybrother,221.8,0.656,0.379,2007ø
It Ain't Gonna Work,To Die Alone,Moneybrother,254.6,0.656,0.379,2005ø
I'm Not Ready For It_ Jo,To Die Alone,Moneybrother,292.6,0.656,0.379,2005ø
I'm Losing,To Die Alone,Moneybrother,161.0,0.656,0.379,2005ø
Guess Who's Gonna Get Some Tonight,Mount Pleasure,Moneybrother,205.9,0.656,0.379,2007ø
Falling In Love (With Christmas Time),Pengabrorsan,Moneybrother,553.7,0.656,0.379,2006ø
Don't Call The Police,Blood Panic,Moneybrother,225.6,0.656,0.379,2003ø
Can't Stop,Blood Panic,Moneybrother,240.7,0.656,0.379,2003ø
Bum Fxxked (For Sure),They're Building Walls Around Us,Moneybrother,275.7,0.656,0.379,2005ø
Blow Him Back Into My Arms,To Die Alone,Moneybrother,265.0,0.656,0.379,2005ø
Any Other Heart,Mount Pleasure,Moneybrother,253.8,0.656,0.379,2007ø