West Wing,Think Too Much,My Little Pony,241.2,0.518,0.362,2008ø
The Sunshine Goodtime Song,Think Too Much,My Little Pony,247.8,0.518,0.362,2008ø
Skipping Down The Street,Think Too Much,My Little Pony,192.1,0.518,0.362,2008ø
MacGyver Blues,Think Too Much,My Little Pony,196.2,0.509,0.362,2007ø
I Don't Know (Part 2),Think Too Much,My Little Pony,156.8,0.518,0.362,2008ø
I Don't Know (Part 1),Think Too Much,My Little Pony,208.1,0.518,0.362,2008ø
Do You Really Love Me Or Am I Just In Your Network?,Think Too Much,My Little Pony,174.8,0.518,0.362,2008ø
Comic Relief,Think Too Much,My Little Pony,218.5,0.518,0.362,2008ø
A Song For You On Your 40th Birthday,Think Too Much,My Little Pony,161.1,0.518,0.362,2008ø