Wayfaring Stranger,The Tigers Have Spoken,Neko Case,196.4,0.754,0.511,2004ø
Tightly (Cd),Blacklisted,Neko Case,136.4,0.754,0.511,2002ø
This Tornado Loves You,Middle Cyclone,Neko Case,199.2,0.754,0.511,2009ø
This Little Light,The Tigers Have Spoken,Neko Case,180.6,0.754,0.511,2004ø
Things That Scare Me (Cd),Blacklisted,Neko Case,150.3,0.754,0.511,2002ø
The Train From Kansas City,The Tigers Have Spoken,Neko Case,205.2,0.754,0.511,2004ø
The Tigers Intro (Spoken Word),The Tigers Have Spoken,Neko Case,67.1,0.754,0.511,2004ø
The Tigers Have Spoken,The Tigers Have Spoken,Neko Case,161.8,0.754,0.511,2004ø
The Pharoahs,Middle Cyclone,Neko Case,213.0,0.754,0.511,2009ø
"The Next Time You Say ""Forever",Middle Cyclone,Neko Case,104.5,0.754,0.511,2009ø
Stinging Velvet (Cd),Blacklisted,Neko Case,175.8,0.754,0.511,2002ø
Runnin' Out Of Fools (Cd),Blacklisted,Neko Case,185.9,0.754,0.511,2002ø
Red Tide,Middle Cyclone,Neko Case,156.5,0.754,0.511,2009ø
Rated X,The Tigers Have Spoken,Neko Case,169.6,0.754,0.511,2004ø
Prison Girls,Middle Cyclone,Neko Case,323.5,0.754,0.511,2009ø
Polar Nettles,Middle Cyclone,Neko Case,144.5,0.754,0.511,2009ø
People Got A Lotta Nerve,Middle Cyclone,Neko Case,151.0,0.754,0.511,2009ø
Outro With Bees (Reprise) (Cd),Blacklisted,Neko Case,144.8,0.754,0.511,2002ø
Middle Cyclone,Middle Cyclone,Neko Case,185.9,0.754,0.511,2009ø
Magpie To The Morning,Middle Cyclone,Neko Case,164.0,0.754,0.511,2009ø
Loretta,The Tigers Have Spoken,Neko Case,129.1,0.754,0.511,2004ø
Look For Me (I'll Be Around) (Cd),Blacklisted,Neko Case,201.1,0.754,0.511,2002ø
Lady Pilot (Cd),Blacklisted,Neko Case,146.7,0.754,0.511,2002ø
If You Knew,The Tigers Have Spoken,Neko Case,150.6,0.754,0.511,2004ø
Hold On_ Hold On,Fox Confessor Brings The Flood,Neko Case,166.6,0.754,0.511,2006ø
Hex,The Tigers Have Spoken,Neko Case,299.9,0.754,0.511,2004ø
Fox Confessor Brings The Flood (Album Version),Fox Confessor Brings The Flood,Neko Case,162.4,0.754,0.511,2006ø
Fox Confessor Brings The Flood,Fox Confessor Brings The Flood,Neko Case,162.5,0.754,0.511,2006ø
Favorite,The Tigers Have Spoken,Neko Case,216.7,0.754,0.511,2001ø
Dirty Knife,Fox Confessor Brings The Flood,Neko Case,198.8,0.754,0.511,2006ø
Deep Red Bells (Cd),Blacklisted,Neko Case,243.7,0.754,0.511,2002ø
Blacklisted (Cd),Blacklisted,Neko Case,142.3,0.754,0.511,2002ø
Blacklisted,The Tigers Have Spoken,Neko Case,131.8,0.754,0.511,2002ø
A Widow's Toast,Fox Confessor Brings The Flood,Neko Case,96.7,0.754,0.511,2006ø