We Were Meant For Ruin (Album Version),The Faithless,Nights Like These,121.6,0.629,0.347,2006ø
Veteran Theives (Album Versions),Sunlight At Secondhand,Nights Like These,128.2,0.629,0.347,2007ø
Symphony For The Plague (Album Version),The Faithless,Nights Like These,76.5,0.629,0.347,2006ø
Scavenger's Daughter (Album Version),The Faithless,Nights Like These,190.4,0.629,0.347,2006ø
Memento Mori (Album Version),The Faithless,Nights Like These,80.7,0.629,0.347,2006ø
Let The Waters Overtake Us (Album Version),The Faithless,Nights Like These,186.2,0.629,0.347,2006ø
Empty Lungs (Album Version),Sunlight At Secondhand,Nights Like These,236.9,0.629,0.347,2007ø
Bury The Messenger (Album Version),The Faithless,Nights Like These,112.5,0.629,0.347,2006ø
Storming Valhalla (Album Version),The Faithless,Nights Like These,124.4,0.629,0.311,2006ø
Samsara (Album Version),Sunlight At Secondhand,Nights Like These,244.8,0.629,0.311,2007ø
King (Album Version),Sunlight At Secondhand,Nights Like These,284.5,0.629,0.311,2007ø
Heart Of The Wound (Album Version),Sunlight At Secondhand,Nights Like These,232.0,0.629,0.311,2007ø
Head Of Medusa (Album Version),The Faithless,Nights Like These,170.7,0.629,0.311,2006ø
Ghost Town Rituals (Album Version),The Faithless,Nights Like These,305.9,0.629,0.311,2006ø
Eternal Tempest (Album Version),The Faithless,Nights Like These,140.9,0.629,0.311,2006ø
Electric Winds (Album Version),Sunlight At Secondhand,Nights Like These,298.7,0.629,0.311,2007ø
Destroy The Stairs (Album Version),The Faithless,Nights Like These,91.8,0.629,0.311,2006ø
Collective Unconscious (Album Version),Sunlight At Secondhand,Nights Like These,248.1,0.629,0.311,2007ø
Claw Your Way Out (Album Version),Sunlight At Secondhand,Nights Like These,305.9,0.629,0.311,2007ø
Black The Sun (Album Version),Sunlight At Secondhand,Nights Like These,227.8,0.629,0.311,2007ø
Bay Of Pigs (Album Version,Sunlight At Secondhand,Nights Like These,284.2,0.629,0.311,2007ø