Take It Easy My Brother Charles,O Rappa,O Rappa,246.7,0.614,0.433,1994ø
R.A.M.,O Rappa,O Rappa,256.8,0.614,0.433,1994ø
Mitologia Gerimum,O Rappa,O Rappa,255.8,0.614,0.433,1994ø
Lado B Lado A,Elite Squad,O Rappa,307.9,0.614,0.433,2001ø
Favela,Lado B Lado A,O Rappa,201.2,0.614,0.433,1999ø
Eu Quero Ver Gol,Play Brazil - Exterior,O Rappa,221.4,0.614,0.433,1996ø
Catequeses Do Medo,O Rappa,O Rappa,237.0,0.614,0.433,1994ø
Brixton_ Bronx Ou Baixada,O Rappa,O Rappa,286.1,0.614,0.433,1994ø
A Todas As Comunidades Do Engenho Novo,Lado B Lado A,O Rappa,378.2,0.614,0.433,1999ø