Satellite (Radio Edit) (Radio Edit),Satellite,OceanLab,198.2,0.557,0.552,2004ø
Satellite (Poison Pro Remix) (Poison Pro Remix),Satellite,OceanLab,408.4,0.557,0.552,2004ø
Satellite (Paul Brekeman Remix) (Paul Brekeman Remix),Satellite,OceanLab,465.1,0.557,0.552,2004ø
Satellite (Floris de Haan Mix) (Floris de Haan Mix),Satellite,OceanLab,271.7,0.557,0.552,2004ø
Satellite (Flipside Vocal Mix) (Flipside Vocal Mix),Satellite,OceanLab,327.8,0.557,0.552,2004ø
Satellite (Filo & Peri Remix) (Filo & Peri Remix),Satellite,OceanLab,516.6,0.557,0.552,2004ø
Satellite (Devotion Remix) (Devotion Remix),Satellite,OceanLab,441.3,0.557,0.552,2004ø
Satellite (Boldt & Steinweg Remix) (Boldt & Steinweg Remix),Satellite,OceanLab,456.2,0.557,0.552,2004ø
Satellite (Blue Pace Remix) (Blue Pace Remix),Satellite,OceanLab,505.1,0.557,0.552,2004ø
Satellite (Andreas Reuterberg Remix) (Andrewas Reuterberg Remix),Satellite,OceanLab,588.3,0.557,0.552,2004ø
Satellite (Above & Beyond Progressive Remix) (Above & Beyond Progressive Remix),Satellite,OceanLab,475.3,0.557,0.552,2004ø
Satellite (3 Colours Mix) (3 Colours Mix),Satellite,OceanLab,580.0,0.557,0.552,2004ø
Satellite,Armada The Best Of_ Vol. 1,OceanLab,195.1,0.557,0.552,2004ø
On A Good Day,Trance Nation Mixed by Above & Beyond,OceanLab,469.6,0.557,0.552,2008ø
Miracle,Ibiza Annual 2008,OceanLab,501.2,0.557,0.552,2008ø
Beautiful Together,Cream 1992-2008,OceanLab,426.2,0.557,0.552,2003ø