Wer die Heimat net liebt,Volksmusik-Party Original Naabtal Duo,Original Naabtal Duo,190.8,0.409,0.386,2007ø
Wennst immer an den Herrgott glaubst,Top 101 Glaube Liebe Hoffnung Vol. 3,Original Naabtal Duo,191.9,0.409,0.386,2007ø
Venedig ist ein Katzensprung,Mutti ist die Beste,Original Naabtal Duo,200.1,0.409,0.386,1993ø
Morgen ist Heute schon gestern,Das Beste vom Original Naabtal Duo,Original Naabtal Duo,200.0,0.409,0.386,2007ø
In unserer Hand liegt unsere Erde,Das Beste vom Original Naabtal Duo,Original Naabtal Duo,195.1,0.409,0.386,2007ø
In dem Dorf war ich einmal daheim,Das Beste vom Original Naabtal Duo,Original Naabtal Duo,164.0,0.409,0.386,2007ø
Denn es gibt viel zwischen Himmel und Erde,Top 101 Glaube Liebe Hoffnung Vol. 3,Original Naabtal Duo,247.1,0.409,0.386,2007ø
Abendfrieden,Top45 - Zauber der Berge,Original Naabtal Duo,202.8,0.409,0.386,2007ø