Hold That Sucker Down (Shocker Radio Edit),Hold That Sucker Down,OT Quartet,219.6,0.451,0.3,1994ø
Hold That Sucker Down (Radio Edit),Hold That Sucker Down,OT Quartet,220.3,0.451,0.3,1994ø
Hold That Sucker Down (Lifelike & Kris Menace Mix),Hold That Sucker Down,OT Quartet,354.2,0.451,0.3,1994ø
Hold That Sucker Down (Dual's Bass-Rok Club Mix),Hold That Sucker Down,OT Quartet,424.1,0.451,0.3,1994ø
Hold That Sucker Down (DJ Capella),Hold That Sucker Down,OT Quartet,78.3,0.451,0.3,2000ø
Hold That Sucker Down (Brutal Mix),Hold That Sucker Down,OT Quartet,364.6,0.451,0.3,1994ø