We Gon' Make It  Featuring Jack Knight (Explicit Album Version),Press Play,P. Diddy,213.5,0.683,0.51,2006ø
Wanna Move Featuring Big Boi_ Ciara & Scar (Explicit Album Version),Press Play,P. Diddy,318.4,0.837,0.51,2006ø
Through The Pain (She Told Me) Featuring Mario Winans (Explicit Album Version),Press Play,P. Diddy,328.9,0.837,0.51,2006ø
Thought You Said Featuring Brandy (Explicit Album Version),Press Play,P. Diddy,349.0,0.837,0.51,2006ø
The Future (Explicit Album Version),Press Play,P. Diddy,191.9,0.837,0.51,2006ø
Testimonial (Intro) (Explicit Album Version),Press Play,P. Diddy,144.3,0.837,0.51,2006ø
Tell Me Featuring Christina Aguilera (Explicit Album Version),Press Play,P. Diddy,246.2,0.837,0.51,2006ø
Special Feeling Featuring Mika Lett (Explicit Album Version),Press Play,P. Diddy,265.4,0.837,0.51,2006ø
Partners For Life Featuring Jamie Foxx (Explicit Album Version),Press Play,P. Diddy,271.8,0.837,0.51,2006ø
P. Diddy Rock Featuring Timbaland_ Twista & Shawnna (Explicit Album Version),Press Play,P. Diddy,312.8,0.837,0.51,2006ø
Making It Hard Featuring Mary J. Blige (Amended Album Version),Press Play,P. Diddy,294.3,0.683,0.51,2006ø
Last Night Featuring Keyshia Cole (Amended Album Version),Press Play,P. Diddy,386.1,0.683,0.51,2006ø
I Am (Interlude) (Explicit Album Version),Press Play,P. Diddy,106.7,0.837,0.51,2006ø
Hold Up Featuring Angela Hunte (Explicit Album Version),Press Play,P. Diddy,209.4,0.837,0.51,2006ø
Crazy Thang (Interlude) Featuring S. Rosete (Explicit Album Version),Press Play,P. Diddy,75.3,0.837,0.51,2006ø
Come To Me (Featuring Nicole Scherzinger) (Explicit Version),Come To Me,P. Diddy,272.2,0.837,0.51,2006ø
Claim My Place Featuring Avant (Interlude) (Explicit Album Version),Press Play,P. Diddy,205.0,0.683,0.51,2006ø
Been Around The World (Remix),Come To Me,P. Diddy,326.9,0.683,0.51,2006ø
Been Around The World  (Remix Instrumental),Come To Me,P. Diddy,330.8,0.683,0.51,2006ø
After Love Featuring Keri (Explicit Album Version),Press Play,P. Diddy,287.2,0.837,0.51,2006ø