Time To Dance (Album Version),A Fever You Can't Sweat Out,Panic! At The Disco,202.0,0.842,0.605,2005ø
This Is Halloween,Nightmare Before Christmas,Panic! At The Disco,216.8,0.842,0.605,2006ø
There's A Good Reason These Tables Are Numbered Honey_ You Just Haven't Thought Of It Yet (Album Version),A Fever You Can't Sweat Out,Panic! At The Disco,196.6,0.842,0.605,2005ø
The Only Difference Between Martyrdom and Suicide Is Press Coverage (Tommie Sunshine Brooklyn Fire Remix),Snakes On A Plane [OST],Panic! At The Disco,215.9,0.842,0.605,2006ø
The Only Difference Between Martyrdom and Suicide Is Press Coverage (Album Version),A Fever You Can't Sweat Out,Panic! At The Disco,177.0,0.842,0.605,2005ø
Nine In the Afternoon,Heroes - Original Soundtrack,Panic! At The Disco,194.7,0.842,0.605,2008ø
Nails For Breakfast_ Tacks For Snacks (demo) (unreleased),I Write Sins Not Tragedies,Panic! At The Disco,233.6,0.842,0.605,2006ø
Nails For Breakfast_ Tacks For Snacks (Album Version),A Fever You Can't Sweat Out,Panic! At The Disco,203.8,0.842,0.605,2005ø
Lying Is The Most Fun A Girl Can Have Without Taking Her Clothes Off (Album Version),A Fever You Can't Sweat Out,Panic! At The Disco,200.2,0.842,0.605,2005ø
London Beckoned Songs About Money Written By Machines (Album Version),A Fever You Can't Sweat Out,Panic! At The Disco,203.6,0.842,0.605,2005ø
Introduction (Album Version),A Fever You Can't Sweat Out,Panic! At The Disco,37.0,0.842,0.605,2005ø
Intermission (Album Version),A Fever You Can't Sweat Out,Panic! At The Disco,155.5,0.842,0.605,2005ø
I Write Sins Not Tragedies (MTV VMA Performance 2006),I Write Sins Not Tragedies,Panic! At The Disco,212.3,0.842,0.605,2006ø
I Write Sins Not Tragedies (Album Version),I Write Sins Not Tragedies,Panic! At The Disco,186.6,0.842,0.605,2006ø
I Write Sins Not Tragedies (91X Acoustic Version),But It's Better If You Do,Panic! At The Disco,188.4,0.842,0.605,2006ø
I Constantly Thank God For Esteban (Album Version),A Fever You Can't Sweat Out,Panic! At The Disco,210.3,0.842,0.605,2005ø
Camisado (Album Version),A Fever You Can't Sweat Out,Panic! At The Disco,191.9,0.842,0.605,2005ø
But It's Better If You Do (Album Version),A Fever You Can't Sweat Out,Panic! At The Disco,205.7,0.842,0.605,2005ø