Turn You On [Claude Le Gache Le Club Edit],Paris,Paris Hilton,218.3,0.711,0.563,2006ø
Turn You On (Album Version),Paris,Paris Hilton,186.9,0.711,0.563,2006ø
Turn It Up (Peter Rauhofer Turns It Up Edit),Turn It Up,Paris Hilton,298.3,0.711,0.563,2006ø
Turn It Up (Peter Rauhofer Does Paris Edit),Turn It Up,Paris Hilton,297.4,0.711,0.563,2006ø
Turn It Up (DJ Dan's Hot 2 Trot Edit),Turn It Up,Paris Hilton,219.2,0.711,0.563,2006ø
Turn It Up (DJ Dan's Hot 2 Trot Dub Edit),Turn It Up,Paris Hilton,287.9,0.711,0.563,2006ø
Turn It Up (Album Version),Turn It Up,Paris Hilton,194.3,0.711,0.563,2006ø
Stars Are Blind (Tracy Does Paris Radio Remix),Stars Are Blind,Paris Hilton,214.4,0.711,0.563,2006ø
Stars Are Blind (Tracy Does Paris Dub) (Edit),Stars Are Blind,Paris Hilton,298.8,0.711,0.563,2006ø
Stars Are Blind (Tracy Does Paris Club Mix),Stars Are Blind,Paris Hilton,550.3,0.711,0.563,2006ø
Stars Are Blind (The Scumfrog's Extreme Makeover),Stars Are Blind,Paris Hilton,540.6,0.711,0.563,2006ø
Stars Are Blind (Luny Tunes Remix featuring Wisin and Yandel),Stars Are Blind,Paris Hilton,256.9,0.711,0.563,2006ø
Stars Are Blind (Chus & Ceballos Stereo Remix),Stars Are Blind,Paris Hilton,491.5,0.711,0.563,2006ø
Stars Are Blind (Album Version),Stars Are Blind,Paris Hilton,238.6,0.711,0.563,2006ø
Screwed (Album Version),Paris,Paris Hilton,221.4,0.711,0.563,2006ø
Nothing In This World [Kaskade Remix],Nothing In This World,Paris Hilton,418.3,0.711,0.563,2006ø
Nothing In This World [Kaskade Radio Remix],Nothing In This World,Paris Hilton,211.3,0.711,0.563,2006ø
Nothing In This World [Jason Nevins Radio Remix],Nothing In This World,Paris Hilton,193.6,0.711,0.563,2006ø
Nothing In This World [Exacta Remix Edit],Nothing In This World,Paris Hilton,297.8,0.711,0.563,2006ø
Nothing In This World (Album Version),Paris,Paris Hilton,192.7,0.765,0.563,2006ø
Not Leaving Without You (Album Version),Paris,Paris Hilton,215.3,0.711,0.563,2006ø
Jealousy (Album Version),Paris,Paris Hilton,220.1,0.711,0.563,2006ø
I Want You (Album Version),Paris,Paris Hilton,192.3,0.711,0.563,2006ø
Heartbeat (Album Version),Paris,Paris Hilton,223.5,0.711,0.563,2006ø
Fightin' Over Me [featuring Fat Joe & Jadakiss] (Album Version),Paris,Paris Hilton,241.1,0.711,0.563,2006ø
Do Ya Think I'm Sexy (Album Version),Paris,Paris Hilton,274.1,0.711,0.563,2006ø