Take Me Nowhere,Phyllis Nelson - Move Closer,Phyllis Nelson,220.8,0.492,0.313,1984ø
Stop Don't Do This To Me,"All of Phyllis Nelson (including ""I Like You"")",Phyllis Nelson,207.0,0.492,0.313,1984ø
Somewhere In The City,Phyllis Nelson - Move Closer,Phyllis Nelson,296.1,0.492,0.313,1984ø
Never Love A Rock Star,"All of Phyllis Nelson (including ""I Like You"")",Phyllis Nelson,198.3,0.492,0.313,1984ø
Move Closer,Soul In Love - 35 Essential Love Songs,Phyllis Nelson,277.5,0.492,0.313,1984ø
In A Cadillac,"All of Phyllis Nelson (including ""I Like You"")",Phyllis Nelson,211.5,0.492,0.313,1984ø
I Like You,Disco Discharge. Disco Ladies.,Phyllis Nelson,440.8,0.492,0.313,1990ø
Heartbeat To Heartbeat,Closer,Phyllis Nelson,212.9,0.492,0.313,1984ø
Happy To See You,Phyllis Nelson - Move Closer,Phyllis Nelson,248.7,0.492,0.313,1984ø