Hotride,Always Outnumbered_ Never Outgunned,Prodigy,276.2,0.639,0.603,2004ø
Girls,Always Outnumbered_ Never Outgunned,Prodigy,247.2,0.824,0.603,2004ø
Fire (Sunrise Version),Fire (Edit),Prodigy,301.9,0.639,0.603,1992ø
The Trick,Breathe,Prodigy,265.9,0.639,0.601,1996ø
Smack My Bitch Up (dj Hype Remix),Smack My Bitch Up,Prodigy,443.8,0.639,0.601,1997ø
One Love (Jonny L Remix),One Love,Prodigy,301.8,0.639,0.601,1993ø
No Man Army Feat. Tom Morello,Smack My Bitch Up,Prodigy,286.6,0.639,0.601,1997ø
Mindfields (headrock Dub),Smack My Bitch Up,Prodigy,276.3,0.639,0.601,1997ø
Full Throttle (Original Mix),One Love,Prodigy,332.6,0.639,0.601,1993ø
Everybody In The Place (Fairground Remix),The First Chapters,Prodigy,308.8,0.639,0.601,1991ø
Breathe,Cream 1992-2008,Prodigy,335.9,0.639,0.601,1996ø