Walking On Water,As You May Know,Questions In Dialect,396.6,0.499,0.261,2004ø
They Rose Up In The Twilight,As You May Know,Questions In Dialect,405.6,0.499,0.261,2004ø
The Possibilities Of Right Now,As You May Know,Questions In Dialect,198.9,0.499,0.261,2004ø
The God Of Green Hope,As You May Know,Questions In Dialect,520.2,0.499,0.261,2004ø
Supplemental / Inflatable / Restraint,As You May Know,Questions In Dialect,439.1,0.499,0.261,2004ø
Roll The Credits,As You May Know,Questions In Dialect,387.3,0.499,0.261,2004ø
Resurrection Of The Dead,As You May Know,Questions In Dialect,353.6,0.499,0.261,2004ø
Paper Tigers,As You May Know,Questions In Dialect,441.4,0.499,0.261,2004ø
On This Hand,The Ghost Wishes To Speak To You CD EP,Questions In Dialect,218.9,0.499,0.261,2007ø