Till There Was You (Stereofunk Remix),Till There Was You,Rachael Starr,472.2,0.614,0.428,2005ø
Till There Was You (Reflekt Remix),Hi-Bias: Club Sessions 2,Rachael Starr,485.7,0.614,0.428,2005ø
Till There Was You (Radio Edit),Positiva Presents.....Track Record Vol. 4,Rachael Starr,187.8,0.614,0.428,2005ø
Till There Was You (Pocket & Goodwill Remix),Hi-Bias: Club Life 3,Rachael Starr,484.2,0.614,0.428,2005ø
Till There Was You (Original Club Mix),Till There Was You,Rachael Starr,385.3,0.133,0.428,2005ø
Till There Was You (Gabriel & Dresden Mix),A Trip In Trance 4,Rachael Starr,402.1,0.614,0.428,2005ø
Till There Was You (Gabriel & Dresden Club Mix),Till There Was You,Rachael Starr,524.3,0.614,0.428,2005ø
Till There Was You (Dan Sir & Das S Remix),The Annual Spring 1,Rachael Starr,245.7,0.614,0.428,2006ø
Till there was you,David vendetta in paradise ibiza,Rachael Starr,209.9,0.614,0.428,2005ø