State Of Alert (Edit),State Of Alert,Radio 4,207.8,0.628,0.466,2004ø
Start A Fire (Justin Robertson's Revtone Vocal Mix),Electrify,Radio 4,420.7,0.628,0.466,2004ø
Start A Fire,Gotham,Radio 4,213.3,0.628,0.466,2002ø
Speaking In Codes,Gotham!,Radio 4,254.1,0.628,0.466,2002ø
Sink So Low,Electrify,Radio 4,163.6,0.628,0.466,2001ø
Red Lights,Gotham!,Radio 4,188.1,0.628,0.466,2002ø
No Reaction,Stealing Of A Nation,Radio 4,387.1,0.628,0.466,2004ø
New Motive,The New Song and Dance,Radio 4,186.3,0.628,0.466,2000ø
New Disco,Gotham,Radio 4,169.4,0.628,0.466,2002ø
Fra Type I And II,Stealing Of A Nation,Radio 4,188.8,0.628,0.466,2004ø
Enemies Like This,Enemies Like This,Radio 4,261.5,0.628,0.466,2006ø
Dance To The Underground (Prance Mix By The Faint),Electrify,Radio 4,285.6,0.628,0.466,2003ø
Buy And Sell,The New Song and Dance,Radio 4,215.0,0.628,0.466,2000ø
Beautiful Ride,The New Song and Dance,Radio 4,176.3,0.628,0.466,2000ø
Walls Falling,The New Song and Dance,Radio 4,177.9,0.628,0.376,2000ø
This Is Not A Test,Enemies Like This,Radio 4,298.5,0.628,0.376,2006ø
The Movies,Gotham!,Radio 4,243.9,0.628,0.376,2002ø
Take Anything,Packing Things Up On The Scene,Radio 4,197.6,0.628,0.376,2006ø
Struggle (Adrian Sherwood / Mark Stewart Mutant Disco Dub Mix),Electrify,Radio 4,180.7,0.628,0.376,2003ø
Struggle,State Of Alert,Radio 4,191.3,0.628,0.376,2002ø
State Of Alert,Stealing Of A Nation,Radio 4,267.7,0.628,0.376,2004ø
Start A Fire (Swain And Snell Mix),Electrify,Radio 4,519.2,0.628,0.376,2003ø
Save Your City,Gotham,Radio 4,187.8,0.628,0.376,2002ø
Rise Up,Party Crashers,Radio 4,208.2,0.628,0.376,2004ø
Pretty Good Lie,Packing Things Up On The Scene,Radio 4,286.3,0.628,0.376,2006ø
Pipe Bombs,State Of Alert,Radio 4,273.5,0.628,0.376,2002ø
Party Crashers) (Ashley Beedles N.Y. After Dark Vocal Mix),Party Crashers,Radio 4,511.4,0.628,0.376,2004ø
Party Crashers (Headman Dub Mix),Party Crashers,Radio 4,356.6,0.628,0.376,2004ø
Party Crashers,Stealing Of A Nation,Radio 4,298.6,0.628,0.376,2004ø
Packing Things Up On The Scene (The Loving Hand remix),Packing Things Up On The Scene (The Loving Hand Remixes),Radio 4,554.4,0.628,0.376,2006ø
Packing Things Up On The Scene (Edit),Packing Things Up On The Scene,Radio 4,226.9,0.628,0.376,2006ø
Nation (Black Ark Dub),Transmisson,Radio 4,355.3,0.628,0.376,2004ø
Get Set to Fall Out,The New Song and Dance,Radio 4,142.7,0.628,0.376,2000ø
Enemies Like This (The Culture Cheat Mix),Enemies Like This,Radio 4,312.9,0.628,0.376,2006ø
Enemies Like This (IDC Remix),Enemies Like This Remixes,Radio 4,270.7,0.628,0.376,2006ø
Enemies Like This (Hot Chip Remix),Enemies Like This Remixes,Radio 4,448.0,0.628,0.376,2006ø
Enemies Like This (Edit),Enemies Like This,Radio 4,241.9,0.628,0.376,2006ø
End Of The Rope,Gotham,Radio 4,184.1,0.628,0.376,2002ø
Dance To The Underground (The Good Ginger Remix),Dance To The Underground,Radio 4,315.9,0.628,0.376,2001ø
Dance To The Underground (Playgroup Mix),Electrify,Radio 4,408.4,0.628,0.376,2003ø
Dance To The Underground (Dfa Version),Electrify,Radio 4,541.1,0.628,0.376,2003ø
Dance To The Underground,Gotham,Radio 4,292.3,0.628,0.376,2001ø
Certain Tragedy,Gotham,Radio 4,209.9,0.628,0.376,2002ø
Boy Meets Girl,The New Song and Dance,Radio 4,195.0,0.628,0.376,2000ø
Absolute Affirmation,Stealing Of A Nation,Radio 4,211.4,0.628,0.376,2004ø
(No More Room For) Communication,The New Song and Dance,Radio 4,174.9,0.628,0.376,2000ø
(Give Me All Of Your) Money,Stealing Of A Nation,Radio 4,228.8,0.628,0.376,2004ø