What You Have Done,Coming Home,Ras Shiloh,274.3,0.541,0.403,2007ø
We Need More Love,Coming Home,Ras Shiloh,246.9,0.541,0.403,2007ø
Waste My time,Coming Home,Ras Shiloh,227.9,0.541,0.403,2007ø
Volume Of The Book,Coming Home,Ras Shiloh,232.0,0.541,0.403,2007ø
Voice Of The People,Coming Home,Ras Shiloh,240.5,0.541,0.403,2007ø
Unto Zion,Morgan Heritage Family & Friends Volume . 1,Ras Shiloh,198.7,0.541,0.403,1998ø
The New Rising Day Feat. Bascom X,Coming Home,Ras Shiloh,231.9,0.541,0.403,2007ø
Rebel With A Cause,Coming Home,Ras Shiloh,226.8,0.541,0.403,2007ø
Let The People Voice Be Heard Feat. Morgan Heritage,Coming Home,Ras Shiloh,224.9,0.541,0.403,2007ø
It Will Be Over Feat. Natural Black,Coming Home,Ras Shiloh,261.6,0.36,0.403,2007ø
Give A Little Love,Coming Home,Ras Shiloh,212.2,0.541,0.403,2007ø
Come Down Jah Jah,Coming Home,Ras Shiloh,249.0,0.541,0.403,2007ø
Are You Lonely,Coming Home,Ras Shiloh,218.7,0.541,0.403,2007ø
All What Ah Go On,Coming Home,Ras Shiloh,239.5,0.541,0.403,2007ø
All Of Me,Coming Home,Ras Shiloh,241.1,0.541,0.403,2007ø
Lion Of Judah,Final Blessing,Ras Shiloh,233.2,0.541,0.378,2004ø