Where You Are,Feels Like Today,Rascal Flatts,232.5,0.865,0.777,2004ø
When The Sand Runs Out,Feels Like Today,Rascal Flatts,226.4,0.865,0.777,2004ø
Then I Did,Feels Like Today,Rascal Flatts,192.2,0.865,0.777,2004ø
The Day Before You,Feels Like Today,Rascal Flatts,245.9,0.865,0.777,2004ø
Oklahoma-Texas Line,Feels Like Today,Rascal Flatts,173.5,0.865,0.777,2004ø
Life Is A Highway,The Magic Of Disney,Rascal Flatts,276.6,0.865,0.777,2006ø
Holes,Feels Like Today,Rascal Flatts,257.4,0.865,0.777,2004ø
Feels Like Today,Feels Like Today,Rascal Flatts,200.5,0.82,0.777,2004ø
Fast Cars And Freedom,Feels Like Today,Rascal Flatts,261.7,0.82,0.777,2004ø
Bless The Broken Road,Hannah Montana The Movie,Rascal Flatts,235.0,0.865,0.777,2004ø
Backwards,Hannah Montana The Movie,Rascal Flatts,203.4,0.865,0.777,2006ø