Why I Otta,Hiatus On The Horizon,Recloose,438.3,0.718,0.359,2005ø
Walk In Turquoise,Maui's Lament,Recloose,497.1,0.718,0.359,2008ø
Turkish Delight,Hiatus On The Horizon,Recloose,353.4,0.718,0.359,2005ø
The Sanctuary feat Tyna,Perfect Timing,Recloose,377.9,0.718,0.359,2008ø
Solomon's Alive,Perfect Timing,Recloose,368.2,0.718,0.359,2008ø
So Cool feat. Tyna,Perfect Timing,Recloose,296.2,0.718,0.359,2008ø
Robop,Perfect Timing,Recloose,258.4,0.718,0.359,2008ø
Red Road feat. Justin Chapmanand Genevieve Marentette,Perfect Timing,Recloose,346.5,0.718,0.359,2008ø
Maui's Lament,Maui's Lament,Recloose,405.1,0.718,0.359,2008ø
Mana's Bounce,Hiatus On The Horizon,Recloose,333.4,0.718,0.359,2005ø
Makutu Man,Hiatus On The Horizon,Recloose,353.9,0.718,0.359,2005ø
Emotional Funk feat. Tyna,Perfect Timing,Recloose,241.5,0.718,0.359,2008ø
Dust (Main mix),Dust Remix,Recloose,429.3,0.718,0.359,2005ø
Deeper Waters feat. Joe Dukie,Perfect Timing,Recloose,346.1,0.718,0.359,2008ø
Daydream feat. Rachel Fraser and Jonathan Crayford,Perfect Timing,Recloose,220.3,0.718,0.359,2008ø
Catch A Leaf feat. Rachel Fraser,Perfect Timing,Recloose,188.1,0.718,0.359,2008ø
Can It Be feat. Justin Chapman and Genevieve Marentette,Perfect Timing,Recloose,277.3,0.718,0.359,2008ø