You Used To Hold Me So Tight featuring Angela Johnson,Second Guess,Reel People,324.9,0.516,0.383,2003ø
The Light featuring Vanessa Freeman [Live Version],Second Guess,Reel People,310.5,0.516,0.383,2003ø
Second Guess featuring Jag,Second Guess,Reel People,403.1,0.516,0.383,2003ø
Rise & Fly featuring Vanessa Freeman,Seven Ways To Wonder,Reel People,337.9,0.516,0.383,2007ø
Perfect Sky featuring Joy Rose,Seven Ways To Wonder,Reel People,416.3,0.333,0.383,2007ø
Outta Love featuring Omar,Seven Ways To Wonder,Reel People,305.3,0.516,0.383,2007ø
Outta Love (reprise),Seven Ways To Wonder,Reel People,121.9,0.516,0.383,2007ø
Outta Love,Seven Ways To Wonder-the Remixes (bonus Dubs &amp; Instrumentals),Reel People,383.7,0.516,0.383,2007ø
Love Is Where You Are,Seven Ways To Wonder-the Remixes (bonus Dubs &amp; Instrumentals),Reel People,328.7,0.516,0.383,2007ø
High featuring Dyanna Fearon,Seven Ways To Wonder,Reel People,226.1,0.516,0.383,2007ø
Can't Stop featuring Angela Johnson,Second Guess,Reel People,315.5,0.516,0.383,2003ø
Butterflies featuring Vanessa Freeman [Live Version],Second Guess,Reel People,330.3,0.569,0.383,2003ø
Butterflies featuring Dyanna Fearon [Restless Soul Soul Heaven Mix],Second Guess,Reel People,444.2,0.516,0.383,2003ø
Butterflies featuring Dyanna Fearon,Second Guess,Reel People,420.8,0.516,0.383,2003ø
Back 2 Base featuring Dyanna Fearon,Second Guess,Reel People,310.8,0.516,0.383,2003ø