You've Changed (Album Version),Skylark,Renee Olstead,207.2,0.663,0.482,2009ø
When I Fall In Love [featuring Chris Botti] (Album Version),Skylark,Renee Olstead,283.1,0.663,0.482,2009ø
What A Difference A Day Makes (Album Version),Renee Olstead,Renee Olstead,206.6,0.663,0.482,2004ø
Thanks For The Boogie Ride (Album Version),Skylark,Renee Olstead,181.4,0.685,0.482,2009ø
Taking A Chance On Love (Album Version),Renee Olstead,Renee Olstead,210.2,0.663,0.482,2004ø
Stars Fell On Alabama (Album Version),Skylark,Renee Olstead,195.2,0.663,0.482,2009ø
Skylark (Album Version),Skylark,Renee Olstead,252.1,0.663,0.482,2009ø
Sentimental Journey (Album Version),Renee Olstead,Renee Olstead,212.5,0.663,0.482,2004ø
Nothing But The Blame (Album Version),Skylark,Renee Olstead,251.5,0.663,0.482,2009ø
My Baby Just Cares For Me (Album Version),Skylark,Renee Olstead,183.3,0.663,0.482,2009ø
Midnight In Austin Texas [Special Guest Robert Randolph] (Album Version),Skylark,Renee Olstead,205.8,0.663,0.482,2009ø
Midnight At The Oasis (Album Version),Renee Olstead,Renee Olstead,201.4,0.663,0.482,2004ø
Meet Me_ Midnight (Album Version),Renee Olstead,Renee Olstead,175.3,0.663,0.482,2004ø
Lover Man (Album Version),Skylark,Renee Olstead,302.7,0.663,0.482,2009ø
Is You Is Or Is You Ain't My Baby (Album Version),Renee Olstead,Renee Olstead,199.8,0.663,0.482,2004ø
Hold Me Now (Album Version),Skylark,Renee Olstead,242.6,0.663,0.482,2009ø
Hit The Road Jack (Album Version),Skylark,Renee Olstead,202.7,0.663,0.482,2009ø
Breaking Up Is Hard To Do (Album Version),Renee Olstead,Renee Olstead,251.2,0.663,0.482,2004ø
Ain't We Got Fun (Album Version),Skylark,Renee Olstead,165.3,0.663,0.482,2009ø