You Don't Need a Doctor (Album Version),They Think They Are The Robocop Kraus,Robocop Kraus,215.9,0.629,0.356,2006ø
Small Houses Odd Cars (Album Version),They Think They Are The Robocop Kraus,Robocop Kraus,230.0,0.629,0.356,2006ø
Life Amazes Us Despite Our Miserable Future (Album Version),They Think They Are The Robocop Kraus,Robocop Kraus,257.5,0.629,0.356,2006ø
I Picture You (Album Version),They Think They Are The Robocop Kraus,Robocop Kraus,193.0,0.629,0.356,2006ø
Concerned_ Your Secular Friends (Album Version),They Think They Are The Robocop Kraus,Robocop Kraus,198.9,0.629,0.356,2006ø
All The Good Men (Album Version),Who Do They Think They Are?,Robocop Kraus,177.7,0.629,0.356,2005ø
After Laughter Comes Tears (Album Version),They Think They Are The Robocop Kraus,Robocop Kraus,240.0,0.629,0.356,2006ø
A Man's Not A Bird (Album Version),They Think They Are The Robocop Kraus,Robocop Kraus,273.7,0.629,0.356,2006ø