Music & You (Tom Neville Vocal Mix) (Feat. Oliver Cheatham),Music & You,Room 5 Featuring Oliver Cheatham,424.4,0.578,0.372,2003ø
Music & You (Full Intention Club Mix) (Feat. Oliver Cheatham),Music & You,Room 5 Featuring Oliver Cheatham,461.6,0.578,0.372,2003ø
Make Luv (Radio Edit) (Feat. Oliver Cheatham),Make Luv,Room 5 Featuring Oliver Cheatham,212.3,0.578,0.372,2003ø
Make Luv (Laurent Konrad Remix),Hi-Bias: Juicy Beats 1,Room 5 Featuring Oliver Cheatham,360.2,0.578,0.372,2005ø
Make Luv (Extended Mix) (Feat. Oliver Cheatham),Make Luv,Room 5 Featuring Oliver Cheatham,351.2,0.578,0.372,2003ø
Make Luv (Doublefunk Remix) (Feat. Oliver Cheatham),Make Luv,Room 5 Featuring Oliver Cheatham,371.4,0.578,0.372,2003ø
Make Luv (Axwell Remix) (Feat. Oliver Cheatham),Make Luv,Room 5 Featuring Oliver Cheatham,442.4,0.578,0.372,2003ø