The Beat Goes On (Dance Mix Feat. G. Faulkner),Best Of Ryan Paris,Ryan Paris,242.3,0.541,0.424,2006ø
Kein Zuruck (Frankfurt Mix Feat. Tatiana Schmidt),Best Of Ryan Paris,Ryan Paris,230.4,0.541,0.424,2006ø
I Wanna Love You Once Again,I Wanna Love You Once Again,Ryan Paris,213.4,0.541,0.424,2006ø
Fall In Love,Dolce Vita Vol.2,Ryan Paris,190.2,0.541,0.424,1986ø
Don't Let Me Down (Pop/Dance Mix),Best Of Ryan Paris,Ryan Paris,236.5,0.541,0.424,2006ø
Dolce Vita (Maxi Single),Best Of Ryan Paris,Ryan Paris,438.0,0.541,0.424,2006ø