Wanna Live,USA,Saint Dog,190.8,0.636,0.328,2006ø
Stand Up (Feat. Big Hoss),USA,Saint Dog,206.8,0.636,0.328,2006ø
Reaper (Feat. Chucky Styles and Big Hoss),USA,Saint Dog,253.6,0.636,0.328,2006ø
Paper Chase (Feat. Big Hoss),USA,Saint Dog,201.3,0.636,0.328,2006ø
Oompa Loompa,USA,Saint Dog,199.4,0.636,0.328,2006ø
Inside My Head (Feat. Big Hoss),USA,Saint Dog,208.2,0.636,0.328,2006ø
How many (Feat. Judge D),USA,Saint Dog,238.1,0.636,0.328,2006ø
Ha Ha (Feat. Big Hoss and Daddy X),USA,Saint Dog,228.9,0.636,0.328,2006ø
Friends Like You (Feat. Big Hoss),USA,Saint Dog,89.4,0.636,0.328,2006ø
Down 4 Whatever (Feat. Pakelika),USA,Saint Dog,205.1,0.636,0.328,2006ø