Zeppo (LP Version),Road To Bloodshed,Sanctity,252.7,0.621,0.332,2007ø
The Shape Of Things (LP Version),Road To Bloodshed,Sanctity,214.2,0.621,0.332,2007ø
The Rift Between (LP Version),Road To Bloodshed,Sanctity,218.5,0.621,0.332,2007ø
Seconds (Explicit) (LP Version),Road To Bloodshed,Sanctity,218.3,0.621,0.332,2007ø
Road To Bloodshed (LP Version),Road To Bloodshed,Sanctity,209.8,0.621,0.332,2007ø
Once Again (LP Version),Road To Bloodshed,Sanctity,270.5,0.621,0.332,2007ø
Lost To Ego (Album Version),Road To Bloodshed,Sanctity,281.7,0.621,0.332,2007ø
Laws Of Reason (LP Version),Road To Bloodshed,Sanctity,267.0,0.621,0.332,2007ø
Haze of Gray (Album Version),Road To Bloodshed,Sanctity,226.2,0.621,0.332,2007ø
Flatline (LP Version),Road To Bloodshed,Sanctity,206.6,0.621,0.332,2007ø
Brotherhood Of Destruction (LP Version),Road To Bloodshed,Sanctity,261.4,0.621,0.332,2007ø
Billy Seals (LP Version),Road To Bloodshed,Sanctity,209.0,0.621,0.332,2007ø
Beneath The Machine (LP Version),Road To Bloodshed,Sanctity,199.6,0.621,0.332,2007ø
Beloved Killer (LP Version),Road To Bloodshed,Sanctity,199.5,0.621,0.332,2007ø