Uthul Khulture,Draconian Poetry,Sephiroth,258.1,0.526,0.412,2005ø
Therasia,Draconian Poetry,Sephiroth,518.2,0.526,0.412,2004ø
The Clock of Distant Dreams,Draconian Poetry,Sephiroth,385.2,0.526,0.412,2005ø
The Call of the Serpent,Draconian Poetry,Sephiroth,381.7,0.526,0.412,2005ø
Now Night Her Course Began,Draconian Poetry,Sephiroth,543.6,0.526,0.412,2005ø
Dark Garden,Draconian Poetry,Sephiroth,297.5,0.526,0.412,2005ø
A Map of Eden Before the Storms,Draconian Poetry,Sephiroth,536.4,0.526,0.412,2005ø