Show Me Something Special (SM Organ Version),Show Me Something Special,SM-Trax,375.6,0.401,0.327,1998ø
Show Me Something Special,Greatest Hits ... In Motion,SM-Trax,220.1,0.401,0.327,1998ø
Got The Groove 2.8,House Music Lover Vol. 7 (International Edition),SM-Trax,461.7,0.593,0.327,2008ø
Got The Groove (SM In Motion Mix),Got The Groove,SM-Trax,449.7,0.401,0.327,1998ø
Got The Groove (DJ Tomcraft Mix),Got The Groove,SM-Trax,283.0,0.401,0.327,1998ø
Got The Groove (Caba Kroll pres. C.J. Stone Pleasure Mix),Got The Groove,SM-Trax,422.9,0.401,0.327,1998ø
Got The Groove,Greatest Hits ... In Motion,SM-Trax,237.0,0.401,0.327,1999ø
At The Club (Mario Lopez vs. Lightforce Radio Edit),At The Club,SM-Trax,192.2,0.401,0.327,2000ø
At The Club,Greatest Hits ... In Motion,SM-Trax,227.0,0.401,0.327,2000ø
... Is Calling,Greatest Hits ... In Motion,SM-Trax,228.8,0.419,0.327,2000ø