Tripping (Trip Out Dub),Tripping,Smooth Touch,502.8,0.388,0.299,1997ø
Tripping (Get Your Swerve On Loop),Tripping,Smooth Touch,205.5,0.388,0.299,1997ø
Tripping ('More' Nunez Mix),Tripping,Smooth Touch,513.2,0.388,0.299,1997ø
House Of Love (The Raise Your House Mix),House Of Love,Smooth Touch,525.5,0.388,0.299,1993ø
House Of Love (Seduction Mix),House Of Love,Smooth Touch,372.1,0.388,0.299,1993ø
House Of Love (More Acid Beats),House Of Love,Smooth Touch,146.8,0.388,0.299,1993ø
House Of Love (More / Phearce Mix),House Of Love,Smooth Touch,467.2,0.388,0.299,1993ø
House Of Love (Love Mix),House Of Love,Smooth Touch,291.6,0.388,0.299,1993ø
Come And Take A Trip (Erick 'More' Club Mix),Strictly Rhythm - The Lost Tapes: The Tony Humphries Strictly Rhythm Mix Volume 2,Smooth Touch,417.3,0.388,0.299,1994ø