World Peace A.D.?,Revenge of the Mozabites,Suns Of Arqa,132.3,0.512,0.378,2001ø
Unique Seal (Raw Pete Mix),Technomor Remixes Vol. 4,Suns Of Arqa,381.7,0.512,0.378,2002ø
Tomorrow Never Knows,Through the Gate We Go,Suns Of Arqa,208.0,0.512,0.378,2001ø
Return To Hellenes,Hallucinasia,Suns Of Arqa,260.2,0.512,0.378,2005ø
Part III (Featuring Tim Wheater and Kadir Durvesh),Cradle,Suns Of Arqa,503.7,0.512,0.378,1992ø
Open The Door To Your Heart,Land Of A Thousand Churches,Suns Of Arqa,240.1,0.512,0.378,1991ø
Never Know Tomorrow (Gagarin Mix),Aberglaube (Re-mixes Vol. 3),Suns Of Arqa,253.6,0.512,0.378,2001ø
Majhi Ra,Big And Live,Suns Of Arqa,377.3,0.512,0.378,2006ø
Libera Me,A Brief History Of S.O.A.,Suns Of Arqa,145.0,0.512,0.378,1991ø
Kyrie,Seven,Suns Of Arqa,202.4,0.512,0.378,1991ø
Kalilotalove,Seven,Suns Of Arqa,265.4,0.512,0.378,1991ø
Kadir The Whirling Durvesh,Uni-Verse-City,Suns Of Arqa,494.9,0.512,0.378,2001ø
Hey Jagunath,Muslim Guaze: The Suns Of Arqa Mixes,Suns Of Arqa,251.0,0.512,0.378,1999ø
Govinda's Dream,A Brief History Of S.O.A.,Suns Of Arqa,391.3,0.512,0.378,1998ø
Fling Away Your Guns (Nucleus Roots Mix),Big And Live,Suns Of Arqa,271.6,0.512,0.378,2006ø
Erasmus Meets The Earthling,Land Of A Thousand Churches,Suns Of Arqa,348.7,0.512,0.378,1991ø
Cosmic Jugalband (Mixed By DJ Guapo),Hallucinasia,Suns Of Arqa,330.0,0.512,0.378,2005ø
Brujo Magic,Arqaology,Suns Of Arqa,379.4,0.512,0.378,1999ø
Bhairagi Bardo,Uni-Verse-City,Suns Of Arqa,533.1,0.289,0.378,2001ø
Based On Raga Misra Bilawal,Cosmic Jugalbandi,Suns Of Arqa,279.3,0.512,0.378,2000ø
Based On Raga Khammaj,Cosmic Jugalbandi,Suns Of Arqa,578.5,0.512,0.378,2000ø
Based On Raga Bhairavi,Cosmic Jugalbandi,Suns Of Arqa,584.1,0.512,0.378,2000ø
Ageng - Mimansa,Suns Of Arqa meet the Gayan Uttejak Orchestra,Suns Of Arqa,511.9,0.512,0.378,1999ø
Acid Tabla Dub,Revenge of the Mozabites,Suns Of Arqa,185.1,0.512,0.378,2001ø
Acid Tabla,Total Eclipse of the Suns,Suns Of Arqa,455.0,0.512,0.378,1995ø