Zuton Fever,KCRW.com presents The Zutons Live,The Zutons,192.7,0.705,0.488,2003ø
You've Got To Move,Always Right Behind You,The Zutons,172.9,0.705,0.488,2008ø
You've Got A Friend In Me,Tired Of Hanging Around,The Zutons,237.9,0.705,0.488,2006ø
You Will You Won't,KCRW.com presents The Zutons Live,The Zutons,179.8,0.705,0.488,2004ø
You Could Make The 4 Walls Cry,You Can Do Anything,The Zutons,213.0,0.705,0.488,2008ø
Why Won't You Give Me Your Love?,Why Won't You Give Me Your Love?,The Zutons,224.2,0.705,0.488,2006ø
What's Your Problem,You Can Do Anything,The Zutons,236.0,0.705,0.488,2008ø
What's My Heart For?,Why Won't You Give Me Your Love - EP,The Zutons,180.4,0.705,0.488,2006ø
Valerie,Live Lounge 2,The Zutons,231.5,0.705,0.488,2006ø
Tired Of Hanging Around,Tired Of Hanging Around,The Zutons,216.8,0.705,0.488,2006ø
That's The Cost,Always Right Behind You,The Zutons,139.5,0.705,0.488,2008ø
Secrets,Tired Of Hanging Around,The Zutons,196.4,0.705,0.488,2006ø
Rumblin' Ramblin',Creepin' an' a Crawlin,The Zutons,261.3,0.705,0.488,2003ø
Remember Me,Who Killed The Zutons?,The Zutons,200.7,0.705,0.488,2004ø
Railroad,Who Killed The Zutons?,The Zutons,217.6,0.705,0.488,2004ø
Put A Little Aside,You Can Do Anything,The Zutons,242.0,0.705,0.488,2008ø
Pressure Point,KCRW.com presents The Zutons Live,The Zutons,191.0,0.705,0.488,2003ø
Oh Stacey (Look What You've Done!),Tired Of Hanging Around,The Zutons,209.7,0.705,0.488,2006ø
Not A Lot To Do,Who Killed The Zutons?,The Zutons,226.4,0.705,0.488,2004ø
Nightmare Part II,Who Killed The Zutons?,The Zutons,180.8,0.705,0.488,2004ø
Moons And Horror Shows,Who Killed The Zutons?,The Zutons,158.3,0.705,0.488,2004ø
Long Time Coming,Who Killed The Zutons?,The Zutons,140.7,0.705,0.488,2004ø
Little Red Door,You Can Do Anything,The Zutons,206.8,0.705,0.488,2008ø
Let's Work It Out,Always Right Behind You,The Zutons,210.9,0.705,0.488,2008ø
It's The Little Things We Do,Tired Of Hanging Around,The Zutons,187.0,0.705,0.488,2006ø
In The City,Valerie,The Zutons,247.2,0.705,0.488,2006ø
I Know I'll Never Leave,Tired Of Hanging Around,The Zutons,298.6,0.705,0.488,2006ø
Havana Gang Brawl,KCRW.com presents The Zutons Live,The Zutons,226.3,0.705,0.488,2004ø
Harder And Harder,You Can Do Anything,The Zutons,229.0,0.705,0.488,2008ø
Give Me A Reason,You Can Do Anything,The Zutons,392.7,0.705,0.488,2008ø
Freak,You Can Do Anything,The Zutons,261.6,0.705,0.488,2008ø
Family Of Leechs,You Can Do Anything,The Zutons,239.8,0.705,0.488,2008ø
Don't Get Caught,You Can Do Anything,The Zutons,198.3,0.705,0.488,2008ø
Don't Ever Think (Too Much),Who Killed The Zutons?,The Zutons,162.2,0.705,0.488,2004ø
Creepin' An' A Crawlin',Creepin' an' a Crawlin,The Zutons,162.2,0.705,0.488,2003ø
Confusion,Who Killed The Zutons?,The Zutons,211.3,0.705,0.488,2004ø
Bumbag,You Can Do Anything,The Zutons,273.7,0.705,0.488,2008ø
April Fool,Valerie,The Zutons,216.0,0.705,0.488,2006ø
Always Right Behind You,Always Right Behind You,The Zutons,213.4,0.705,0.488,2008ø