The Song That (Actually) Doesn't End - Part 2,Short Controlled Bursts,The Fullblast,444.5,0.57,0.347,2007ø
Stu Ross_ Good Dude; Great Dude,Short Controlled Bursts,The Fullblast,128.1,0.57,0.347,2007ø
Spoons_ Gats_ Prison Tats,Short Controlled Bursts,The Fullblast,284.9,0.57,0.347,2007ø
Sober Pud Would Never Wage A War,Short Controlled Bursts,The Fullblast,188.7,0.57,0.347,2007ø
She Houdini_ Where Did Her Boobs Go?,Short Controlled Bursts,The Fullblast,311.8,0.57,0.347,2007ø
James Eats Planet; Loves PCP,Short Controlled Bursts,The Fullblast,203.2,0.57,0.347,2007ø
Ghettoblaster (Circlewerks V. The Fullblast),Short Controlled Bursts,The Fullblast,128.8,0.57,0.347,2007ø
Fred's Got Slacks,Short Controlled Bursts,The Fullblast,340.7,0.57,0.347,2007ø