Whispering Pines (2000 Digital Remaster),The Band,The Band,238.3,0.655,0.499,1969ø
When You Awake (2000 Digital Remaster),The Band,The Band,193.4,0.655,0.499,1969ø
Up On Cripple Creek (Alternate Take) (2000 Digital Remaster),The Band,The Band,294.6,0.655,0.499,1969ø
To Kingdom Come (2000 Digital Remaster),Music From Big Pink,The Band,202.3,0.655,0.499,1968ø
Time To Kill (2000 Digital Remaster) (Alternate),Stage Fright,The Band,206.4,0.655,0.499,1970ø
Time To Kill (2000 Digital Remaster),Stage Fright,The Band,208.2,0.655,0.499,1970ø
Thinkin' Out Loud (2000 Digital Remaster),Cahoots,The Band,199.3,0.655,0.499,1971ø
The Weight,The Weight,The Band,275.1,0.655,0.499,1968ø
The Shape I'm In,To Kingdom Come (The Definitive Collection),The Band,245.2,0.655,0.499,1970ø
The Promised Land (2001 Digital Remaster),Moondog Matinee,The Band,181.0,0.655,0.499,1973ø
The Night They Drove Old Dixie Down (Alternate Mix) (2000 Digital Remaster),The Band,The Band,256.3,0.655,0.499,1969ø
Tears Of Rage (Alternate Take) (2000 Digital Remaster),Music From Big Pink,The Band,330.3,0.655,0.499,1968ø
Smoke Signal (2000 Digital Remaster),Cahoots,The Band,309.6,0.655,0.499,1971ø
Share Your Love With Me (2001 Digital Remaster),Moondog Matinee,The Band,174.9,0.655,0.499,1973ø
Saved (2001 Digital Remaster),Moondog Matinee,The Band,230.0,0.655,0.499,1973ø
Rockin' Chair (2000 Digital Remaster),The Band,The Band,223.3,0.655,0.499,1969ø
Radio Commercial (Stage Fright) (2000 Digital Remaster),Stage Fright,The Band,66.0,0.655,0.499,1970ø
Orange Juice Blues (Blues For Breakfast)(Outtake Demo) (2000 Digital Remaster),Music From Big Pink,The Band,218.2,0.655,0.499,1968ø
Long Distance Operator (Outtake) (2000 Digital Remaster),Music From Big Pink,The Band,236.5,0.655,0.499,1968ø
Last Train to Memphis,Original Artist Hit List: The Band,The Band,247.6,0.655,0.499,1998ø
Last Of The Blacksmiths (2000 Digital Remaster),Cahoots,The Band,220.6,0.655,0.499,1971ø
King Harvest (Has Surely Come),Collection,The Band,182.8,0.655,0.499,1969ø
Key To The Highway (Outtake) (2000 Digital Remaster),Music From Big Pink,The Band,147.3,0.655,0.499,1968ø
Kentucky Downpour,Original Artist Hit List: The Band,The Band,270.0,0.655,0.499,1998ø
Jawbone (2000 Digital Remaster),The Band,The Band,260.7,0.655,0.499,1969ø
It Makes No Difference (2001 Digital Remaster),Greatest Hits,The Band,392.8,0.655,0.499,2000ø
If I Should Fail,Original Artist Hit List: The Band,The Band,237.7,0.655,0.499,1998ø
If I Lose (Outtake) (2000 Digital Remaster),Music From Big Pink,The Band,148.6,0.655,0.499,1968ø
High Cotton,Original Artist Hit List: The Band,The Band,205.0,0.655,0.499,1998ø
Going Back To Memphis (Outtake) (2001 Digital Remaster),Moondog Matinee,The Band,302.1,0.655,0.499,1973ø
Georgia On My Mind (2001 Digital Remaster),Islands,The Band,189.8,0.655,0.499,1977ø
Georgia On My Mind,Collection,The Band,186.6,0.655,0.499,1977ø
Endless Highway (2000 Digital Remaster),Cahoots,The Band,224.8,0.655,0.499,1971ø
Don't Do It (2000 Digital Remaster),Cahoots,The Band,232.6,0.655,0.499,1971ø
Caledonia Mission (2000 Digital Remaster),Music From Big Pink,The Band,178.5,0.655,0.499,1968ø
Book Faded Brown,Original Artist Hit List: The Band,The Band,252.9,0.655,0.499,1998ø
All La Glory (2000 Digital Remaster),Stage Fright,The Band,215.2,0.655,0.499,1970ø
A Change Is Gonna Come (2001 Digital Remaster),Moondog Matinee,The Band,259.3,0.655,0.499,1973ø
4% Pantomime (2000 Digital Remaster),Cahoots,The Band,272.3,0.655,0.499,1971ø