Tragic Boy (Album Version),Pot Boiler,The Verlaines,254.6,0.51,0.418,2007ø
Sunday In Sevastopol (Album Version),Pot Boiler,The Verlaines,311.4,0.51,0.418,2007ø
Stop Messing Around (Album Version),Pot Boiler,The Verlaines,177.6,0.51,0.418,2007ø
Real Good Life (Album Version),Pot Boiler,The Verlaines,240.0,0.51,0.418,2007ø
Midlife Crisis (Album Version),Pot Boiler,The Verlaines,199.0,0.51,0.418,2007ø
It's Easier To Harden A Broken Heart (Than Mend It) (Album Version),Pot Boiler,The Verlaines,296.0,0.51,0.418,2007ø
If You Can't Beat Them (Album Version),Pot Boiler,The Verlaines,249.7,0.51,0.418,2007ø
Forgive Thine Enemies (But Don't Forget Their Names) (Album Version),Pot Boiler,The Verlaines,183.0,0.51,0.418,2007ø
Don't Leave (Album Version),Pot Boiler,The Verlaines,196.1,0.51,0.418,2007ø
All Messed Up (Album Version),Pot Boiler,The Verlaines,209.4,0.51,0.418,2007ø
16 Years (Album Version),Pot Boiler,The Verlaines,181.2,0.51,0.418,2007ø