Whoo! Alright - Yeah...Uh Huh.,Pieces Of The People We Love,The Rapture,228.7,0.75,0.517,2006ø
The Sound,Go Commando with JDH and Dave P,The Rapture,249.1,0.75,0.517,2006ø
The Coming Of Spring,Echoes,The Rapture,164.3,0.75,0.517,2003ø
Sister Saviour,Love Is All / I Need Your Love,The Rapture,225.3,0.75,0.517,2003ø
Pieces Of The People We Love,Pieces Of The People We Love,The Rapture,223.5,0.75,0.517,2006ø
Open Up Your Heart,NY-LON,The Rapture,323.5,0.75,0.517,2003ø
Olio,Echoes,The Rapture,321.4,0.75,0.517,1999ø
Love Is All,Echoes,The Rapture,255.3,0.75,0.517,2003ø
Live In Sunshine,Pieces Of The People We Love,The Rapture,239.9,0.75,0.517,2006ø
Killing,Echoes,The Rapture,218.2,0.75,0.517,2003ø
Infatuation,Echoes,The Rapture,301.8,0.75,0.517,2003ø
I Need Your Love,Echoes,The Rapture,279.6,0.75,0.517,2003ø
House Of Jealous Lovers,House Of Jealous Lovers,The Rapture,387.1,0.75,0.517,2000ø
Get Myself Into It,Get Myself Into It,The Rapture,373.2,0.75,0.517,2006ø
First Gear,Pieces Of The People We Love,The Rapture,380.0,0.75,0.517,2006ø
Down For So Long,Pieces Of The People We Love,The Rapture,224.3,0.75,0.517,2006ø
Don Gon Do It,Pieces Of The People We Love,The Rapture,275.3,0.75,0.517,2006ø
Alabama Sunshine,House Of Jealous Lovers,The Rapture,166.3,0.75,0.517,2003ø