Zzzzz (Album Version),Whisper War,The Cab,218.7,0.747,0.583,2008ø
Vegas Skies (Album Version),Whisper War,The Cab,277.5,0.747,0.583,2008ø
This City Is Contagious (Album Version),Whisper War,The Cab,216.6,0.747,0.583,2008ø
That '70s Song (Album Version),Whisper War,The Cab,213.4,0.747,0.583,2008ø
Risky Business (Album Version),Whisper War,The Cab,215.3,0.747,0.583,2008ø
One Of THOSE Nights (Album Version),Whisper War,The Cab,228.8,0.747,0.583,2008ø
I'm A Wonder (Album Version),Whisper War,The Cab,213.0,0.747,0.583,2008ø
I'll Run (Album Version),Whisper War,The Cab,226.1,0.747,0.583,2008ø
High Hopes In Velvet (Album Version),Whisper War,The Cab,202.3,0.747,0.583,2008ø
Can You Keep A Secret? (Album Version),Whisper War,The Cab,230.7,0.747,0.583,2008ø
Bounce (Album Version),Whisper War,The Cab,214.8,0.747,0.583,2008ø
Blue Garden,Chill House Sensation Vol. 02 (60 Fantastic Summer Tunes),The Cab,279.9,0.747,0.583,2008ø