Same Sex Killers,Tyrades,Tyrades,164.2,0.366,0.258,2003ø
Plastic Bag Baby,Tyrades,Tyrades,109.8,0.366,0.258,2003ø
Money Boy_ Money Girl,Tyrades,Tyrades,139.5,0.366,0.258,2003ø
Message From the Operator,Tyrades,Tyrades,123.0,0.366,0.258,2003ø
Let Down,Tyrades,Tyrades,116.7,0.366,0.258,2003ø
I Hate Your Wave,Tyrades,Tyrades,169.6,0.366,0.258,2003ø
Dance Like a Maniac,Tyrades,Tyrades,158.2,0.366,0.258,2003ø
Cut Your Feet Off,Tyrades,Tyrades,146.2,0.366,0.258,2003ø
Couples,Tyrades,Tyrades,221.2,0.366,0.258,2003ø