You're Not Invincible,You're Not Invincible,White Belt Yellow Tag,212.8,0.56,0.332,2010ø
Where Echoes Land...,Methods,White Belt Yellow Tag,250.8,0.56,0.332,2010ø
We All Have Sound,Methods,White Belt Yellow Tag,250.6,0.56,0.332,2010ø
Tell Your Friends (It All Worked Out),Tell Your Friends (It All Worked Out),White Belt Yellow Tag,172.1,0.56,0.332,2010ø
So Try My Enemies,Methods,White Belt Yellow Tag,180.6,0.56,0.332,2010ø
Same Clothes_ Same Life,Methods,White Belt Yellow Tag,234.5,0.56,0.332,2010ø
Of a...,Methods,White Belt Yellow Tag,117.0,0.56,0.332,2010ø
Ode,Methods,White Belt Yellow Tag,247.8,0.56,0.332,2010ø
News,Methods,White Belt Yellow Tag,165.9,0.56,0.332,2010ø
It's A Long Way_ Don't You Fall Behind,Methods,White Belt Yellow Tag,228.1,0.56,0.332,2010ø
Careless Talk And Sinking Ships,Methods,White Belt Yellow Tag,154.9,0.56,0.332,2010ø