Von Hier An Blind,Von Hier An Blind,Wir Sind Helden,210.7,0.698,0.488,2005ø
Stiller,Soundso + Track-by-Track Kommentare,Wir Sind Helden,260.5,0.698,0.488,2007ø
Soundso,Soundso,Wir Sind Helden,253.0,0.698,0.488,2007ø
Popstar,Endlich Ein Grund Zur Panik,Wir Sind Helden,221.0,0.698,0.488,2007ø
Nur Ein Wort (Demo 2004),Nur Ein Wort,Wir Sind Helden,195.6,0.698,0.488,2005ø
Nur Ein Wort (Berlin-Town) (P.R. Kantate & Meine Band Version),Kaputt,Wir Sind Helden,262.0,0.698,0.488,2007ø
Monster,Die Reklamation,Wir Sind Helden,228.9,0.698,0.488,2003ø
Lass Uns Verschwinden (FM4 Akustik Version),Soundso,Wir Sind Helden,267.2,0.698,0.488,2007ø
Keine Angst Mehr,Gekommen Um Zu Bleiben,Wir Sind Helden,172.9,0.698,0.488,2005ø
Heldenzeit,Die Reklamation,Wir Sind Helden,264.0,0.698,0.488,2003ø
Gekommen Um Zu Bleiben (Demo),Gekommen Um Zu Bleiben,Wir Sind Helden,165.7,0.698,0.488,2005ø
Gekommen Um Zu Bleiben,Gekommen Um Zu Bleiben,Wir Sind Helden,191.1,0.698,0.488,2005ø
Geht Auseinander,Von Hier An Blind,Wir Sind Helden,190.4,0.698,0.488,2005ø
Friede_ Freude_ Lagerfeuer,Von Hier An Blind,Wir Sind Helden,188.3,0.698,0.488,2005ø
Endlich Ein Grund Zur Panik Remix (Tim Tim),Endlich Ein Grund Zur Panik,Wir Sind Helden,300.3,0.698,0.488,2007ø
Endlich Ein Grund Zur Panik (FM4 Akustik Version),Soundso,Wir Sind Helden,228.4,0.698,0.488,2007ø
Echolot,Von Hier An Blind,Wir Sind Helden,271.4,0.698,0.488,2005ø
Die Wallerts - Baumhaus,Die Konkurrenz,Wir Sind Helden,118.2,0.698,0.488,2008ø
Die Nacht,Die Reklamation,Wir Sind Helden,258.8,0.698,0.488,2003ø
Die Konkurrenz (FM4 Akustik Version),Soundso,Wir Sind Helden,223.3,0.698,0.488,2007ø
Denkmal,Die Reklamation,Wir Sind Helden,195.8,0.698,0.488,2002ø
Darf Ich Das Behalten,Von Hier An Blind,Wir Sind Helden,198.5,0.698,0.488,2005ø
Bist Du nicht Bela? (Wir Sind Helden Feat. Bela B.),Kaputt,Wir Sind Helden,229.4,0.698,0.488,2007ø
Ausser Dir (Live 05),Wenn Es Passiert,Wir Sind Helden,234.4,0.698,0.488,2006ø
Ausser Dir,Die Reklamation,Wir Sind Helden,221.9,0.698,0.488,2003ø
Wenn Es Passiert (Album Version),Wenn Es Passiert,Wir Sind Helden,213.6,0.698,0.474,2006ø
Vorschlaghammer (Nur Ein Wort-Kapaikos-Version),Kaputt,Wir Sind Helden,201.1,0.698,0.474,2007ø
Nur Ein Wort (Demo 2001),Nur Ein Wort,Wir Sind Helden,189.6,0.698,0.474,2005ø
Ist Das So?,Die Reklamation,Wir Sind Helden,184.4,0.698,0.474,2003ø
In Mir Drin,Von Hier An Blind,Wir Sind Helden,182.7,0.698,0.474,2005ø
Halt Dich An Deiner Liebe Fest (Live Berlin Columbiahalle 2003),Nur Ein Wort,Wir Sind Helden,257.3,0.698,0.474,2005ø
Gekommen Um Zu Bleiben (Moonbootica Remix),Nur Ein Wort,Wir Sind Helden,345.9,0.698,0.474,2005ø
Endlich Ein Grund Zur Panik,Soundso + Track-by-Track Kommentare,Wir Sind Helden,222.9,0.698,0.474,2007ø
Die Zeit Heilt Alle Wunden,Die Reklamation,Wir Sind Helden,249.9,0.698,0.474,2003ø
(Ode) An Die Arbeit,Soundso,Wir Sind Helden,222.1,0.698,0.474,2007ø