You Got The Jump On Me (2006 Digital Remaster),Wizzard Brew,Wizzard,388.0,0.613,0.451,1973ø
The Carlsberg Special (2006 Digital Remaster),Wizzard Brew,Wizzard,254.5,0.613,0.451,1973ø
See My Baby Jive,Original Hits - Seventies,Wizzard,297.3,0.613,0.451,1972ø
Rob Roy's Nightmare (A Bit More H.A.) (2006 Digital Remaster),Wizzard Brew,Wizzard,227.1,0.613,0.451,1973ø
Meet Me At The Jailhouse (US Insert) (2006 Digital Remaster),Wizzard Brew,Wizzard,46.8,0.613,0.451,1973ø
I Wish It Could Be Christmas Everyday (2006 Digital Remaster),Wizzard Brew,Wizzard,287.9,0.613,0.451,1973ø
I Wish It Could Be Christmas Everyday,I Wish It Could Be Christmas Everyday,Wizzard,278.5,0.613,0.451,1992ø
Buffalo Station - Get On Down To Memphis (2006 Digital Remaster),Wizzard Brew,Wizzard,457.0,0.613,0.451,1973ø
Bend Over Beethoven (2006 Digital Remaster),Wizzard Brew,Wizzard,280.7,0.613,0.451,1973ø
Ball Park Incident,Top Of The Pops - Seventies,Wizzard,218.0,0.613,0.451,1977ø
Angel Fingers (A Teen Ballad) (2006 Digital Remaster),Wizzard Brew,Wizzard,277.7,0.613,0.451,1973ø