We Should Never Be Lonely My Love,The Complete Motown Singles Vol. 10: 1970,Yvonne Fair,169.4,0.456,0.415,2008ø
Stay A Little Longer,The Complete Motown Singles Vol. 10: 1970,Yvonne Fair,161.7,0.456,0.415,2008ø
Say Yeah Yeah,James Brown's Original Funky Divas,Yvonne Fair,146.8,0.456,0.415,2006ø
It Should Have Been Me,Party Triple Set,Yvonne Fair,204.5,0.456,0.415,1988ø
If I Knew,James Brown's Original Funky Divas,Yvonne Fair,146.9,0.456,0.415,1962ø
I Can't Let Him Go,A Cellarful Of Motown Volume 3,Yvonne Fair,171.0,0.456,0.415,2007ø